,NAME,STORE,ORIGINAL PRICE,SALE PRICE
0,"Funko Disney Kingdom Hearts 3 Pop! Sora Vinyl Figure, ",Hot Topic,12.50,9.00
1,"Funko Disney Kingdom Hearts 3 Pop! Soldier Heartless Vinyl Figure, ",Hot Topic,12.50,9.00
2,"Funko Disney Kingdom Hearts 3 Pop! Riku Vinyl Figure, ",Hot Topic,12.50,9.00
3,"Funko Marvel Spider-Man: Into The Spider-Verse Pop! Spider-Gwen Vinyl Bobble-Head, ",Hot Topic,12.50,9.00
4,"Funko Ralph Breaks The Internet Pop! Wreck-It Ralph Cherry Pie Vinyl Figure Hot Topic Exclusive, ",Hot Topic,12.50,
5,"Funko Disney Diamond Collection Mulan Pop! Mulan Vinyl Figure Hot Topic Exclusive, ",Hot Topic,14.50,
6,"Funko Marvel Spider-Man Pop! Games Spider-Man Vinyl Bobble-Head, ",Hot Topic,12.50,9.00
7,"Funko Child's Play 2 Pop! Movies Chucky On Cart Vinyl Figure Hot Topic Exclusive, ",Hot Topic,12.50,
8,"Funko Marvel Spider-Man: Into The Spider-Verse Pocket Pop! Miles Morales Bobble-Head Key Chain, ",Hot Topic,7.90,6.32
9,"Funko Marvel Spider-Man: Into The Spider-Verse Pocket Pop! Peter Parker Bobble-Head Key Chain, ",Hot Topic,7.90,6.32
10,"Funko Super Racers Five Nights At Freddy's Foxy The Pirate Racer Figure, ",Hot Topic,6.90,5.52
11,"Funko Super Racers Five Nights At Freddy's Freddy Racer Figure, ",Hot Topic,6.90,5.52
12,"Funko Super Racers Five Nights At Freddy's Ennard Racer Figure, ",Hot Topic,6.90,5.52
13,"Funko Super Racers Five Nights At Freddy's Cupcake Racer Figure, ",Hot Topic,6.90,5.52
14,"Funko Super Racers Five Nights At Freddy's Lolbit Racer Figure, ",Hot Topic,6.90,5.52
15,"Funko Super Racers Five Nights At Freddy's Chica Racer Figure, ",Hot Topic,6.90,5.52
16,"Funko Super Racers Five Nights At Freddy's Fredbear Racer Figure, ",Hot Topic,6.90,5.52
17,"Funko Super Racers Five Nights At Freddy's Marionette Racer Figure, ",Hot Topic,6.90,5.52
18,"Funko The Grinch Pop! Movies Max The Dog Vinyl Figure, ",Hot Topic,12.50,9.00
19,"Funko Cuphead Pop! Games Evil Cuphead Vinyl Figure Hot Topic Exclusive, ",Hot Topic,12.50,
20,"Funko The Grinch Pop! Movies The Grinch Vinyl Figure, ",Hot Topic,12.50,9.00
21,"Funko The Grinch Cindy-Lou Who Pop! Movies Vinyl Figure, ",Hot Topic,12.50,9.00
22,"Funko The Grinch Pop! Movies The Young Grinch Vinyl Figure, ",Hot Topic,12.50,9.00
23,"Funko Cowboy Bebop 20th Pop! Animation Ed And Ein Vinyl Figures, ",Hot Topic,12.50,9.00
24,"Funko Cowboy Bebop 20th Pop! Animation Vicious Vinyl Figure, ",Hot Topic,12.50,9.00
25,"Funko Marvel Spider-Man: Into The Spider-Verse Pop! Miles Morales (In Suit) Vinyl Bobble-Head, ",Hot Topic,12.50,9.00
26,"Funko Doctor Who Pop! Television TARDIS (Clara's Memorial) 6 Inch Vinyl Figure, ",Hot Topic,18.50,14.80
27,"Funko Marvel Spider-Man: Into The Spider-Verse Pop! Peter Parker (In Suit) Vinyl Bobble-Head, ",Hot Topic,12.50,9.00
28,"Funko Marvel Spider-Man: Into The Spider-Verse Pop! Miles Morales Vinyl Bobble-Head, ",Hot Topic,12.50,9.00
29,"Funko Marvel Spider-Man: Into The Spider-Verse Pop! Green Goblin Vinyl Bobble-Head, ",Hot Topic,12.50,9.00
30,"Funko Disney Kingdom Hearts Pocket Pop! Shadow Heartless Vinyl Key Chain, ",Hot Topic,7.90,6.32
31,"Funko Destiny Pocket Pop! Destiny Ghost Blind Bag Key Chain, ",Hot Topic,7.90,6.32
32,"Funko Star Wars Vynl. Jabba The Hut & Salacious Crumb Vinyl Bobble-Heads, ",Hot Topic,18.90,15.12
33,"Funko Die Hard Pop! Movies Al Powell Vinyl Figure, ",Hot Topic,12.50,9.00
34,"Funko Married With Children Pop! Television Peggy Bundy Vinyl Figure, ",Hot Topic,12.50,9.00
35,"Funko Mariah Carey Pop! Rocks Holiday Mariah Carey Vinyl Figure, ",Hot Topic,12.50,9.00
36,"Funko Cuphead Pop! Games Aeroplane Cuphead Vinyl Figure, ",Hot Topic,12.50,9.00
37,"Funko Cuphead Pop! Games Cala Maria Vinyl Figure, ",Hot Topic,12.50,9.00
38,"Funko Doctor Who Pop! Television Missy Vinyl Figure, ",Hot Topic,12.50,9.00
39,"Funko Die Hard Pop! Movies Tony Vreski Vinyl Figure, ",Hot Topic,12.50,9.00
40,"Funko Cuphead Pop! Games Sally Stageplay Vinyl Figure, ",Hot Topic,12.50,9.00
41,"Funko Star Wars Pop! Yoda (Holiday) Vinyl Figure, ",Hot Topic,12.50,9.00
42,"Funko Marvel Pop! Spider-Man Holiday Sweater Vinyl Figure, ",Hot Topic,12.50,9.00
43,"Funko Marvel Deadpool Pop! Holiday Deadpool Vinyl Figure, ",Hot Topic,12.50,9.00
44,"Funko Marvel Pop! Groot Holiday Lights Vinyl Figure, ",Hot Topic,12.50,9.00
45,"Funko Marvel Pop! Hulk (Holiday) Vinyl Bobble-Head, ",Hot Topic,12.50,9.00
46,"Funko Tokyo Ghoul Pop! Animation Eto Vinyl Figure 2018 Fall Convention Exclusive, ",Hot Topic,15.00,
47,"Funko DC Comics Pop! Heroes Wonder Woman Vinyl Figure 2018 Fall Convention Exclusive, ",Hot Topic,15.00,
48,"Funko DC Comics Aquaman Pop! Heroes Arthur Curry Vinyl Figure 2018 Fall Convention Exclusive, ",Hot Topic,15.00,
49,"Funko The Brady Bunch Pop! Television Cindy Brady Vinyl Figure, ",Hot Topic,12.50,9.00
50,"Funko The Brady Bunch Pop! Television Marcia Brady Vinyl Figure, ",Hot Topic,12.50,9.00
51,"Funko The Brady Bunch Pop! Television Alice Nelson Vinyl Figure, ",Hot Topic,12.50,9.00
52,"Funko Blade Runner 2049 Dorbz Deckard Vinyl Figure, ",Hot Topic,9.50,6.00
53,"Funko Birdhouse Skateboards Pop! Sports Tony Hawk Vinyl Figure, ",Hot Topic,12.50,9.00
54,"Funko Blade Runner 2049 Dorbz Sapper Vinyl Figure, ",Hot Topic,9.50,6.00
55,"Funko DC Super Heroes Pop! Heroes Superman From Flashpoint Vinyl Figure Hot Topic Exclusive, ",Hot Topic,12.50,
56,"Funko Blade Runner 2049 Dorbz Wallace Vinyl Figure, ",Hot Topic,9.50,6.00
57,"Funko Blade Runner 2049 Dorbz Officer K Vinyl Figure, ",Hot Topic,9.50,6.00
58,"Funko Child's Play 2 Pocket Pop! Chucky Key Chain Hot Topic Exclusive, ",Hot Topic,7.90,6.32
59,"Funko Overwatch Pop! Games Roadhog (Junkenstein's Monster) 6 Inch Vinyl Figure Hot Topic Exclusive, ",Hot Topic,26.90,
60,"Funko Marvel Avengers: Infinity War Vynl. Thanos & Iron Spider Vinyl Figures, ",Hot Topic,18.90,15.12
61,"Funko DC Comics Aquaman Pop! Mera Vinyl Figure, ",Hot Topic,12.50,9.00
62,"Funko DC Comics Aquaman Pop! Orm Vinyl Figure, ",Hot Topic,12.50,9.00
63,"Funko Aquaman Pocket Pop! Aquaman Classic Suit Vinyl Key Chain, ",Hot Topic,7.90,6.32
64,"Funko DC Comics Aquaman Pop! Black Manta Vinyl Figure, ",Hot Topic,12.50,9.00
65,"Funko Ralph Breaks The Internet Pop! Yesss Vinyl Figure, ",Hot Topic,12.50,9.00
66,"Funko DC Comics Aquaman Pop! Arthur Curry (Gladiator) Vinyl Figure, ",Hot Topic,12.50,9.00
67,"Funko Ralph Breaks The Internet Wreck-It Ralph Pop! Key Chain, ",Hot Topic,7.90,6.32
68,"Funko DC Comics Aquaman Mystery Minis Blind Box Vinyl Figure, ",Hot Topic,7.90,6.32
69,"Funko Aquaman Pocket Pop! Black Manta Key Chain, ",Hot Topic,7.90,6.32
70,"Funko Fortnite Pop! Games Raptor Vinyl Figure, ",Hot Topic,12.50,10.00
71,"Funko Fortnite Pop! Games Highrise Assault Trooper Vinyl Figure, ",Hot Topic,12.50,10.00
72,"Funko Fortnite Pop! Games Merry Marauder Vinyl Figure, ",Hot Topic,12.50,10.00
73,"Funko Fortnite Pop! Games Moonwalker Vinyl Figure, ",Hot Topic,12.50,10.00
74,"Funko Fortnite Pop! Games Tower Recon Specialist Vinyl Figure, ",Hot Topic,12.50,10.00
75,"Funko Fortnite Pop! Games Love Ranger Vinyl Figure, ",Hot Topic,12.50,10.00
76,"Funko Fortnite Pop! Games Cuddle Team Leader Vinyl Figure, ",Hot Topic,12.50,10.00
77,"Funko Fortnite Pop! Games Brite Bomber Vinyl Figure, ",Hot Topic,12.50,10.00
78,"Funko Fortnite Pop! Games Black Knight Vinyl Figure, ",Hot Topic,12.50,10.00
79,"Funko Fortnite Pop! Games Skull Trooper Vinyl Figure, ",Hot Topic,12.50,10.00
80,"Funko Fortnite Pop! Games Omega Vinyl Figure, ",Hot Topic,12.50,10.00
81,"Funko Marvel Runaways Pop! Gert Yorkes Vinyl Bobble-Head, ",Hot Topic,12.50,9.00
82,"Funko Cuphead King Dice Collectible Plush, ",Hot Topic,14.90,11.92
83,"Funko Disney Diamond Collection Big Hero 6 Pop! Baymax 6 Inch Vinyl Figure Hot Topic Exclusive, ",Hot Topic,24.50,
84,"Funko NFL Cowboys Pop! Football Deion Sanders Vinyl Figure, ",Hot Topic,12.50,9.00
85,"Funko Five Nights At Freddy's Pocket Pop! Orville Elephant Key Chain, ",Hot Topic,7.90,6.32
86,"Funko The Nightmare Before Christmas Vynl. The Mayor & Barrel Vinyl Figures, ",Hot Topic,18.90,15.12
87,"Funko The Nightmare Before Christmas Vynl. Lock & Shock Vinyl Figures, ",Hot Topic,18.90,15.12
88,"Funko NFL Chargers Pop! Football Junior Seau Vinyl Figure, ",Hot Topic,12.50,9.00
89,"Funko NFL Patriots Pop! Football Drew Bledsoe Vinyl Figure, ",Hot Topic,12.50,9.00
90,"Funko VYNL. Harry Potter Dobby & Harry Vinyl Figures, ",Hot Topic,18.90,15.12
91,"Funko NFL Cowboys Pop! Football Troy Aikman Vinyl Figure, ",Hot Topic,12.50,9.00
92,"Funko NFL Steelers Pop! Football Jerome Bettis Vinyl Figure, ",Hot Topic,12.50,9.00
93,"Funko NFL Bears Pop! Football Walter Payton Vinyl Figure, ",Hot Topic,12.50,9.00
94,"Funko NFL Packers Pop! Football Brett Favre Vinyl Figure, ",Hot Topic,12.50,9.00
95,"Funko NFL Packers Pop! Football Bart Starr Vinyl Figure, ",Hot Topic,12.50,9.00
96,"Funko NFL Seahawks Pop! Football Brian Bosworth Vinyl Figure, ",Hot Topic,12.50,9.00
97,"Funko NFL Steelers Pop! Football Terry Bradshaw Vinyl Figure, ",Hot Topic,12.50,9.00
98,"Funko The Nightmare Before Christmas Vynl. Oogie Boogie & Behemoth Vinyl Figures, ",Hot Topic,18.90,15.12
99,"Funko SpongeBob SquarePants Pop! Animation SpongeBob Holiday Pop! Vinyl Figure, ",Hot Topic,12.50,9.00
100,"Funko DC The Flash Pop! Television The Flash Vinyl Figure, ",Hot Topic,12.50,9.00
101,"Funko SpongeBob SquarePants Pop! Animation Patrick Star (Holiday) Vinyl Figure, ",Hot Topic,12.50,9.00
102,"Funko Horror Mystery Box Hot Topic Exclusive, ",Hot Topic,32.90,26.32
103,"Funko Fantastic Beasts: The Crimes Of Grindelwald SuperCute Plushies Black & White Baby Niffler Collectible Plush, ",Hot Topic,12.90,10.32
104,"Funko Fantastic Beasts: The Crimes Of Grindelwald SuperCute Plushies Bowtruckle Collectible Plush, ",Hot Topic,12.90,10.32
105,"Funko Fantastic Beasts: The Crimes Of Grindelwald Pop! Chupacabra Vinyl Figure Hot Topic Exclusive, ",Hot Topic,12.50,
106,"Funko Kubo And The Two Strings Pop! Movies Kubo Vinyl Figure, ",Hot Topic,12.50,9.00
107,"Funko Bendy And The Ink Machine Pop! Games The Projectionist Vinyl Figure, ",Hot Topic,12.50,9.00
108,"Funko Bendy And The Ink Machine Pop! Games Striker Vinyl Figure, ",Hot Topic,12.50,9.00
109,"Funko Fantastic Beasts: The Crimes Of Grindelwald SuperCute Plushies Niffler Collectible Plush, ",Hot Topic,12.90,10.32
110,"Funko Bendy And The Ink Machine Pop! Games Piper Vinyl Figure, ",Hot Topic,12.50,9.00
111,"Funko Bendy And The Ink Machine Pop! Games Fisher Vinyl Figure, ",Hot Topic,12.50,9.00
112,"Funko Marvel Studios: The First Ten Years Pop! Gold Chrome Hulk Bobble-Head, ",Hot Topic,14.50,11.60
113,"Funko Marvel Studios The First Ten Years Pop! Gold Chrome Black Widow Bobble-Head, ",Hot Topic,14.50,11.60
114,"Funko Disney Sleeping Beauty Pocket Pop! Maleficent Glow-In-The-Dark Key Chain Hot Topic Exclusive, ",Hot Topic,7.90,6.32
115,"Funko Fantastic Beasts: The Crimes Of Grindelwald Pickett Pop! Key Chain, ",Hot Topic,7.90,6.32
116,"Funko Fantastic Beasts: The Crimes Of Grindelwald Thestral Pop! Key Chain, ",Hot Topic,7.90,6.32
117,"Funko Marvel Runaways Pop! Alex Wilder Vinyl Bobble-Head, ",Hot Topic,12.50,
118,"Funko Kubo And The Two Strings Pop! Movies Kubo & Little Hanzo Vinyl Figure, ",Hot Topic,12.50,9.00
119,"Funko Marvel Runaways Pop! Chase Stein Vinyl Bobble-Head, ",Hot Topic,12.50,
120,"Funko Marvel Studios The First Ten Years Pop! Red Skull Vs. Captain America Movie Moments Vinyl Collectibles, ",Hot Topic,36.50,29.20
121,"Funko Kubo And The Two Strings Pop! Movies Monkey Vinyl Figure, ",Hot Topic,12.50,9.00
122,"Funko Fantastic Beasts: The Crimes Of Grindelwald Pop! Albus Dumbledore Vinyl Figure, ",Hot Topic,12.50,9.00
123,"Funko The Nightmare Before Christmas Pop! Vampire Teddy With Duck Vinyl Figure, ",Hot Topic,12.50,9.00
124,"Funko The Nightmare Before Christmas Pop! Clown Vinyl Figure, ",Hot Topic,12.50,9.00
125,"Funko Marvel Black Panther Pop! T'Challa (Black Robe) Vinyl Bobble-Head, ",Hot Topic,12.50,9.00
126,"Funko Marvel Runaways Pop! Karolina Dean Vinyl Bobble-Head, ",Hot Topic,12.50,9.00
127,"Funko Smallfoot Pop! Movies Stonekeeper Vinyl Figure, ",Hot Topic,12.50,
128,"Funko Rick And Morty Scary Terry Action Figure, ",Hot Topic,16.50,13.20
129,"Funko Marvel Runaways Pop! Molly Hernandez Vinyl Bobble-Head, ",Hot Topic,12.50,9.00
130,"Funko Rick And Morty Squanchy Action Figure, ",Hot Topic,16.50,13.20
131,"Funko The Nightmare Before Christmas Pop! Sally Vinyl Figure, ",Hot Topic,12.50,9.00
132,"Funko Spyro Pop! Games Spyro & Sparx Vinyl Figure, ",Hot Topic,12.50,9.00
133,"Funko Overwatch Pop! Games Torbjorn Vinyl Figure, ",Hot Topic,12.50,
134,"Funko Rick And Morty Purge Suit Morty Action Figure, ",Hot Topic,16.50,13.20
135,"Funko Rick And Morty Summer Action Figure, ",Hot Topic,16.50,13.20
136,"Funko Rick And Morty Purge Suit Rick Action Figure, ",Hot Topic,16.50,13.20
137,"Funko Overwatch Pocket Pop! Sombra Key Chain, ",Hot Topic,7.90,6.32
138,"Funko Overwatch Pocket Pop! Soldier: 76 Key Chain, ",Hot Topic,7.90,6.32
139,"Funko Overwatch Pocket Pop! Pharah Key Chain, ",Hot Topic,7.90,6.32
140,"Funko Overwatch Pocket Pop! Lucio Key Chain, ",Hot Topic,7.90,6.32
141,"Funko Overwatch Pocket Pop! D.Va Key Chain, ",Hot Topic,7.90,6.32
142,"Funko Five Nights At Freddy's Pocket Pop! Helpy Key Chain, ",Hot Topic,7.90,6.32
143,"Funko Five Nights At Freddy's Pocket Pop! Pigpatch Key Chain, ",Hot Topic,7.90,6.32
144,"Funko Five Nights At Freddy's Pocket Pop! Rockstar Freddy Key Chain, ",Hot Topic,7.90,6.32
145,"Funko Five Nights At Freddy's Pocket Pop! Rockstar Foxy Key Chain, ",Hot Topic,7.90,6.32
146,"Funko Small Foot Pop! Movies Percy Vinyl Figure, ",Hot Topic,12.50,
147,"Funko Small Foot Pop! Movies Fleem Vinyl Figure, ",Hot Topic,12.50,
148,"Funko Smallfoot Pop! Movies Migo Vinyl Figure, ",Hot Topic,12.50,9.00
149,"Funko Marvel Black Panther Pop! Erik Killmonger Vinyl Bobble-Head, ",Hot Topic,12.50,9.00
150,"Funko Harry Potter Vynl. Lord Voldemort & Bellatrix Lestrange Vinyl Figures, ",Hot Topic,18.90,15.12
151,"Funko Marvel Black Panther Pop! Ulysses Klaue Vinyl Bobble-Head, ",Hot Topic,12.50,9.00
152,"Funko Betty Boop Pop! Betty Boop & Pudgy Vinyl Figure, ",Hot Topic,12.50,9.00
153,"Funko Marvel Studios: The First Ten Years Pop! Gold Chrome Loki Bobble-Head, ",Hot Topic,14.50,11.60
154,"Funko Blink-182 Pop! Rocks Mark Hoppus Vinyl Figure, ",Hot Topic,12.50,9.00
155,"Funko Digimon Pop! Animation Matt Vinyl Figure, ",Hot Topic,12.50,9.00
156,"Funko Digimon Pop! Animation Gabumon Vinyl Figure, ",Hot Topic,12.50,9.00
157,"Funko Blink-182 Pop! Rocks Travis Barker Vinyl Figure, ",Hot Topic,12.50,9.00
159,"Funko Digimon Pop! Animation Tai Vinyl Figure, ",Hot Topic,12.50,9.00
160,"Funko Little Shop Of Horrors SuperCute Plushies Audrey II Plush Collectible Hot Topic Exclusive, ",Hot Topic,36.90,29.52
161,"Funko Saturday Night Live Pop! SNL Spartan Cheerleaders Vinyl Figure Set, ",Hot Topic,22.50,18.00
162,"Funko Saturday Night Live Pop! SNL Roseanne Roseannadanna Vinyl Figure, ",Hot Topic,12.50,9.00
163,"Funko Saturday Night Live Pop! SNL Drunk Uncle Vinyl Figure, ",Hot Topic,12.50,9.00
164,"Funko Little Shop Of Horrors Pop! Movies Orin Scrivello D.D.S Vinyl Figure, ",Hot Topic,12.50,9.00
165,"Funko Star Wars: The Clone Wars Pop! Ahsoka Vinyl Bobble-Head Hot Topic Exclusive, ",Hot Topic,12.50,
166,"Funko The Nightmare Before Christmas SuperCute Plushies Pumpkin King Santa Collectible Plush Hot Topic Exclusive, ",Hot Topic,32.90,26.32
167,"Funko The Predator Pop! Movies Predator Hound Vinyl Figure, ",Hot Topic,12.50,9.00
168,"Funko Star Wars: The Clone Wars Pop! Yoda Vinyl Bobble-Head, ",Hot Topic,12.50,9.00
169,"Funko Power Rangers Pop! Television Rita Repulsa Vinyl Figure, ",Hot Topic,12.50,9.00
170,"Funko Power Rangers Pop! Television Lord Zedd Vinyl Figure, ",Hot Topic,12.50,9.00
171,"Funko Power Rangers Pop! Television Billy Vinyl Figure, ",Hot Topic,12.50,9.00
172,"Funko Power Rangers Pop! Television Goldar Vinyl Figure, ",Hot Topic,12.50,9.00
173,"Funko Power Rangers Pop! Television Zack Vinyl Figure, ",Hot Topic,12.50,
174,"Funko Power Rangers Pop! Television Tommy Vinyl Figure, ",Hot Topic,12.50,9.00
175,"Funko Power Rangers Pop! Television Kimberly Vinyl Figure, ",Hot Topic,12.50,
176,"Funko Power Rangers Pop! Television Jason Vinyl Figure, ",Hot Topic,12.50,
177,"Funko Power Rangers Pop! Television Trini Vinyl Figure, ",Hot Topic,12.50,
178,"Funko Classic Horror SuperCute Plushies Chucky Collectible Plush Hot Topic Exclusive, ",Hot Topic,38.90,27.23
179,"Funko Star Wars: The Clone Wars Pop! Cad Bane Vinyl Bobble-Head 2018 Summer Convention Exclusive, ",Hot Topic,15.00,12.00
180,"Funko Marvel Black Panther Pop! T'Challa Vinyl Bobble-Head, ",Hot Topic,12.50,9.00
181,"Funko Saga Pop! Comics Ghus In Pajamas Flocked Vinyl Figure 2018 Summer Convention Exclusive, ",Hot Topic,15.00,12.00
182,"Funko Riverdale Pop! Television Josie McCoy Vinyl Figure 2018 Summer Convention Exclusive, ",Hot Topic,15.00,
183,"Funko Disney Christopher Robin Pop! Eeyore Vinyl Figure, ",Hot Topic,12.50,9.00
184,"Funko Five Nights At Freddy's: The Twisted Ones Twisted Theodore Collectible Plush, ",Hot Topic,14.90,11.92
185,"Funko Disney TailSpin Pop! Shere Khan Vinyl Figure, ",Hot Topic,12.50,9.00
186,"Funko Five Nights At Freddy's: The Twisted Ones Twisted Bonnie Collectible Plush, ",Hot Topic,14.90,11.92
187,"Funko Disney TailSpin Pop! Rebecca Cunningham Vinyl Figure, ",Hot Topic,12.50,9.00
188,"Funko Mister Rogers' Neighborhood Supercute Plushies Mr. Rogers Collectible Plush, ",Hot Topic,12.90,10.32
189,"Funko Five Nights At Freddy's: The Twisted Ones Twisted Foxy Collectible Plush, ",Hot Topic,14.90,11.92
190,"Funko Five Nights At Freddy's: The Twisted Ones Twisted Wolf Collectible Plush, ",Hot Topic,14.90,11.92
191,"Funko Five Nights At Freddy's: The Twisted Ones Twisted Freddy Collectible Plush, ",Hot Topic,14.90,11.92
192,"Funko Five Nights At Freddy's: The Twisted Ones Twisted Chica Collectible Plush, ",Hot Topic,14.90,11.92
193,"Funko Five Nights At Freddy's: The Twisted Ones Twisted Stanley Collectible Plush, ",Hot Topic,14.90,11.92
194,"Funko Marvel Ant-Man And The Wasp Pop! Hank Pym Unmasked Vinyl Bobble-Head Hot Topic Exclusive, ",Hot Topic,12.50,
195,"Funko Overwatch Pop! Games Orisa Vinyl Figure, ",Hot Topic,18.50,14.80
196,"Funko Mega Man Pop! Games Mega Man Vinyl Figure, ",Hot Topic,12.50,9.00
197,"Funko Steven Universe Pop! Animation Stevonnie Vinyl Figure Hot Topic Exclusive, ",Hot Topic,12.50,
198,"Funko Gargoyles Pop! Demona (Stone) Vinyl Figure Hot Topic Exclusive, ",Hot Topic,12.50,
199,"Funko Dragon Ball Z Pop! Animation Gohan (Training Outfit) Vinyl Figure, ",Hot Topic,12.50,9.00
200,"Funko Steven Universe SuperCute Plushies Pumpkin Collectible Plush Hot Topic Exclusive, ",Hot Topic,34.90,27.92
201,"Funko Dragon Ball Z Pop! Animation Master Roshi Vinyl Figure, ",Hot Topic,12.50,9.00
202,"Funko Steven Universe Mystery Minis Blind Bag Plush Key Chain, ",Hot Topic,5.90,4.72
203,"Funko Overwatch Pop! Games Doomfist Vinyl Figure, ",Hot Topic,12.50,9.00
204,"Funko Disney Gargoyles Pocket Pop! Goliath Key Chain, ",Hot Topic,6.90,5.52
205,"Funko The Nightmare Before Christmas Lock Supercute Plushie, ",Hot Topic,14.90,11.92
206,"Funko Overwatch Pop! Games Ana Vinyl Figure, ",Hot Topic,12.50,9.00
207,"Funko Adventure Time x Minecraft Pop! Animation Marceline Vinyl Figure, ",Hot Topic,12.50,
208,"Funko The Nightmare Before Christmas Barrel Supercute Plushie, ",Hot Topic,14.90,11.92
209,"Funko The Nightmare Before Christmas SuperCute Plushies Jack Skellington Collectible Plush, ",Hot Topic,12.90,10.32
210,"Funko Overwatch Pop! Games Hanzo Vinyl Figure, ",Hot Topic,12.50,
211,"Funko Five Nights At Freddy's Pop! Games Rockstar Foxy Vinyl Figure, ",Hot Topic,12.50,9.00
212,"Funko Adventure Time x Minecraft Pop! Animation Finn Vinyl Figure, ",Hot Topic,12.50,
213,"Funko Adventure Time x Minecraft Pop! Animation Jake Vinyl Figure, ",Hot Topic,12.50,
214,"Funko The Nightmare Before Christmas Shock Supercute Plushie, ",Hot Topic,14.90,11.92
215,"Funko Fantastic Beasts And Where To Find Them Fwooper Supercute Plushies Hot Topic Exclusive, ",Hot Topic,14.90,11.92
216,"Funko The Nightmare Before Christmas Sally Supercute Plushie, ",Hot Topic,12.90,10.32
217,"Funko Disney Gargoyles Pocket Pop! Demona Stone Key Chain Hot Topic Exclusive, ",Hot Topic,6.90,5.52
218,"Funko Adventure Time x Minecraft Pop! Animation Princess Bubblegum Vinyl Figure, ",Hot Topic,12.50,9.00
219,"Funko Overwatch Pop! Games Genji Vinyl Figure, ",Hot Topic,12.50,
220,"Funko Disney Gargoyles Pocket Pop! Demona Key Chain, ",Hot Topic,6.90,5.52
221,"Funko Five Nights At Freddy's Pop! Games Rockstar Freddy Vinyl Figure, ",Hot Topic,12.50,9.00
222,"Funko Sailor Moon Mystery Minis Blind Box Figure Hot Topic Exclusive Variants, ",Hot Topic,7.90,6.32
223,"Funko Steven Universe Supercute Plushies Amethyst Collectible Plush, ",Hot Topic,12.90,10.32
224,"Funko Steven Universe Supercute Plushies Steven Collectible Plush, ",Hot Topic,12.90,10.32
225,"Funko Steven Universe Supercute Plushies Pearl Collectible Plush, ",Hot Topic,12.90,10.32
226,"Funko Star Wars: The Last Jedi Pop! Movies Caretaker Vinyl Bobble-Head, ",Hot Topic,12.50,9.00
227,"Funko Star Wars: The Last Jedi Pop! Movies Porg Vinyl Bobble-Head, ",Hot Topic,12.50,
228,"Funko Steven Universe Supercute Plushies Steven With Jewel Collectible Plush, ",Hot Topic,12.90,10.32
229,"Funko The Nightmare Before Christmas Zero Pop! Plush, ",Hot Topic,32.90,26.32
230,"Funko Steven Universe Supercute Plushies Garnet Collectible Plush, ",Hot Topic,12.90,10.32
231,"Funko The Lord Of The Rings Smeagol Supercute Plushie Hot Topic Exclusive, ",Hot Topic,12.90,6.45
232,"Funko DC Comics Super Heroes Pop! Heroes Wonder Woman From Flashpoint Vinyl Figure Hot Topic Exclusive, ",Hot Topic,12.50,
233,"Funko Steven Universe Pocket Pop! Pink Diamond Key Chain Hot Topic Exclusive, ",Hot Topic,6.90,5.52
234,"Funko The Lord Of The Rings Pocket Pop! Aragorn Key Chain, ",Hot Topic,7.90,6.32
235,"Funko Marvel Ant-Man And The Wasp Pocket Pop! Wasp Key Chain, ",Hot Topic,6.90,5.52
236,"Funko Rick And Morty Pocket Pop! Toxic Morty Key Chain Hot Topic Exclusive, ",Hot Topic,6.90,5.52
237,"Funko Coming To America Pop! Movies Semmi Vinyl Figure, ",Hot Topic,12.50,9.00
238,"Funko Bullet Club Pop! The Young Bucks Vinyl Figure Set Hot Topic Exclusive, ",Hot Topic,24.50,15.00
239,"Funko New Japan Pro-Wrestling Young Bucks Pop! T-Shirt Hot Topic Exclusive, BLACK",Hot Topic,20.90,16.72
240,"Marvel Funko Pandapool T-Shirt Hot Topic Exclusive, BLACK",Hot Topic,,
241,"Funko The Lord Of The Rings SuperCute Plushies Frodo Collectible Plush, ",Hot Topic,12.90,10.32
242,"Funko Pop! WWE Sgt. Slaughter Vinyl Figure, ",Hot Topic,12.50,9.00
243,"Funko The Lord Of The Rings SuperCute Plushies Gandalf The Grey Collectible Plush, ",Hot Topic,12.90,10.32
244,"Funko The Lord Of The Rings SuperCute Plushies Samwise Plush Collectible, ",Hot Topic,12.90,10.32
245,"Funko Five Nights At Freddy's Arcade Vinyl Toy Freddy Vinyl Figure, ",Hot Topic,12.50,10.00
246,"Funko Five Nights At Freddy's Arcade Vinyl Nightmare Freddy Vinyl Figure, ",Hot Topic,12.50,10.00
247,"Funko Star Wars The Empire Strikes Back Mystery Minis Blind Box Vinyl Figure Hot Topic Exclusive Variants, ",Hot Topic,7.90,6.32
248,"Funko Rick And Morty 19"" Pickle Rick (Biting Lip) Galactic Plush, ",Hot Topic,34.90,27.92
249,"Funko The Lord Of The Rings Supercute Plushies Gollum Collectible Plush, ",Hot Topic,12.90,10.32
250,"Funko WWE Pop! WWE Kurt Angle Vinyl Figure, ",Hot Topic,12.50,9.00
251,"Funko Harry Potter Rock Candy Lord Voldemort Vinyl Figure, ",Hot Topic,12.50,9.90
252,"Funko DC Comics Diamond Collection Pop! Heroes Batgirl Vinyl Figure Hot Topic Exclusive, ",Hot Topic,14.50,
253,"Funko Teen Titans Go! Pop! Television Raven As Lady Legasus Vinyl Figure Hot Topic Exclusive, ",Hot Topic,12.50,
254,"Funko It Pocket Pop! Pennywise With Wig Key Chain, ",Hot Topic,6.90,5.52
255,"Funko Tomb Raider Pocket Pop! Lara Croft Key Chain, ",Hot Topic,6.90,5.52
256,"Funko It Pocket Pop! Pennywise With Balloon Key Chain, ",Hot Topic,6.90,5.52
257,"Funko It Pocket Pop! Pennywise With Spider Legs Key Chain, ",Hot Topic,6.90,5.52
258,"Funko Disney Pocket Pop! Dumbo Key Chain, ",Hot Topic,6.90,5.52
259,"Funko Game Of Thrones Pocket Pop! Daenerys Key Chain, ",Hot Topic,6.90,5.52
260,"Funko New Girl Pop! Television Winston Vinyl Figure, ",Hot Topic,12.50,9.00
261,"Funko Hellboy Dorbz Abe Sapien Vinyl Figure, ",Hot Topic,8.90,6.00
262,"Funko Seattle Mariners Pop! MLB Robinson Cano Vinyl Figure, ",Hot Topic,12.50,
263,"Funko Marvel Vynl. Deadpool & Cable Vinyl Figures, ",Hot Topic,18.90,15.12
264,"Funko Washington Nationals Pop! MLB Max Scherzer Vinyl Figure, ",Hot Topic,12.50,
265,"Funko New York Yankees Pop! MLB Giancarlo Stanton Vinyl Figure, ",Hot Topic,12.50,9.00
266,"Funko San Diego Padres Pop! MLB Wil Myers Vinyl Figure, ",Hot Topic,12.50,
267,"Funko Houston Astros Pop! MLB Jose Altuve Vinyl Figure, ",Hot Topic,12.50,
268,"Funko Boston Red Sox Pop! MLB Mookie Betts Vinyl Figure, ",Hot Topic,12.50,
269,"Funko Boston Red Sox Pop! MLB Chris Sale Vinyl Figure, ",Hot Topic,12.50,9.00
270,"Funko Seattle Mariners Pop! MLB Nelson Cruz Vinyl Figure, ",Hot Topic,12.50,
271,"Funko St. Louis Cardinals Pop! MLB Yadier Molina Vinyl Figure, ",Hot Topic,12.50,
272,"Funko Cleveland Indians Pop! MLB Francisco Lindor Vinyl Figure, ",Hot Topic,12.50,
273,"Funko New York Mets Pop! MLB Noah Syndergaard Vinyl Figure, ",Hot Topic,12.50,
274,"Funko Washington Nationals Pop! MLB Bryce Harper Vinyl Figure, ",Hot Topic,12.50,
275,"Funko Harry Potter Pop! Nearly Headless Nick Vinyl Figure, ",Hot Topic,12.50,9.00
276,"Funko New Girl Pop! Television Schmidt Vinyl Figure, ",Hot Topic,12.50,9.00
277,"Funko Baby Driver Pop! Movies Bats Vinyl Figure, ",Hot Topic,12.50,
278,"Funko DC Comics Vnyl. Justice League Batman & Wonder Woman Vinyl Figures, ",Hot Topic,18.50,14.80
279,"Funko Rick And Morty Dorbz Tinkles Vinyl Figure Hot Topic Exclusive, ",Hot Topic,8.90,
