,NAME,STORE,ORIGINAL PRICE,SALE PRICE
2122,Kofi Kingston WWE Pop! Vinyl by Funko,ToyTokyo,9.99,
2123,Krall Star Trek Beyond Pop! Vinyl Movies by Funko,ToyTokyo,9.99,
2124,Lagoona Blue Monster High Pop! Vinyl by Funko,ToyTokyo,9.99,
2125,Lara Croft (Tomb Raider) Pop! Vinyl Games by Funko,ToyTokyo,9.99,
2126,Lemon Meringue & Frappe Strawberry Shortcake Pop! Vinyl Animation by Funko,ToyTokyo,9.99,
2127,Lil' Gruesome Wacky Races Hanna Barbera Pop! Vinyl  Animation by Funko,ToyTokyo,9.99,
2128,Linus van Pelt Peanuts Pop! Vinyl TV by Funko,ToyTokyo,9.99,
2129,Lothar Warcraft Pop! Vinyl Movies by Funko,ToyTokyo,9.99,
2130,Louis Princess and the Frog Disney Pop! Vinyl by Funko,ToyTokyo,9.99,
2131,Lt. Starbuck Battlestar Galactica Pop! Vinyl TV by Funko,ToyTokyo,9.99,
2132,Lt. Starbuck from Battlestar Galactica (70s) Pop! Vinyl Television by Funko,ToyTokyo,9.99,
2133,Luke Hobbs Fast & Furious Pop! Vinyl Movies by Funko,ToyTokyo,9.99,
2134,Lumiere Disney's Beauty and the Beast Pop! Vinyl by Funko,ToyTokyo,9.99,
2135,Main Coon Pop! Vinyl Pets by Funko,ToyTokyo,9.99,
2136,ME-809 Droid Star Wars: The Force Awaken Pop! Vinyl by Funko,ToyTokyo,10.99,
2137,Morton Schmidt (Jonah Hill) from 21 Jump Street Pop! Vinyl Movies by Funko,ToyTokyo,9.99,
2138,Mr. Snuffleupagus from Sesame Street 6 Inch Pop! Vinyl TV by Funko,ToyTokyo,14.99,
2139,Ms. Pac-Man Pop! Vinyl Games by Funko,ToyTokyo,9.99,
2140,Mycroft Holmes from Sherlock Pop! Vinyl TV by Funko,ToyTokyo,9.99,
2141,Nemesis Punisher Marvel Pop! Vinyl by Funko,ToyTokyo,9.99,
2142,Nightmare Freddy Five Nights at Freddy's Pop! Vinyl Games by Funko,ToyTokyo,9.99,
2143,Ninth Doctor BBC's Doctor Who Pop! Vinyl TV by Funko,ToyTokyo,9.99,
2144,Ogrim World of Warcraft Pop! Vinyl Movies by Funko,ToyTokyo,12.00,
2145,Orange Blossom & Marmalade Strawberry Shortcake Pop! Vinyl Animation by Funko,ToyTokyo,9.99,
2146,Pac-Man Pop! Vinyl Games by Funko,ToyTokyo,9.99,
2147,Pedro from Napoleon Dynamite Pop! Vinyl Movies by Funko,ToyTokyo,9.99,
2148,Peeta Mellark The Hunger Games Pop! Vinyl Movies by Funko,ToyTokyo,9.99,
2149,Petra Ender's Game Pop! Vinyl Movies by Funko,ToyTokyo,9.99,
2150,Pinky from Pinky and the Brain Pop! Vinyl Animation by Funko,ToyTokyo,9.99,
2151,Poet from Poet Anderson Pop! Vinyl Movies by Funko,ToyTokyo,9.99,
2152,Poison Ivy/Batman ImPOPster Pop! Vinyl Heroes by Funko,ToyTokyo,9.99,
2153,Power Girl DC Comics Pop! Vinyl Heroes by Funko,ToyTokyo,9.99,
2154,President Snow The Hunger Games Pop! Vinyl Movies by Funko,ToyTokyo,9.99,
2155,Psycho Borderlands Pop! Vinyl Games by Funko,ToyTokyo,9.99,
2156,Quickdraw McGraw Hanna Barbera Pop! Vinyl Animation by Funko,ToyTokyo,9.99,
2157,Ray Gun Stewie Family Guy Pop! Vinyl Animation by Funko,ToyTokyo,9.99,
2158,Red Ranger Power Rangers Pop! Vinyl TV by Funko,ToyTokyo,9.99,
2159,Ren Nickelodeon's Ren and Stimpy Pop! Vinyl Animation,ToyTokyo,9.99,
2160,Rick Flag Suicide Squad Pop! Vinyl Heroes by Funko,ToyTokyo,9.99,
2161,Ricochet Rabbit Hanna Barbera Pop! Vinyl Animation by Funko,ToyTokyo,9.99,
2162,Rose Tyler Bad Wolf Edition from BBC's Doctor Who Pop! Vinyl by Funko,ToyTokyo,9.99,
2163,Rush Mega Man Pop! Vinyl Games by Funko,ToyTokyo,9.99,
2164,Sabertooth Marvel X-Men Pop! Vinyl by Funko,ToyTokyo,9.99,
2165,Sailor Jupiter Sailor Moon Pop! Vinyl Animation by Funko,ToyTokyo,9.99,
2166,Samantha Baker from Sixteen Candles Pop! Vinyl Movies by Funko,ToyTokyo,9.99,
2167,Sarah Jane Smith The BBC's Doctor Who Pop! Vinyl by Funko,ToyTokyo,9.99,
2168,Scarecrow Batman Arkham Knight Pop! Vinyl DC Heroes by Funko,ToyTokyo,9.99,
2169,Scarlet Witch Captain America Civil War Pop! Vinyl Marvel by Funko,ToyTokyo,9.99,
2170,Scotty Star Trek Beyond Pop! Vinyl Movies by Funko,ToyTokyo,9.99,
2171,She-Hulk Pop! Vinyl Marvel by Funko,ToyTokyo,9.99,
2172,Siamese Pop! Vinyl Pets by Funko,ToyTokyo,9.99,
2173,Six Battlestar Galactica Pop! Vinyl by Funko,ToyTokyo,9.99,
2174,Snap Wexley Star Wars: The Force Awakens Pop! Vinyl by Funko,ToyTokyo,10.99,
2175,Spock  Star Trek Beyond Pop! Vinyl Movies by Funko (Pre-Order Shipping in July),ToyTokyo,9.99,
2176,Squiddly Diddly Hanna Barbera Pop! Vinyl Animation by Funko,ToyTokyo,8.99,
2177,Storm Mohawk Marvel X-Men Pop! Vinyl by Funko,ToyTokyo,9.99,
2178,Strawberry Shortcake & Custard Pop! Vinyl Animation by Funko,ToyTokyo,9.99,
2179,Sulu Star Trek Beyond Pop! Vinyl Movies by Funko,ToyTokyo,9.99,
2180,Super Girl DC Super Heroes Pop! Vinyl by Funko,ToyTokyo,9.99,
2181,Superman from Batman v Superman Pop! Vinyl Heroes by Funko,ToyTokyo,9.99,
2182,Superman Soldier Batman v Superman Pop! Vinyl Heroes by Funko,ToyTokyo,9.99,
2183,Ted (The Geek) from Sixteen Candles Pop! VInyl Movies by Funko,ToyTokyo,9.99,
2184,The A-Team Van with B.A. Baracus Pop! Vinyl Rides by Funko NOW AVAILABLE,ToyTokyo,29.99,
2185,The Flash Captain Cold Pop! Vinyl Television by Funko,ToyTokyo,9.99,
2186,The Penguin (Batman) Heroes Impopster Pop! Vinyl by Funko,ToyTokyo,9.99,
2187,The Silence The BBC's Doctor Who Pop! Vinyl TV by Funko,ToyTokyo,9.99,
2188,Touche Turtle Hanna Barbera Pop! Vinyl Animation by Funko,ToyTokyo,9.99,
2189,Toy Tokyo Halloween Mystery Box Funko Pop! Vinyl Figure,ToyTokyo,30.00,
2190,Uhura Star Trek Beyon Pop! Vinyl Movies by Funko,ToyTokyo,9.99,
2191,Val Evolve Pop! Vinyl Games by Funko,ToyTokyo,9.99,
2192,Wakko Animaniacs Pop! Vinyl Animation by Funko,ToyTokyo,9.99,
2193,Wasabi No-Ginger from Disney's Big Hero 6 - Funko,ToyTokyo,8.99,
2194,White Canary DC's Legends of Tomorrow Pop! Vinyl Television by Funko,ToyTokyo,9.99,
2195,Xavier Woods WWE Pop! Vinyl by Funko,ToyTokyo,9.99,
2196,1960's Classic Batman Pop! Vinyl Figure Batgirl 1966,Fugitive Toys,$9.95,
2197,1960's Classic Batman Pop! Vinyl Figure Batman 1966 Surf's Up,Fugitive Toys,$9.95,
2198,1960's Classic Batman Pop! Vinyl Figure King Tut 1966,Fugitive Toys,$9.95,
2199,1960's Classic Batman Pop! Vinyl Figure Mr. Freeze 1966,Fugitive Toys,$9.95,
2200,1960's Classic Batman Pop! Vinyl Figure The Joker 1966 Surf's Up,Fugitive Toys,$9.95,
2201,1960's Classic Batman Pop! Vinyl Figure The Penguin 1966,Fugitive Toys,$9.95,
2202,1960's Classic Batman Pop! Vinyl Figure The Riddler 1966,Fugitive Toys,$9.95,
2203,8-Bit Pop! Vinyl Figure Alien [Alien] [24],Fugitive Toys,$9.95,
2204,8-Bit Pop! Vinyl Figure Blue & Grey Batman [NYCC 2017 Exclusive] [1],Fugitive Toys,$19.95,
2205,8-Bit Pop! Vinyl Figure Classic Batgirl [2],Fugitive Toys,$9.95,
2206,8-Bit Pop! Vinyl Figure Dig Dug [NYCC 2017 Exclusive] [3],Fugitive Toys,$19.95,
2207,8-Bit Pop! Vinyl Figure Donatello [Teenage Mutant Ninja Turtles] [5],Fugitive Toys,$9.95,
2208,8-Bit Pop! Vinyl Figure Freddy Krueger [Nightmare on Elm Street] [22],Fugitive Toys,$9.95,
2209,8-bit Pop! Vinyl Figure Greek Warrior Werewolf [Altered Beasts] [32],Fugitive Toys,$9.95,
2210,8-Bit Pop! Vinyl Figure Leonardo [Teenage Mutant Ninja Turtles] [4],Fugitive Toys,$9.95,
2211,8-Bit Pop! Vinyl Figure Michelangelo [Teenage Mutant Ninja Turtles] [7],Fugitive Toys,$9.95,
2212,8-Bit Pop! Vinyl Figure Raphael [Teenage Mutant Ninja Turtles] [6],Fugitive Toys,$9.95,
2213,A-Team Pop! Vinyl Figure Howling Mad Murdock,Fugitive Toys,$9.95,
2214,A-Team Pop! Vinyl Figure John Hannibal Smith,Fugitive Toys,$9.95,
2215,A-Team Pop! Vinyl Figure Templeton Faceman Peck,Fugitive Toys,$9.95,
2216,Aaahh!!! Real Monsters Pop! Vinyl Figure Ickis [222],Fugitive Toys,$9.95,
2217,Aaahh!!! Real Monsters Pop! Vinyl Figure Krumm [224],Fugitive Toys,$9.95,
2218,Aaahh!!! Real Monsters Pop! Vinyl Figure Oblina [223],Fugitive Toys,$9.95,
2219,Ad Icons Pop! Vinyl Figure Dig Em' Frog [Honey Smacks] [25],Fugitive Toys,$9.95,
2220,Ad Icons Pop! Vinyl Figure Jollibee [Jollibee] [30],Fugitive Toys,$129.95,
2221,Ad Icons Pop! Vinyl Figure Twinkie the Kid [Hostess] [27],Fugitive Toys,$9.95,
2222,Ad Icons Pop! Vinyl Figure Twinkie the Kid [Hostess] [Chase] [27],Fugitive Toys,$34.95,
2223,Adventure Time Pop! Vinyl Figure Flame Princess,Fugitive Toys,$14.95,
2224,Adventure Time Pop! Vinyl Figure Gunter,Fugitive Toys,$22.95,
2225,Adventure Time Pop! Vinyl Figure Marceline [31],Fugitive Toys,$19.95,
2226,Adventure Time Pop! Vinyl Figure The Lich King,Fugitive Toys,$9.95,
2227,Alias Pop! Vinyl Figure Sydney Bristow Blonde,Fugitive Toys,$9.95,
2228,Alias Pop! Vinyl Figure Sydney Bristow Goth,Fugitive Toys,$9.95,
2229,Alias Pop! Vinyl Figure Sydney Bristow Redhead,Fugitive Toys,$9.95,
2230,Alias Pop! Vinyl Figure Sydney Bristow School Girl,Fugitive Toys,$9.95,
2231,American Horror Story: Coven Pop! Vinyl Figure Papa Legba,Fugitive Toys,$79.95,
2232,American Horror Story: Freak Show Pop! Vinyl Figure Pepper,Fugitive Toys,$34.95,
2233,American Horror Story: Hotel Pop! Vinyl Figure Holden,Fugitive Toys,$9.95,
2234,American Horror Story: Hotel Pop! Vinyl Figure Mr. March,Fugitive Toys,$19.95,
2235,Angry Beavers Pop! Vinyl Figure Dagget [323],Fugitive Toys,$9.95,
2236,Angry Beavers Pop! Vinyl Figure Norbert [322],Fugitive Toys,$9.95,
2237,Animaniacs Pop! Vinyl Dot,Fugitive Toys,$15.95,
2238,Animaniacs Pop! Vinyl Wakko,Fugitive Toys,$15.95,
2239,Anime Pop! Vinyl Figure Boa Hancock [One Piece] [330],Fugitive Toys,$9.95,
2240,Anime Pop! Vinyl Figure Ciel [Black Butler],Fugitive Toys,$19.95,
2241,Anime Pop! Vinyl Figure Franky [One Piece] [329],Fugitive Toys,$9.95,
2242,Anime Pop! Vinyl Figure Happy [Fairy Tail],Fugitive Toys,$9.95,
2243,Anime Pop! Vinyl Figure Ichigo [Bleach],Fugitive Toys,$9.95,
2244,Anime Pop! Vinyl Figure Kakashi [Naruto],Fugitive Toys,$9.95,
2245,Anime Pop! Vinyl Figure Ken Kaneki [Tokyo Ghoul],Fugitive Toys,$14.95,
2296,Anime Pop! Vinyl Figure Kirito [Sword Art Online],Fugitive Toys,$9.95,
2297,Anime Pop! Vinyl Figure Monkey. D. Luffy [One Piece],Fugitive Toys,$9.95,
2298,Anime Pop! Vinyl Figure Nami [One Piece] [328],Fugitive Toys,$9.95,
2299,Anime Pop! Vinyl Figure Naruto (Rasengan) [Naruto],Fugitive Toys,$9.95,
2300,Anime Pop! Vinyl Figure Portgas D. Ace [One Piece],Fugitive Toys,$9.95,
2301,Anime Pop! Vinyl Figure Sailor Mercury (Sailor Moon),Fugitive Toys,$9.95,
2302,Anime Pop! Vinyl Figure Sailor Moon w/ Luna (Sailor Moon),Fugitive Toys,$9.95,
2303,Anime Pop! Vinyl Figure Tobi [Naruto],Fugitive Toys,$9.95,
2304,Anime Pop! Vinyl Figure Tony Tony Chopper [One Piece],Fugitive Toys,$9.95,
2305,Anime Pop! Vinyl Figure Touka Kirishima [Tokyo Ghoul],Fugitive Toys,$9.95,
2306,Anime Pop! Vinyl Figure Tuxedo Mask (Sailor Moon),Fugitive Toys,$9.95,
2307,Aquaman Pop! Vinyl Figure Aquaman in Hero Suit [245],Fugitive Toys,$9.95,
2308,Aquaman Pop! Vinyl Figure Arthur Curry [NYCC 2018 Exclusive] [243],Fugitive Toys,$14.95,
2309,Aquaman Pop! Vinyl Figure Arthur Curry as Gladiator [244],Fugitive Toys,$9.95,
2310,Aquaman Pop! Vinyl Figure Black Manta [248],Fugitive Toys,$9.95,
2311,Aquaman Pop! Vinyl Figure Mera [246],Fugitive Toys,$9.95,
2312,Aquaman Pop! Vinyl Figure Orm [247],Fugitive Toys,$9.95,
2313,Arrested Development Pop! Vinyl Figure Banana Stand Michael Bluth,Fugitive Toys,$9.95,
2314,Arrested Development Pop! Vinyl Figure Buster Bluth,Fugitive Toys,$14.95,
2315,Arrested Development Pop! Vinyl Figure George Bluth Sr.,Fugitive Toys,$9.95,
2316,Arrested Development Pop! Vinyl Figure George-Michael Bluth,Fugitive Toys,$9.95,
2317,Arrested Development Pop! Vinyl Figure Gob Bluth,Fugitive Toys,$24.95,
2318,Arrested Development Pop! Vinyl Figure Good Grief Buster Bluth,Fugitive Toys,$9.95,
2319,Arrested Development Pop! Vinyl Figure Michael Bluth,Fugitive Toys,$9.95,
2320,Arrow The Television Series Pop! Vinyl Figure Black Canary,Fugitive Toys,$9.95,
2321,Arrow The Television Series Pop! Vinyl Figure Deathstroke,Fugitive Toys,$9.95,
2322,Arrow The Television Series Pop! Vinyl Figure Oliver Queen,Fugitive Toys,$9.95,
2323,Arrow The Television Series Pop! Vinyl Figure Speedy,Fugitive Toys,$9.95,
2324,Arrow The Television Series Pop! Vinyl Figure Speedy w/ Sword,Fugitive Toys,$9.95,
2325,Ash vs Evil Dead Pop! Vinyl Figure Kelly,Fugitive Toys,$9.95,
2326,Ash vs Evil Dead Pop! Vinyl Figure Pablo,Fugitive Toys,$9.95,
2327,Ash vs Evil Dead Pop! Vinyl Figure Ruby Knowby,Fugitive Toys,$9.95,
2328,Asia Pop! Vinyl Figure Blando [Astro Boy] Exclusive,Fugitive Toys,$19.99,
2329,Asia Pop! Vinyl Figure Bloody Aswang [Legendary Creatures & Myths] Exclusive,Fugitive Toys,$29.95,
2330,Asia Pop! Vinyl Figure Bora [Astro Boy] Exclusive,Fugitive Toys,$19.99,
2331,Asia Pop! Vinyl Figure Epsilon [Astro Boy] Exclusive,Fugitive Toys,$19.99,
2332,Asia Pop! Vinyl Figure Flocked Dr. Ochanomizu [Astro Boy] Exclusive,Fugitive Toys,$19.99,
2333,Asia Pop! Vinyl Figure Flocked Tink [Osamu Tezuka Official] Exclusive,Fugitive Toys,$19.99,
2334,Asia Pop! Vinyl Figure Glow in the Dark Guan Yu [Three Kingdoms] Exclusive,Fugitive Toys,$24.95,
2335,Asia Pop! Vinyl Figure Glow in the Dark Tossakan [Legendary Creatures & Myths] Exclusive,Fugitive Toys,$74.95,
2336,Asia Pop! Vinyl Figure Green Oni [Momotaro] Exclusive,Fugitive Toys,$19.99,
2337,Asia Pop! Vinyl Figure Hanuman [Legendary Creatures & Myths],Fugitive Toys,$29.95,
2338,Asia Pop! Vinyl Figure Manny Pacquiao [Basketball Player],Fugitive Toys,$49.95,
2339,Asia Pop! Vinyl Figure Metallic Pluto [Astro Boy] Exclusive,Fugitive Toys,$19.99,
2340,Asia Pop! Vinyl Figure Monochrome Black Jack [Osamu Tezuka Official] Exclusive,Fugitive Toys,$19.99,
2341,Asia Pop! Vinyl Figure Monochrome Wu Tang Priest [Shaolin Legends] Exclusive,Fugitive Toys,$24.95,
2342,Asia Pop! Vinyl Figure Mont Blanc [Astro Boy] Exclusive,Fugitive Toys,$19.99,
2343,Asia Pop! Vinyl Figure Platinum Monkey King [Exclusive],Fugitive Toys,$24.95,
2344,Asia Pop! Vinyl Figure Ryu [Street Fighter],Fugitive Toys,$17.95,
2345,Asia Pop! Vinyl Figure Sharaku [Osamu Tezuka Official] Exclusive,Fugitive Toys,$19.99,
2346,Asia Pop! Vinyl Figure Stan Lee [Guan Yu],Fugitive Toys,$49.95,
2347,Assassin's Creed III Pop! Vinyl Figure Connor,Fugitive Toys,$19.95,
2348,Assassin's Creed III: Liberation Pop! Vinyl Figure Aveline de Grandpre,Fugitive Toys,$19.95,
2349,Assassin's Creed: Unity Pop! Vinyl Figure Elise,Fugitive Toys,$9.95,
2350,Atomic Blonde Pop! Vinyl Figure Lorraine White Coat (Chase) [565],Fugitive Toys,$34.95,
2351,Atomic Blonde Pop! Vinyl Figure Lorraine White Coat [565],Fugitive Toys,$9.95,
2352,Atomic Blonde Pop! Vinyl Figure Lorraine with Gun (Chase) [566],Fugitive Toys,$34.95,
2353,Atomic Blonde Pop! Vinyl Figure Lorraine with Gun [566],Fugitive Toys,$9.95,
2354,Attack on Titan Pop! Vinyl Figure Annie Leonhart,Fugitive Toys,$9.95,
2355,Batman the Animated Series Pop! Vinyl Figure Bane,Fugitive Toys,$9.95,
2356,Batman the Animated Series Pop! Vinyl Figure Batgirl,Fugitive Toys,$9.95,
2357,Batman the Animated Series Pop! Vinyl Figure Batman,Fugitive Toys,$9.95,
2358,Batman the Animated Series Pop! Vinyl Figure Batman Robot,Fugitive Toys,$9.95,
2359,Batman the Animated Series Pop! Vinyl Figure Clayface,Fugitive Toys,$9.95,
2360,Batman the Animated Series Pop! Vinyl Figure Harley Quinn,Fugitive Toys,$9.95,
2361,Batman the Animated Series Pop! Vinyl Figure Phantasm,Fugitive Toys,$9.95,
2362,Batman the Animated Series Pop! Vinyl Figure Poison Ivy,Fugitive Toys,$9.95,
2363,Batman the Animated Series Pop! Vinyl Figure Robin,Fugitive Toys,$9.95,
2364,Batman the Animated Series Pop! Vinyl Figure Scarecrow,Fugitive Toys,$9.95,
2365,Battlestar Galactica Pop! Vinyl Figure Captain Apollo,Fugitive Toys,$9.95,
2366,Battlestar Galactica Pop! Vinyl Figure Commander Adama,Fugitive Toys,$9.95,
2367,Battlestar Galactica Pop! Vinyl Figure Lieutenant Starbuck,Fugitive Toys,$9.95,
2368,Baywatch Pop! Vinyl Figure C.J. Parker,Fugitive Toys,$9.95,
2369,Baywatch Pop! Vinyl Figure Mitch Buchannon,Fugitive Toys,$9.95,
2370,Beetlejuice Pop! Vinyl Figure Beetlejuice with Hat [605],Fugitive Toys,$9.95,
2371,Bendy and the Ink Machine Pop! Vinyl Figure Alice Angel [281],Fugitive Toys,$9.95,
2372,Bendy and the Ink Machine Pop! Vinyl Figure Boris the Wolf [280],Fugitive Toys,$9.95,
2373,Bendy and the Ink Machine Pop! Vinyl Figure Dead Boris [290],Fugitive Toys,$9.95,
2374,Bendy and the Ink Machine Pop! Vinyl Figure Fisher [387],Fugitive Toys,$9.95,
2375,Bendy and the Ink Machine Pop! Vinyl Figure Ink Bendy [289],Fugitive Toys,$9.95,
2376,Bendy and the Ink Machine Pop! Vinyl Figure Piper [389],Fugitive Toys,$9.95,
2377,Bendy and the Ink Machine Pop! Vinyl Figure Sammy Lawrence [282],Fugitive Toys,$9.95,
2378,Bendy and the Ink Machine Pop! Vinyl Figure Searcher [291],Fugitive Toys,$9.95,
2379,Bendy and the Ink Machine Pop! Vinyl Figure Striker [388],Fugitive Toys,$9.95,
2380,Bendy and the Ink Machine Pop! Vinyl Figure The Projectionist [390],Fugitive Toys,$9.95,
2381,Betty Boop Pop! Vinyl Figure Betty Boop with Pudgy [421],Fugitive Toys,$9.95,
2382,Bioshock Pop! Vinyl Figure Little Sister,Fugitive Toys,$24.95,
2383,Bioshock: Infinite Pop! Vinyl Figure Booker DeWitt,Fugitive Toys,$9.95,
2384,Bioshock: Infinite Pop! Vinyl Figure Booker DeWitt with Skyhook,Fugitive Toys,$9.95,
2385,Bioshock: Infinite Pop! Vinyl Figure Elizabeth,Fugitive Toys,$9.95,
2386,Blacklist Pop! Vinyl Figure Elizabeth Keen,Fugitive Toys,$9.95,
2387,Bleach Pop! Vinyl Figure Grimmjow [349],Fugitive Toys,$9.95,
2388,Bleach Pop! Vinyl Figure Renji [348],Fugitive Toys,$9.95,
2389,BoJack Horseman Pop! Vinyl Figure Diane Nguyen [229],Fugitive Toys,$9.95,
2390,BoJack Horseman Pop! Vinyl Figure Mr. Peanutbutter [230],Fugitive Toys,$9.95,
2391,BoJack Horseman Pop! Vinyl Figure Princess Carolyn [231],Fugitive Toys,$9.95,
2392,BoJack Horseman Pop! Vinyl Figure Todd Chavez [232],Fugitive Toys,$9.95,
2393,Books Pop! Vinyl Figure Cat in the Hat [Dr. Seuss],Fugitive Toys,$9.95,
2394,Books Pop! Vinyl Figure Fox in Socks [Dr. Seuss],Fugitive Toys,$9.95,
2395,Books Pop! Vinyl Figure Max the Dog [Dr. Seuss The Grinch] [13],Fugitive Toys,$9.95,
2396,Books Pop! Vinyl Figure Sam I Am [Dr. Seuss],Fugitive Toys,$9.95,
2397,Books Pop! Vinyl Figure Sam's Friend [Dr. Seuss],Fugitive Toys,$9.95,
2398,Books Pop! Vinyl Figure The Grinch (Chase) [Dr. Seuss The Grinch] [12],Fugitive Toys,$34.95,
2399,Books Pop! Vinyl Figure The Grinch [Dr. Seuss The Grinch] [12],Fugitive Toys,$9.95,
2400,Borderlands Pop! Vinyl Figure Lilith The Siren,Fugitive Toys,$9.95,
2401,Borderlands Pop! Vinyl Figure Mad Moxxi,Fugitive Toys,$9.95,
2402,Borderlands Pop! Vinyl Figure Psycho,Fugitive Toys,$9.95,
2403,Breezly and Sneezly Pop! Vinyl Figure Breezly [277],Fugitive Toys,$9.95,
2404,Breezly and Sneezly Pop! Vinyl Figure Sneezly [278],Fugitive Toys,$9.95,
2405,Bright Pop! Vinyl Figure Daryl Ward [558],Fugitive Toys,$9.95,
2406,Bright Pop! Vinyl Figure Daryl Ward [Chase] [558],Fugitive Toys,$34.95,
2407,Bright Pop! Vinyl Figure Nick Jakoby with Gun [560],Fugitive Toys,$9.95,
2408,Bright Pop! Vinyl Figure Tikka with Wand [559],Fugitive Toys,$9.95,
2409,Buffy The Vampire Slayer 20th Anniversary Pop! Vinyl Figure Dark Willow [598],Fugitive Toys,$9.95,
2410,Buffy The Vampire Slayer 20th Anniversary Pop! Vinyl Figure Faith [597],Fugitive Toys,$9.95,
2411,Buffy The Vampire Slayer 20th Anniversary Pop! Vinyl Figure Giles [596],Fugitive Toys,$9.95,
2412,Buffy The Vampire Slayer 20th Anniversary Pop! Vinyl Figure Xander (Chase) [595],Fugitive Toys,$34.95,
2413,Buffy The Vampire Slayer 20th Anniversary Pop! Vinyl Figure Xander [595],Fugitive Toys,$9.95,
2414,Buffy The Vampire Slayer Pop! Vinyl Figure Buffy & Faith 2-pack [NYCC 2017 Exclusive] [2],Fugitive Toys,$34.95,
2415,Bullet Club Pop! Vinyl Figure Kenny Omega [01],Fugitive Toys,$9.95,
2416,Bullet Club Pop! Vinyl Figure The American Nightmare Cody [02],Fugitive Toys,$9.95,
2417,Care Bears Pop! Vinyl Figure Cheer Bear [351],Fugitive Toys,$9.95,
2418,Care Bears Pop! Vinyl Figure Cheer Bear [Chase] [351],Fugitive Toys,$34.95,
2419,Care Bears Pop! Vinyl Figure Funshine Bear [356],Fugitive Toys,$9.95,
2420,Care Bears Pop! Vinyl Figure Good Luck Bear [355],Fugitive Toys,$9.95,
2421,Care Bears Pop! Vinyl Figure Good Luck Bear [Chase] [355],Fugitive Toys,$34.95,
2422,Care Bears Pop! Vinyl Figure Love-A-Lot Bear [354],Fugitive Toys,$9.95,
2423,Care Bears Pop! Vinyl Figure Tenderheart Bear [352],Fugitive Toys,$9.95,
2424,Carmen Sandiego Pop! Vinyl Figure Carmen Sandiego [662],Fugitive Toys,$9.95,
2425,Cartoon Hangover Bravest Warriors Pop! Vinyl Figure Catbug,Fugitive Toys,$24.95,
2426,Cartoon Hangover Bravest Warriors Pop! Vinyl Figure Commander Catbug [Entertainment Earth Exclusive],Fugitive Toys,$12.99,
2427,Cartoon Hangover Bravest Warriors Pop! Vinyl Figure Impossibear,Fugitive Toys,$9.95,
2428,Cartoon Hangover Bravest Warriors Pop! Vinyl Figure Orange Glow Catbug [NYCC 2015 Exclusive],Fugitive Toys,$19.99,
2429,Children's Hospital Pop! Vinyl Figure Dr. Blake Downs [43],Fugitive Toys,$9.95,
2430,Comics Pop! Vinyl Figure Abe Sapien [Hellboy] [03],Fugitive Toys,$9.95,
2431,Comics Pop! Vinyl Figure Alana with Gun [Saga] [8],Fugitive Toys,$9.95,
2432,Comics Pop! Vinyl Figure Hellboy with Excalibur [Previews Exclusive] [14],Fugitive Toys,$12.95,
2433,Comics Pop! Vinyl Figure Liz Sherman [Hellboy] [02],Fugitive Toys,$9.95,
2434,Comics Pop! Vinyl Figure Lobster Johnson [Hellboy] [04],Fugitive Toys,$9.95,
2435,Comics Pop! Vinyl Figure Marko with Sword [Saga] [7],Fugitive Toys,$9.95,
2436,Comics Pop! Vinyl Figure Nimue The Queen of Blood [Hellboy] [06],Fugitive Toys,$9.95,
2437,Comics Pop! Vinyl Figure Prince Robot IV [Saga] [9],Fugitive Toys,$9.95,
2438,Comics Pop! Vinyl Figure Rasputin [Hellboy] [05],Fugitive Toys,$9.95,
2439,Comics Pop! Vinyl Figure The Will (Chase) [Saga] [10],Fugitive Toys,$34.95,
2440,Comics Pop! Vinyl Figure The Will [Saga] [10],Fugitive Toys,$9.95,
2441,Coraline Pop! Vinyl Figure Coraline in Pajamas [NYCC 2018 Exclusive] [424],Fugitive Toys,$22.95,
2442,Cowboy Bebop Pop! Vinyl Figure Edward and Ein [470],Fugitive Toys,$9.95,
2443,Cowboy Bebop Pop! Vinyl Figure Vicious [469],Fugitive Toys,$9.95,
2444,Crash Bandicoot Pop! Vinyl Figure Crash Bandicoot (Chase) [273],Fugitive Toys,$34.95,
2445,Crash Bandicoot Pop! Vinyl Figure Crash Bandicoot [273],Fugitive Toys,$9.95,
2446,Crash Bandicoot Pop! Vinyl Figure Dr. Neo Cortex [276],Fugitive Toys,$9.95,
2447,Cuphead Pop! Vinyl Figure Cuphead (Chase) [310],Fugitive Toys,$34.95,
2448,Cuphead Pop! Vinyl Figure Cuphead [310],Fugitive Toys,$9.95,
2449,Cuphead Pop! Vinyl Figure King Dice (Chase) [313],Fugitive Toys,$34.95,
2450,Cuphead Pop! Vinyl Figure King Dice [313],Fugitive Toys,$9.95,
2451,Cuphead Pop! Vinyl Figure Legendary Chalice [314],Fugitive Toys,$9.95,
2452,Cuphead Pop! Vinyl Figure Sally Stageplay [414],Fugitive Toys,$9.95,
2453,Cuphead Pop! Vinyl Figure The Devil [312],Fugitive Toys,$9.95,
2454,D.I.Y. Pop! Vinyl Figure Female,Fugitive Toys,$9.95,
2455,DC Comics Bombshells Pop! Vinyl Figure Batgirl,Fugitive Toys,$9.95,
2456,DC Comics Bombshells Pop! Vinyl Figure Batwoman [221],Fugitive Toys,$9.95,
2457,DC Comics Bombshells Pop! Vinyl Figure Catwoman [225],Fugitive Toys,$9.95,
2458,DC Comics Bombshells Pop! Vinyl Figure Hawkgirl [223],Fugitive Toys,$9.95,
2459,DC Comics Bombshells Pop! Vinyl Figure Poison Ivy [224],Fugitive Toys,$9.95,
2460,DC Comics Bombshells Pop! Vinyl Figure Supergirl [222],Fugitive Toys,$9.95,
2461,DC Comics Bombshells Pop! Vinyl Katana,Fugitive Toys,$9.95,
2462,DC Comics Bombshells Pop! Vinyl Wonder Woman,Fugitive Toys,$9.95,
2463,DC Comics Pop! Vinyl Batman Impopster Harley Quinn,Fugitive Toys,$9.95,
2464,DC Comics Pop! Vinyl Batman Impopster Harley Quinn Batgirl,Fugitive Toys,$9.95,
2465,DC Comics Pop! Vinyl Batman Impopster Penguin,Fugitive Toys,$9.95,
2466,DC Comics Pop! Vinyl Batman Impopster Poison Ivy,Fugitive Toys,$9.95,
2467,DC Comics Pop! Vinyl Batman Impopster Two-Face,Fugitive Toys,$9.95,
2468,DC Comics Pop! Vinyl Batman v Superman - Aquaman,Fugitive Toys,$9.95,
2469,DC Comics Pop! Vinyl Batman v Superman - Batman,Fugitive Toys,$9.95,
2470,"DC Comics Pop! Vinyl Batman v Superman - Doomsday 6"" [SDCC 2016 Exclusive]",Fugitive Toys,$34.95,
2471,DC Comics Pop! Vinyl Batman v Superman - Superman,Fugitive Toys,$9.95,
2472,DC Comics Pop! Vinyl Batman v Superman - Superman Soilder,Fugitive Toys,$9.95,
2473,DC Comics Pop! Vinyl Batman v Superman - Wonder Woman,Fugitive Toys,$9.95,
2474,DC Comics Pop! Vinyl Figure Batgirl 2016,Fugitive Toys,$9.95,
2475,DC Comics Pop! Vinyl Figure Cyborg,Fugitive Toys,$9.95,
2476,DC Comics Pop! Vinyl Figure Firestorm,Fugitive Toys,$9.95,
2477,DC Heroes Pop! Vinyl Figure Earth 1 Batman,Fugitive Toys,$9.95,
2478,DC Heroes Pop! Vinyl Figure Super Friends Batman,Fugitive Toys,$9.95,
2479,DC Universe Pop! Vinyl Figure Arkham Knight,Fugitive Toys,$9.95,
2480,DC Universe Pop! Vinyl Figure Batgirl [03],Fugitive Toys,$99.95,
2481,DC Universe Pop! Vinyl Figure Batman 75th Anniversary Rainbow Set [Entertainment Earth Exclusive],Fugitive Toys,$79.95,
2482,DC Universe Pop! Vinyl Figure Batman [Arkham Knight],Fugitive Toys,$9.95,
2483,DC Universe Pop! Vinyl Figure Batman [Batman: Arkham Asylum],Fugitive Toys,$9.95,
2484,DC Universe Pop! Vinyl Figure Black Batman [01],Fugitive Toys,$9.95,
2485,DC Universe Pop! Vinyl Figure Blackest Night Batman [Exclusive],Fugitive Toys,$29.99,
2486,DC Universe Pop! Vinyl Figure Blue Batman 75th Anniversary Rainbow [Entertainment Earth Exclusive],Fugitive Toys,$14.95,
2487,DC Universe Pop! Vinyl Figure Blue Batman [Batman: Arkham Asylum] Exclusive,Fugitive Toys,$19.95,
2488,DC Universe Pop! Vinyl Figure Bruce Wayne [Gotham],Fugitive Toys,$9.95,
2489,DC Universe Pop! Vinyl Figure Domo Superman [27],Fugitive Toys,$12.95,
2490,DC Universe Pop! Vinyl Figure Fish Mooney [Gotham],Fugitive Toys,$9.95,
2491,DC Universe Pop! Vinyl Figure Harley Quinn [Arkham Knight],Fugitive Toys,$9.95,
2492,DC Universe Pop! Vinyl Figure Harley Quinn w/ Mallet,Fugitive Toys,$9.95,
2493,DC Universe Pop! Vinyl Figure Harvey Bullock [Gotham],Fugitive Toys,$9.95,
2494,DC Universe Pop! Vinyl Figure James Gordon [Gotham],Fugitive Toys,$9.95,
2495,DC Universe Pop! Vinyl Figure Metallic Deathstroke [Previews Exclusive],Fugitive Toys,$34.95,
2496,DC Universe Pop! Vinyl Figure Robin [02],Fugitive Toys,$9.95,
2497,DC Universe Pop! Vinyl Figure Scarecrow [Arkham Knight],Fugitive Toys,$9.95,
