,NAME,STORE,ORIGINAL PRICE,SALE PRICE
0,"Funko Pop! Stacks Plastic Protector, ",Hot Topic,10.50,
1,"Funko Fantastic Beasts: The Crimes Of Grindelwald SuperCute Plushies Bowtruckle Collectible Plush, ",Hot Topic,12.90,10.32
2,"Funko Marvel Runaways Pop! Alex Wilder Vinyl Bobble-Head, ",Hot Topic,12.50,9.00
3,"Funko Fantastic Beasts: The Crimes Of Grindelwald Pop! Thestral Vinyl Figure, ",Hot Topic,12.50,9.00
4,"Funko Fantastic Beasts: The Crimes Of Grindelwald Pop! Albus Dumbledore Vinyl Figure, ",Hot Topic,12.50,9.00
5,"Funko Marvel Runaways Pop! Chase Stein Vinyl Bobble-Head, ",Hot Topic,12.50,9.00
6,"Funko Fantastic Beasts: The Crimes Of Grindelwald Pop! Newt Scamander Vinyl Figure, ",Hot Topic,12.50,9.00
7,"Funko Fantastic Beasts: The Crimes Of Grindelwald Pop! Pickett Vinyl Figure, ",Hot Topic,12.50,9.00
8,"Funko Smallfoot Pop! Movies Stonekeeper Vinyl Figure, ",Hot Topic,12.50,9.00
9,"Funko The Nightmare Before Christmas Diamond Collection Pop! Jack Skellington Vinyl Figure Hot Topic Exclusive, ",Hot Topic,14.50,
10,"Funko Spider-Man Pop! Games Miles Morales Vinyl Bobble-Head, ",Hot Topic,12.50,9.00
11,"Funko The Nightmare Before Christmas Pop! Clown Vinyl Figure, ",Hot Topic,12.50,9.00
12,"Rick And Morty Portal Gun Replica, ",Hot Topic,17.90,14.32
13,"Funko Overwatch Pop! Games Torbjorn Vinyl Figure, ",Hot Topic,12.50,9.00
14,"Funko Rick And Morty Scary Terry Action Figure, ",Hot Topic,16.50,13.20
15,"Funko Rick And Morty Purge Suit Rick Action Figure, ",Hot Topic,16.50,13.20
16,"Funko The Nightmare Before Christmas Pop! Snowman Jack Vinyl Figure, ",Hot Topic,12.50,9.00
17,"Funko Rick And Morty Summer Action Figure, ",Hot Topic,16.50,13.20
18,"Funko Rick And Morty Purge Suit Morty Action Figure, ",Hot Topic,16.50,13.20
19,"Funko Rick And Morty Squanchy Action Figure, ",Hot Topic,16.50,13.20
20,"Funko The Nightmare Before Christmas Pop! Sally Vinyl Figure, ",Hot Topic,12.50,9.00
21,"Funko Friends Pop! Television Monica Geller Vinyl Figure, ",Hot Topic,12.50,9.00
22,"Funko Marvel Studios The First 10 Years Pop! Thanos (With Throne) Vinyl Bobble-Head Hot Topic Exclusive, ",Hot Topic,32.50,
23,"Funko Supernatural Pop! Television Castiel With Wings Vinyl Figure Hot Topic Exclusive, ",Hot Topic,14.50,
24,"Funko Five Nights At Freddy's Pocket Pop! Helpy Key Chain, ",Hot Topic,7.90,6.32
25,"Funko The Nightmare Before Christmas Pocket Pop! Dapper Jack Key Chain Hot Topic Exclusive, ",Hot Topic,7.90,6.32
26,"Funko Disney Hercules Pop! Rides Hercules & Pegasus Vinyl Figure , ",Hot Topic,32.50,25.00
27,"FUNKO DISNEY TREASURES VILLAINS BOX HOT TOPIC EXCLUSIVE, ",Hot Topic,32.90,
28,"Funko Cuphead Mugman Vinyl Figure , ",Hot Topic,12.50,10.00
29,"Funko Small Foot Pop! Movies Percy Vinyl Figure, ",Hot Topic,12.50,9.00
30,"Funko Small Foot Pop! Movies Fleem Vinyl Figure, ",Hot Topic,12.50,9.00
31,"Funko Smallfoot Pop! Movies Migo Vinyl Figure, ",Hot Topic,12.50,9.00
32,"Funko Marvel Venom Pop! Venomized Iron Man Bobble-Head, ",Hot Topic,12.50,9.00
33,"Funko Coraline Pop! Mr. Bobinsky With Mouse Vinyl Figure, ",Hot Topic,12.50,9.00
34,"Funko Mickey's 90th Pocket Pop! Brave Little Tailor Key Chain, ",Hot Topic,6.90,5.52
35,"Funko Mickey's 90th Pocket Pop! Band Concert Mickey Key Chain, ",Hot Topic,6.90,5.52
36,"Funko Disney Pop! Apprentice Mickey Mouse Vinyl Figure, ",Hot Topic,12.50,10.00
37,"Funko Disney Pop! Steamboat Willie Mickey Mouse Vinyl Figure, ",Hot Topic,12.50,10.00
38,"Funko Blink-182 Pop! Rocks Mark Hoppus Vinyl Figure, ",Hot Topic,12.50,9.00
39,"Funko Blink-182 Pop! Rocks Travis Barker Vinyl Figure, ",Hot Topic,12.50,9.00
40,"Funko The Nightmare Before Christmas Mystery Minis Blind Box Water Globe Hot Topic Exclusive, ",Hot Topic,12.50,10.00
41,"Funko Marvel Spider-man Pop! Games Mary Jane Vinyl Bobble-Head, ",Hot Topic,12.50,9.00
42,"Funko Big Mouth Pop! Television Hormone Monster Vinyl Figure, ",Hot Topic,12.50,9.00
43,"Funko Pan's Labyrinth Pop! Movies Fauno Vinyl Figure, ",Hot Topic,12.50,9.00
44,"Funko Big Mouth Pop! Television Nick Vinyl Figure, ",Hot Topic,12.50,9.00
45,"Funko Star Wars: The Clone Wars Pop! Ahsoka Vinyl Bobble-Head Hot Topic Exclusive, ",Hot Topic,12.50,
46,"Funko Marvel Venom Pop! Carnage Vinyl Bobble-Head, ",Hot Topic,12.50,9.00
47,"Funko Star Wars: The Clone Wars Pop! Yoda Vinyl Bobble-Head, ",Hot Topic,12.50,9.00
48,"Funko Friends Pop! Television Joey Tribbiani Vinyl Figure, ",Hot Topic,12.50,9.00
49,"Funko Star Wars Vynl. Darth Vader & Stormtrooper Vinyl Figures, ",Hot Topic,18.90,15.12
50,"Funko Power Rangers Pop! Television Zack Vinyl Figure, ",Hot Topic,12.50,9.00
51,"Funko Power Rangers Pop! Television Goldar Vinyl Figure, ",Hot Topic,12.50,9.00
52,"Funko Power Rangers Pop! Television Billy Vinyl Figure, ",Hot Topic,12.50,9.00
53,"Funko Power Rangers Pop! Television Rita Repulsa Vinyl Figure, ",Hot Topic,12.50,9.00
54,"Funko Power Rangers Pop! Television Lord Zedd Vinyl Figure, ",Hot Topic,12.50,9.00
55,"Funko Power Rangers Pop! Television Jason Vinyl Figure, ",Hot Topic,12.50,9.00
56,"Funko Power Rangers Pop! Television Trini Vinyl Figure, ",Hot Topic,12.50,9.00
57,"Funko Power Rangers Pop! Television Tommy Vinyl Figure, ",Hot Topic,12.50,9.00
58,"Funko Power Rangers Pop! Television Kimberly Vinyl Figure, ",Hot Topic,12.50,9.00
59,"Funko Star Wars: The Clone Wars Pop! Cad Bane Vinyl Bobble-Head 2018 Summer Convention Exclusive, ",Hot Topic,15.00,
60,"Funko Marvel Black Panther Pop! T'Challa Vinyl Bobble-Head, ",Hot Topic,12.50,9.00
61,"Funko Saga Pop! Comics Ghus In Pajamas Flocked Vinyl Figure 2018 Summer Convention Exclusive, ",Hot Topic,15.00,10.00
62,"Funko Riverdale Pop! Television Josie McCoy Vinyl Figure 2018 Summer Convention Exclusive, ",Hot Topic,15.00,
63,"Funko TailSpin Pop! Baloo Vinyl Figure, ",Hot Topic,12.50,9.00
64,"Funko Mister Rogers' Neighborhood Supercute Plushies Mr. Rogers Collectible Plush, ",Hot Topic,12.90,10.32
65,"Funko Disney TailSpin Pop! Louie Vinyl Figure, ",Hot Topic,12.50,9.00
66,"Funko Five Nights At Freddy's: The Twisted Ones Twisted Chica Collectible Plush, ",Hot Topic,14.90,11.92
67,"Funko Disney TailSpin Pop! Shere Khan Vinyl Figure, ",Hot Topic,12.50,9.00
68,"Funko Disney TailSpin Pop! Kit Cloudkicker Vinyl Figure, ",Hot Topic,12.50,9.00
69,"Funko Five Nights At Freddy's: The Twisted Ones Twisted Theodore Collectible Plush, ",Hot Topic,14.90,11.92
70,"Funko Five Nights At Freddy's: The Twisted Ones Twisted Stanley Collectible Plush, ",Hot Topic,14.90,11.92
71,"Funko Disney TailSpin Pop! Rebecca Cunningham Vinyl Figure, ",Hot Topic,12.50,9.00
72,"Funko Five Nights At Freddy's: The Twisted Ones Twisted Foxy Collectible Plush, ",Hot Topic,14.90,11.92
73,"Funko Five Nights At Freddy's: The Twisted Ones Twisted Bonnie Collectible Plush, ",Hot Topic,14.90,11.92
74,"Funko Five Nights At Freddy's: The Twisted Ones Twisted Wolf Collectible Plush, ",Hot Topic,14.90,11.92
75,"Funko Marvel Ant-Man And The Wasp Pop! Hank Pym Unmasked Vinyl Bobble-Head Hot Topic Exclusive, ",Hot Topic,12.50,
76,"Funko Overwatch Pop! Games Orisa Vinyl Figure, ",Hot Topic,18.50,14.80
77,"Funko Steven Universe Pop! Animation Stevonnie Vinyl Figure Hot Topic Exclusive, ",Hot Topic,12.50,
78,"Funko Gargoyles Pop! Demona (Stone) Vinyl Figure Hot Topic Exclusive, ",Hot Topic,12.50,
79,"Funko Dragon Ball Z Pop! Animation Bulma Vinyl Figure, ",Hot Topic,12.50,9.00
80,"Funko Dragon Ball Z Pop! Animation Tien And Chiaotzu Vinyl Figure, ",Hot Topic,12.50,9.00
81,"Funko Steven Universe SuperCute Plushies Pumpkin Collectible Plush Hot Topic Exclusive, ",Hot Topic,34.90,27.92
82,"Funko Dragon Ball Z Pop! Animation Master Roshi Vinyl Figure, ",Hot Topic,12.50,9.00
83,"Funko Dragon Ball Z Pop! Animation Gohan (Training Outfit) Vinyl Figure, ",Hot Topic,12.50,9.00
84,"Funko New Japan Pro-Wrestling Pop! The American Nightmare Cody Vinyl Figure, ",Hot Topic,12.50,9.00
85,"Funko Disney Gargoyles Pop! Brooklyn Vinyl Figure, ",Hot Topic,12.50,9.00
86,"Funko Adventure Time x Minecraft Pop! Animation Princess Bubblegum Vinyl Figure, ",Hot Topic,12.50,9.00
87,"Funko Disney Gargoyles Pocket Pop! Demona Key Chain, ",Hot Topic,6.90,5.52
88,"Funko Overwatch Pop! Games Hanzo Vinyl Figure, ",Hot Topic,12.50,9.00
89,"Funko Disney Gargoyles Pop! Goliath Vinyl Figure, ",Hot Topic,12.50,9.00
90,"Funko Five Nights At Freddy's Pop! Games Orville Elephant Vinyl Figure, ",Hot Topic,12.50,9.00
91,"Funko Steven Universe Lapis Lazuli Supercute Plushies Hot Topic Exclusive, ",Hot Topic,12.90,10.32
92,"Funko Overwatch Pop! Games Ana Vinyl Figure, ",Hot Topic,12.50,9.00
93,"Funko Five Nights At Freddy's Pop! Games Rockstar Freddy Vinyl Figure, ",Hot Topic,12.50,9.00
94,"Funko Overwatch Pop! Games Genji Vinyl Figure, ",Hot Topic,12.50,9.00
95,"Funko Adventure Time x Minecraft Pop! Animation Finn Vinyl Figure, ",Hot Topic,12.50,9.00
96,"Funko Five Nights At Freddy's Pop! Games Pig Patch Vinyl Figure, ",Hot Topic,12.50,9.00
97,"Funko Adventure Time x Minecraft Pop! Animation Jake Vinyl Figure, ",Hot Topic,12.50,9.00
98,"Funko Five Nights At Freddy's Pop! Games Helpy Vinyl Figure, ",Hot Topic,12.50,9.00
99,"Funko The Nightmare Before Christmas Shock Supercute Plushie, ",Hot Topic,14.90,11.92
100,"Funko YU-GI-OH! Pop! Animation Seto Kaiba Vinyl Figure, ",Hot Topic,12.50,9.00
101,"Funko Fantastic Beasts And Where To Find Them Fwooper Supercute Plushies Hot Topic Exclusive, ",Hot Topic,14.90,11.92
102,"Funko Disney Gargoyles Pocket Pop! Goliath Key Chain, ",Hot Topic,6.90,5.52
103,"Funko The Nightmare Before Christmas Lock Supercute Plushie, ",Hot Topic,14.90,11.92
104,"Funko Five Nights At Freddy's Pop! Games Rockstar Foxy Vinyl Figure, ",Hot Topic,12.50,9.00
105,"Funko The Nightmare Before Christmas Barrel Supercute Plushie, ",Hot Topic,14.90,11.92
106,"Funko Steven Universe Mystery Minis Blind Bag Plush Key Chain, ",Hot Topic,5.90,4.72
107,"Funko Overwatch Pop! Games Doomfist Vinyl Figure, ",Hot Topic,12.50,9.00
108,"Funko Disney Gargoyles Pocket Pop! Demona Stone Key Chain Hot Topic Exclusive, ",Hot Topic,6.90,5.52
109,"Funko Steven Universe Supercute Plushies Steven Collectible Plush, ",Hot Topic,12.90,10.32
110,"Funko Steven Universe Supercute Plushies Amethyst Collectible Plush, ",Hot Topic,12.90,10.32
111,"Funko Steven Universe Supercute Plushies Steven With Jewel Collectible Plush, ",Hot Topic,12.90,10.32
112,"Funko The Nightmare Before Christmas Zero Pop! Plush, ",Hot Topic,32.90,26.32
113,"Funko Steven Universe Supercute Plushies Garnet Collectible Plush, ",Hot Topic,12.90,10.32
114,"Funko Star Wars: The Last Jedi Pop! Movies Paige Vinyl Bobble-Head, ",Hot Topic,12.50,9.00
115,"Funko Star Wars: The Last Jedi Pop! Movies Caretaker Vinyl Bobble-Head, ",Hot Topic,12.50,9.00
116,"Funko Star Wars: The Last Jedi Pop! Movies Porg Vinyl Bobble-Head, ",Hot Topic,12.50,9.00
117,"Funko Star Wars: The Last Jedi Pop! Movies C'Ai Threnalli Vinyl Bobble-Head, ",Hot Topic,12.50,9.00
118,"Funko Steven Universe Supercute Plushies Pearl Collectible Plush, ",Hot Topic,12.90,10.32
119,"Funko The Lord Of The Rings Smeagol Supercute Plushie Hot Topic Exclusive, ",Hot Topic,12.90,7.74
121,"Funko DC Comics Super Heroes Pop! Heroes Wonder Woman From Flashpoint Vinyl Figure Hot Topic Exclusive, ",Hot Topic,12.50,
122,"Funko Rick And Morty Pocket Pop! Toxic Morty Key Chain Hot Topic Exclusive, ",Hot Topic,6.90,5.52
123,"Funko Rick And Morty Pocket Pop! Toxic Rick Key Chain Hot Topic Exclusive, ",Hot Topic,6.90,5.52
124,"Funko Steven Universe Pocket Pop! Pink Diamond Key Chain Hot Topic Exclusive, ",Hot Topic,6.90,5.52
125,"Funko The Lord Of The Rings Pocket Pop! Aragorn Key Chain, ",Hot Topic,7.90,6.32
126,"Funko Marvel Ant-Man And The Wasp Pocket Pop! Wasp Key Chain, ",Hot Topic,6.90,5.52
127,"Funko Bullet Club Pop! The Young Bucks Vinyl Figure Set Hot Topic Exclusive, ",Hot Topic,24.50,15.00
128,"Marvel Funko Pandapool T-Shirt Hot Topic Exclusive, BLACK",Hot Topic,,
129,"Funko New Japan Pro-Wrestling Young Bucks Pop! T-Shirt Hot Topic Exclusive, BLACK",Hot Topic,20.90,12.54
130,"Funko The Lord Of The Rings SuperCute Plushies Samwise Plush Collectible, ",Hot Topic,12.90,10.32
131,"Funko The Lord Of The Rings SuperCute Plushies Gandalf The Grey Collectible Plush, ",Hot Topic,12.90,10.32
132,"Funko Five Nights At Freddy's Arcade Vinyl Plushtrap Vinyl Figure, ",Hot Topic,12.50,10.00
133,"Funko The Lord Of The Rings SuperCute Plushies Frodo Collectible Plush, ",Hot Topic,12.90,10.32
134,"Funko Star Wars The Empire Strikes Back Mystery Minis Blind Box Vinyl Figure Hot Topic Exclusive, ",Hot Topic,7.90,6.32
135,"Funko Rick And Morty 19"" Pickle Rick (Biting Lip) Galactic Plush, ",Hot Topic,34.90,27.92
136,"Funko The Lord Of The Rings Supercute Plushies Gollum Collectible Plush, ",Hot Topic,12.90,10.32
137,"Funko Five Nights At Freddy's Arcade Vinyl Toy Freddy Vinyl Figure, ",Hot Topic,12.50,10.00
138,"Funko Five Nights At Freddy's Arcade Vinyl Golden Freddy Vinyl Figure, ",Hot Topic,12.50,10.00
139,"Funko Five Nights At Freddy's Arcade Vinyl Foxy Vinyl Figure, ",Hot Topic,12.50,10.00
140,"Funko Five Nights At Freddy's Arcade Vinyl Nightmare Freddy Vinyl Figure, ",Hot Topic,12.50,10.00
141,"Funko DC Comics Diamond Collection Pop! Heroes Batgirl Vinyl Figure Hot Topic Exclusive, ",Hot Topic,14.50,
142,"Funko Rock Candy Harry Potter Ron Weasley Vinyl Figure, ",Hot Topic,12.50,9.90
143,"Funko Disney Pixar Monsters Inc Pocket Pop! Sulley Key Chain, ",Hot Topic,6.90,5.52
144,"Funko Harry Potter Rock Candy Lord Voldemort Vinyl Figure, ",Hot Topic,12.50,9.90
145,"Funko Teen Titans Go! Pop! Television Raven As Lady Legasus Vinyl Figure Hot Topic Exclusive, ",Hot Topic,12.50,
146,"Funko Tomb Raider Pocket Pop! Lara Croft Key Chain, ",Hot Topic,6.90,5.52
147,"Funko It Pocket Pop! Pennywise With Wig Key Chain, ",Hot Topic,6.90,5.52
148,"Funko It Pocket Pop! Pennywise With Balloon Key Chain, ",Hot Topic,6.90,5.52
149,"Funko It Pocket Pop! Pennywise With Spider Legs Key Chain, ",Hot Topic,6.90,5.52
150,"Funko Game Of Thrones Pocket Pop! Daenerys Key Chain, ",Hot Topic,6.90,5.52
151,"Funko Los Angeles Angels Pop! MLB Mike Trout Vinyl Figure, ",Hot Topic,12.50,9.00
152,"Funko Seattle Mariners Pop! MLB Robinson Cano Vinyl Figure, ",Hot Topic,12.50,9.00
153,"Funko Hellboy Dorbz Abe Sapien Vinyl Figure, ",Hot Topic,8.90,7.00
154,"Funko Hellboy Dorbz Hellboy Vinyl Figure, ",Hot Topic,8.90,7.00
155,"Funko Washington Nationals Pop! MLB Max Scherzer Vinyl Figure, ",Hot Topic,12.50,9.00
156,"Funko New York Yankees Pop! MLB Giancarlo Stanton Vinyl Figure, ",Hot Topic,12.50,9.00
157,"Funko St. Louis Cardinals Pop! MLB Yadier Molina Vinyl Figure, ",Hot Topic,12.50,9.00
158,"Funko San Diego Padres Pop! MLB Wil Myers Vinyl Figure, ",Hot Topic,12.50,9.00
159,"Funko San Francisco Giants Pop! MLB Buster Posey Vinyl Figure, ",Hot Topic,12.50,9.00
160,"Funko Cleveland Indians Pop! MLB Francisco Lindor Vinyl Figure, ",Hot Topic,12.50,9.00
161,"Funko New York Mets Pop! MLB Noah Syndergaard Vinyl Figure, ",Hot Topic,12.50,9.00
162,"Funko Houston Astros Pop! MLB Jose Altuve Vinyl Figure, ",Hot Topic,12.50,9.00
163,"Funko Boston Red Sox Pop! MLB Mookie Betts Vinyl Figure, ",Hot Topic,12.50,9.00
164,"Funko Boston Red Sox Pop! MLB Chris Sale Vinyl Figure, ",Hot Topic,12.50,9.00
165,"Funko Seattle Mariners Pop! MLB Nelson Cruz Vinyl Figure, ",Hot Topic,12.50,9.00
166,"Funko Marvel Vynl. Deadpool & Cable Vinyl Figures, ",Hot Topic,18.90,15.12
167,"Funko Washington Nationals Pop! MLB Bryce Harper Vinyl Figure, ",Hot Topic,12.50,9.00
168,"Funko Baby Driver Pop! Movies Bats Vinyl Figure, ",Hot Topic,12.50,9.00
169,"Funko Rick And Morty Dorbz Tinkles Vinyl Figure Hot Topic Exclusive, ",Hot Topic,8.90,
170,"Funko Disney Pop! Doug Porkchop Vinyl Figure, ",Hot Topic,12.50,9.00
171,"Funko Disney Pixar Incredibles 2 Pop! Elastigirl Vinyl Figure, ",Hot Topic,12.50,9.00
172,"Funko Crunchyroll Collectible Box Hot Topic Exclusive, ",Hot Topic,29.90,23.92
173,"Funko Galactic Plushies Rick And Morty Scary Terry Plush, ",Hot Topic,12.90,7.74
174,"Funko Galactic Plushies Rick And Morty Krombopulos Plush, ",Hot Topic,12.90,7.74
175,"Funko Galactic Plushies Rick And Morty Toxic Morty Plush, ",Hot Topic,12.90,7.74
176,"Funko Galactic Plushies Rick And Morty Squanchy Plush, ",Hot Topic,12.90,7.74
177,"Funko Star Wars: The Last Jedi Pop! Rematch On The Supremacy Vinyl Bobble-Heads, ",Hot Topic,32.50,25.00
178,"Funko Galactic Plushies Rick And Morty Snowball Plush, ",Hot Topic,12.90,7.74
179,"Funko Galactic Plushies Rick And Morty Toxic Rick Plush, ",Hot Topic,12.90,7.74
180,"Funko Disney Doug Pop! Quaildog Vinyl Figure Hot Topic Exclusive, ",Hot Topic,12.50,
181,"Funko Disney Doug Pop! Quailman Vinyl Figure Hot Topic Exclusive, ",Hot Topic,12.50,
182,"Funko Disney Diamond Collection The Little Mermaid Pop! Flounder Vinyl Figure Hot Topic Exclusive, ",Hot Topic,14.50,
183,"Funko Disney A Goofy Movie Pop! Powerline Vinyl Figure Hot Topic Exclusive, ",Hot Topic,12.50,
184,"Funko Halo Pop! Halo Sgt Johnson Vinyl Figure, ",Hot Topic,12.50,9.00
185,"Funko DC Super Heroes Harley Quinn And The Skull Bags Pop! Heroes Harley Quinn Vinyl Figure Hot Topic Exclusive, ",Hot Topic,12.50,10.00
186,"Funko Jurassic Park Pop! Movies John Hammond Vinyl Figure, ",Hot Topic,12.50,9.00
187,"Funko Marvel Contest Of Champions Pop! Games Glow-In-The-Dark Civil Warrior Vinyl Bobble-Head Hot Topic Exclusive, ",Hot Topic,12.50,9.00
188,"Funko Solo: A Star Wars Story Pop! Lando Calrissian Vinyl Bobble-Head Hot Topic Exclusive, ",Hot Topic,12.50,10.00
189,"Funko Bendy And The Ink Machine Pop! Games Sammy Lawrence Vinyl Figure, ",Hot Topic,12.50,9.00
190,"Funko IT Pop! Movies Pennywise With Spider Legs Vinyl Figure, ",Hot Topic,12.50,9.00
191,"Funko Bendy And The Ink Machine Pop! Games Dead Boris Vinyl Figure, ",Hot Topic,12.50,9.00
192,"Funko Jurassic World: Fallen Kingdom Pop! Movies Owen Grady Vinyl Figure, ",Hot Topic,12.50,9.00
193,"Funko Rick And Morty Mystery Minis Blind Bag Plush Key Chain, ",Hot Topic,5.90,3.54
194,"Rick And Morty Series 2 Mystery Minis Blind Box Figure, ",Hot Topic,7.90,6.32
195,"Funko Disney Moana Pop! Ceremony Moana Vinyl Figure, ",Hot Topic,12.50,9.00
196,"Funko Marvel Deadpool Pop! Domino Vinyl Bobble-Head, ",Hot Topic,12.50,9.00
197,"Funko Gossip Girl Pop! Television Serena van der Woodsen Vinyl Figure, ",Hot Topic,12.50,9.00
198,"Funko Jurassic World: Fallen Kingdom Pop! Movies Stygimoloch Vinyl Figure, ",Hot Topic,12.50,9.00
199,"Funko Gossip Girl Pop! Television Dan Humphrey Vinyl Figure, ",Hot Topic,12.50,9.00
200,"Funko Gossip Girl Pop! Television Blair Waldorf Vinyl Figure, ",Hot Topic,12.50,9.00
201,"Funko It Pop! Movies Richie Tozier Vinyl Figure, ",Hot Topic,12.50,9.00
202,"Funko Stranger Things Pop! Television Hopper (With Vines) Vinyl Figure, ",Hot Topic,12.50,9.00
203,"Funko Gossip Girl Pop! Television Nate Archibald Vinyl Figure, ",Hot Topic,12.50,9.00
204,"Funko Disney Moana Pop! Grandma Tala Vinyl Figure, ",Hot Topic,12.50,9.00
205,"Funko Rick And Morty Galactic Plushies Pickle Rick Collectible Plush, ",Hot Topic,12.90,10.32
206,"Funko Rick And Morty Galactic Plushies Pickle Rick Scared Collectible Plush, ",Hot Topic,12.90,10.32
207,"Funko Rick And Morty Pickle Rick Annoyed Galactic Plushie, ",Hot Topic,12.90,10.32
208,"Funko Solo: A Star Wars Story Pop! Han Solo Vinyl Bobble-Head, ",Hot Topic,12.50,7.00
209,"Funko Five Nights At Freddy's: The Twisted Ones Pop! Books Stanley Vinyl Figure Hot Topic Exclusive, ",Hot Topic,12.50,7.00
210,"Funko Solo: A Star Wars Story Pop! L3-37 Vinyl Bobble-Head, ",Hot Topic,12.50,9.00
211,"Funko Solo: A Star Wars Story Pop! Qi'ra Vinyl Bobble-Head, ",Hot Topic,12.50,9.00
212,"Funko Overwatch Pop! Games Sombra Translucent Vinyl Figure Hot Topic Exclusive, ",Hot Topic,12.50,
213,"Funko Ready Player One Pop! Movies Parzival (Clear) Vinyl Figure Hot Topic Exclusive, ",Hot Topic,12.50,9.00
214,"Funko Solo: A Star Wars Story Pop! Val Vinyl Bobble-Head, ",Hot Topic,12.50,9.00
215,"Funko Solo: A Star Wars Story Pop! Tobias Beckett Vinyl Bobble-Head, ",Hot Topic,12.50,7.00
216,"Funko Rick And Morty Dorbz Rick Vinyl Figure, ",Hot Topic,8.90,7.00
217,"Funko Rick And Morty Dorbz Morty Vinyl Figure, ",Hot Topic,8.90,7.00
218,"Funko Rick And Morty Dorbz Snowball Vinyl Figure, ",Hot Topic,8.90,7.00
219,"Funko Pee-Wee Herman Pop! Television Miss Yvonne Vinyl Figure, ",Hot Topic,12.50,9.00
220,"Funko Pop! Rocks Alice Cooper Straightjacket Vinyl Figure Hot Topic Exclusive, ",Hot Topic,12.50,
221,"Funko Stranger Things Pop! Television Billy Vinyl Figure, ",Hot Topic,12.50,9.00
222,"Funko Pee-Wee Herman Pop! Television Pee-Wee Herman Vinyl Figure, ",Hot Topic,12.50,9.00
223,"Funko IT Pop! Movies Mike Hanlon Vinyl Figure, ",Hot Topic,12.50,9.00
224,"Funko Marvel Deadpool Pop! Cable Vinyl Bobble-Head, ",Hot Topic,12.50,9.00
225,"Funko Marvel X-Men Pop! Negasonic Teenage Warhead Vinyl Bobble-Head, ",Hot Topic,12.50,9.00
226,"Funko Marvel X-Men Pop! Colossus Vinyl Bobble-Head, ",Hot Topic,12.50,9.00
227,"Funko Disney A Wrinkle In Time Pop! Mrs. Which Vinyl Figure, ",Hot Topic,12.50,9.00
228,"Funko Super Troopers Pop! Movies Ramathorn Vinyl Figure, ",Hot Topic,12.50,9.00
229,"Funko IT Pop! Movies Eddie Kaspbrak Vinyl Figure, ",Hot Topic,12.50,9.00
230,"Funko Atomic Blonde Pop! Movies Lorraine (Gun) Vinyl Figure, ",Hot Topic,12.50,9.00
231,"Funko Disney A Wrinkle In Time Pop! Mrs. Whatsit Vinyl Figure, ",Hot Topic,12.50,9.00
232,"Funko Disney A Wrinkle In Time Pop! Mrs. Who Vinyl Figure, ",Hot Topic,12.50,9.00
233,"Funko Super Troopers Pop! Movies Farva Vinyl Figure, ",Hot Topic,12.50,9.00
234,"Funko Super Troopers Pop! Movies Mac Vinyl Figure, ",Hot Topic,12.50,9.00
235,"Funko Disney Doug Pop! Doug Funnie Vinyl Figure, ",Hot Topic,12.50,9.00
236,"Funko Marvel Avengers: Infinity War Dorbz Ebony Maw Vinyl Figure, ",Hot Topic,8.90,7.00
237,"Funko Destiny Pop! Games Osiris Vinyl Figure, ",Hot Topic,12.50,9.00
238,"Funko Marvel Avengers: Infinity War Pocket Pop! Hulkbuster Key Chain, ",Hot Topic,6.90,5.52
239,"Funko Disney Doug Pop! Patti Mayonnaise Vinyl Figure, ",Hot Topic,12.50,9.00
240,"Funko Destiny Pop! Games Amanda Holliday Vinyl Figure, ",Hot Topic,12.50,9.00
241,"Funko Marvel Avengers: Infinity War Dorbz Proxima Midnight Vinyl Figure, ",Hot Topic,8.90,7.00
242,"Funko Marvel Avengers: Infinity War Pocket Pop! Iron Man Key Chain, ",Hot Topic,6.90,5.52
243,"Funko Destiny Pop! Games Hawthorne (With Louis) Vinyl Figure, ",Hot Topic,12.50,9.00
244,"Funko Destiny Pop! Games Dominus Ghaul Vinyl Figure, ",Hot Topic,12.50,9.00
245,"Funko Pocket Pop! Disney Pixar Incredibles 2 Elastigirl Vinyl Key Chain, ",Hot Topic,6.90,5.52
246,"Funko Solo: A Star Wars Story Mystery Minis Blind Box Figure, ",Hot Topic,7.90,3.95
247,"Funko Solo: A Star Wars Story Wobblers Han Solo Vinyl Bobble-Head, ",Hot Topic,12.50,10.00
248,"Funko Disney Pixar SuperCute Plushies Incredibles 2 Mr. Incredible Collectible Plush, ",Hot Topic,12.90,10.32
249,"Funko Disney Pixar Incredibles 2 Pop! Screenslaver Vinyl Figure, ",Hot Topic,12.50,9.00
250,"Solo: A Star Wars Story Mystery Minis Blind Bag Plush Key Chain, ",Hot Topic,5.90,3.54
251,"Funko Disney Pixar SuperCute Plushies Incredibles 2 Elastigirl Collectible Plush, ",Hot Topic,12.90,10.32
252,"Funko Solo: A Star Wars Story Wobblers Lando Calrissian Vinyl Bobble-Head, ",Hot Topic,12.50,10.00
253,"Funko Smallville Pop! Television Lois Lane Vinyl Figure, ",Hot Topic,12.50,9.00
254,"Funko The Real Cthulhu SuperCute Plushies Cthulhu Collectible Plush, ",Hot Topic,36.90,29.52
255,"Funko Garbage Pail Kids Pop! Clark Can't Vinyl Figure, ",Hot Topic,12.50,9.00
256,"Funko Marvel: Future Fight Pop! Amadeus Cho (As Hulk) Vinyl Bobble-Head, ",Hot Topic,12.50,9.00
257,"Funko Garbage Pail Kids Pop! Ghastly Ashley Vinyl Figure, ",Hot Topic,12.50,9.00
258,"Funko It Supercute Plushies Pennywise (Monster) Collectible Plush, ",Hot Topic,12.90,10.32
259,"Funko Vynl. Hellboy & Abe Sapien Vinyl Figures, ",Hot Topic,18.90,15.12
260,"Funko Harry Potter Vynl. Rubeus Hagrid & Harry Potter Vinyl Figures, ",Hot Topic,18.90,15.12
261,"Funko Five Nights At Freddy's The Twisted Ones + Sister Location Mystery Minis Blind Box Vinyl Figure Hot Topic Exclusive, ",Hot Topic,7.90,6.32
262,"Funko Miraculous: Tales of Ladybug & Cat Noir Pop! Animation Hawk Moth Vinyl Figure, ",Hot Topic,12.50,9.00
263,"Funko Tomb Raider Pop! Games Lara Croft Vinyl Figure, ",Hot Topic,12.50,9.00
264,"Funko Rick And Morty Pop! Rides Mad Max Rick Vinyl Figure, ",Hot Topic,32.50,20.00
265,"Funko Overwatch Pop! Games Roadhog 6 Inch Vinyl Figure, ",Hot Topic,18.50,15.00
266,"Funko Game Of Thrones Pop! Davos Seathworth Vinyl Figure, ",Hot Topic,12.50,9.00
267,"Funko Pop! WWE Jake The Snake Roberts Vinyl Figure, ",Hot Topic,12.50,9.00
268,"Funko NFL Cowboys Pocket Pop! Dez Bryant Key Chain, ",Hot Topic,6.90,5.52
269,"Funko The Walking Dead Pop! Television Sasha Vinyl Figure, ",Hot Topic,12.50,7.00
270,"Funko Saga Pop! Comics Izabel Vinyl Figure Hot Topic Exclusive, ",Hot Topic,12.50,
271,"Funko NFL Giants Pocket Pop! Odell Beckham Jr. Key Chain , ",Hot Topic,6.90,5.52
272,"Funko NFL Seahawks Pocket Pop! Richard Sherman Key Chain, ",Hot Topic,6.90,5.52
273,"Funko Mad Max: Fury Road Pop! Movies Furiosa Vinyl Figure Hot Topic Exclusive, ",Hot Topic,12.50,9.00
274,"Funko Rock Candy Yuri!!! On ICE Yurio Vinyl Figure, ",Hot Topic,12.50,9.90
275,"Funko Marvel Black Panther Black Panther Glow-In-The-Dark Dorbz Vinyl Figure Limited Edition Hot Topic Exclusive, ",Hot Topic,8.90,7.00
276,"Funko Star Wars Pop! Deluxe Chewbacca With AT-ST Vinyl Bobble-Head, ",Hot Topic,32.50,25.00
277,"Funko Predator Dorbz Predator (Mask) Vinyl Figure Limited Edition Hot Topic Exclusive, ",Hot Topic,8.90,7.00
