,NAME,STORE,ORIGINAL PRICE,SALE PRICE
857,"Funko Pop! It Ben Hanscom Vinyl Figure, ",Box Lunch,10.90,9.00
858,"Funko Pop! IT Pennywise With Spider Legs Vinyl Figure, ",Box Lunch,10.90,9.00
859,"Funko SuperCute Plushies Disney Pixar Incredibles 2 Mr. Incredible Collectible Plush, ",Box Lunch,14.90,
860,"Funko Solo: A Star Wars Story Pop! Rio Durant Vinyl Bobble-Head, ",Box Lunch,10.90,9.00
861,"Funko Solo: A Star Wars Story Pop! Lando Calrissian Vinyl Bobble-Head, ",Box Lunch,10.90,9.00
862,"Funko SuperCute Plushies Disney Pixar Incredibles 2 Jack-Jack Collectible Plush, ",Box Lunch,14.90,
863,"Funko Solo: A Star Wars Story Pop! L3-37 Vinyl Bobble-Head, ",Box Lunch,10.90,9.00
864,"Funko SuperCute Plushies Disney Pixar Incredibles 2 Elastigirl Collectible Plush, ",Box Lunch,14.90,
865,"Funko Solo: A Star Wars Story Pop! Range Trooper Vinyl Bobble-Head, ",Box Lunch,10.90,9.00
866,"Funko Solo: A Star Wars Story Pop! Enfys Nest Vinyl Bobble-Head, ",Box Lunch,10.90,9.00
867,"Funko Disney Pixar Incredibles 2 Pop! Underminer Vinyl Figure, ",Box Lunch,10.90,9.00
868,"Funko Disney Pixar Incredibles 2 Pop! Jack-Jack Vinyl Figure, ",Box Lunch,10.90,9.00
869,"Funko Disney Pixar Incredibles 2 Pop! Dash Vinyl Figure, ",Box Lunch,10.90,9.00
870,"Funko Pop! Disney Pixar Monsters Inc. Roz Vinyl Figure, ",Box Lunch,10.90,9.00
871,"Funko Pop! It Bill Denbrough Vinyl Figure, ",Box Lunch,10.90,9.00
872,"Funko Pop! Garbage Pail Kids Adam Bomb Vinyl Figure, ",Box Lunch,10.90,9.00
873,"Funko Pop! Saturday Night Live Stefon Vinyl Figure, ",Box Lunch,10.90,9.00
874,"Funko Pop! Nino Kuni II Revenant Kingdom Evan With Higgledy Vinyl Figure, ",Box Lunch,10.90,9.00
875,"Funko Pop! Buffy The Vampire Slayer Dark Willow Vinyl Figure, ",Box Lunch,10.90,9.00
876,"Funko Pop! Jurassic Park Dr. Ian Malcolm Vinyl Figure, ",Box Lunch,10.90,9.00
877,"Funko Pop! Looney Tunes Elmer Fudd (Opera) Vinyl Figure, ",Box Lunch,10.90,9.00
878,"Funko Pop! The Lord Of The Rings Treebeard Vinyl Figure, ",Box Lunch,16.90,
879,"Funko Dorbz Disney Winnie The Pooh Piglet Vinyl Figure, ",Box Lunch,9.90,7.00
880,"Funko Pop! Ready Player One I-R0K Vinyl Figure, ",Box Lunch,10.90,9.00
881,"Funko Pop! Five Nights At Freddy's The Twisted Ones Twisted Wolf Vinyl Figure, ",Box Lunch,10.90,9.00
882,"Funko Pop! Five Nights At Freddy's The Twisted Ones Twisted Bonnie Vinyl Figure, ",Box Lunch,10.90,9.00
883,"Funko Pop! Ready Player One Sho Vinyl Figure, ",Box Lunch,10.90,9.00
884,"Funko Pop! Five Nights At Freddy's The Twisted Ones Theodore Vinyl Figure, ",Box Lunch,10.90,9.00
885,"Funko Pop! Teen Titans Go! Starfire Vinyl Figure, ",Box Lunch,10.90,9.00
886,"Funko Pop! Marvel Avengers: Infinity War Corvus Glaive Vinyl Bobble-Head, ",Box Lunch,10.90,9.00
887,"Funko Pop! Stranger Things Dart Vinyl Figure, ",Box Lunch,10.90,9.00
888,"Funko Pop! Marvel Avengers: Infinity War Proxima Midnight Vinyl Bobble-Head, ",Box Lunch,10.90,9.00
889,"Funko Pop! Marvel Avengers: Infinity War Iron Man Vinyl Bobble-Head, ",Box Lunch,10.90,9.00
890,"Funko Pop! Marvel Avengers: Infinity War Ebony Maw Vinyl Bobble-Head, ",Box Lunch,10.90,9.00
891,"Funko Pop! Minecraft Creeper Vinyl Figure, ",Box Lunch,10.90,9.00
892,"Funko Pop! Overwatch Zenyatta Vinyl Figure, ",Box Lunch,10.90,9.00
893,"Funko Pocket Pop! Disney DuckTales Webby Key Chain, ",Box Lunch,6.90,
894,"Funko Pop! Marvel Avengers: Infinity War Thanos Vinyl Bobble-Head, ",Box Lunch,10.90,9.00
895,"Funko Pocket Pop! Marvel Avengers: Infinity War Thanos Key Chain, ",Box Lunch,5.90,
896,"Marvel Avengers: Infinity War Iron Spider Plush, ",Box Lunch,14.90,
897,"Funko Pocket Pop! Marvel Avengers: Infinity War Iron Spider Key Chain, ",Box Lunch,5.90,
898,"Funko Pocket Pop! Harry Potter Dobby Vinyl Key Chain, ",Box Lunch,6.90,
899,"Marvel Avengers: Infinity War Thanos Plush, ",Box Lunch,14.90,
900,"Marvel Avengers: Infinity War Hulkbuster Plush, ",Box Lunch,14.90,
901,"Funko Pocket Pop! Game Of Thrones Jon Snow (Season Two) Vinyl Key Chain, ",Box Lunch,6.90,
902,"Funko Pocket Pop! The Walking Dead Daryl Dixon Vinyl Key Chain, ",Box Lunch,6.90,
903,"Funko Pop! Minecraft Ocelot Vinyl Figure, ",Box Lunch,10.90,9.00
904,"Funko Rock Candy The Lord Of The Rings Arwen Vinyl Figure, ",Box Lunch,9.90,
905,"Funko Rock Candy The Lord Of The Rings Eowyn Vinyl Figure, ",Box Lunch,9.90,
906,"Funko Pop! Rick And Morty Weaponized Rick Vinyl Figure, ",Box Lunch,10.90,9.00
907,"Funko Pop! Minecraft Alex Vinyl Figure, ",Box Lunch,10.90,9.00
908,"Funko Pop! Disney Hercules Vinyl Figure, ",Box Lunch,10.90,9.00
909,"Funko Pop! Blade Runner 2049 Wallace Vinyl Figure, ",Box Lunch,10.90,8.99
910,"Funko Pop! Game Of Thrones Jon Snow Vinyl Figure, ",Box Lunch,10.90,9.00
911,"Funko Pop! Disney Hercules Hades Vinyl Figure, ",Box Lunch,10.90,9.00
912,"Funko Pop! Minecraft Steve Vinyl Figure, ",Box Lunch,10.90,9.00
913,"Funko Pop! Marvel Contest Of Champions Guillotine Vinyl Figure, ",Box Lunch,10.90,9.00
914,"Funko Pop! Tommy Boy Tommy Vinyl Figure, ",Box Lunch,10.90,9.00
915,"Funko Pop! Game Of Thrones Daenerys Targaryen Vinyl Figure, ",Box Lunch,10.90,9.00
916,"Funko Pop! The Lord Of The Rings Lurtz Vinyl Figure, ",Box Lunch,10.90,9.00
917,"Funko Pop! Cuphead King Dice Vinyl Figure, ",Box Lunch,10.90,9.00
918,"Funko Pop! The Lord Of The Rings Pippin Took Vinyl Figure, ",Box Lunch,10.90,9.00
919,"Funko Pop! The Lord Of The Rings Merry Brandybuck Vinyl Figure, ",Box Lunch,10.90,9.00
920,"Funko Pop! The Lord Of The Rings Aragorn Vinyl Figure, ",Box Lunch,10.90,9.00
921,"Funko Pop! Minecraft Skeleton Vinyl Figure, ",Box Lunch,10.90,9.00
922,"Funko Pop! Saga Alana Vinyl Figure, ",Box Lunch,10.90,9.00
923,"Funko Pint Sized Heroes Rick And Morty Blind Bag Vinyl Figure, ",Box Lunch,5.90,
924,"Funko Pocket Pop! Marvel Ghost Rider Key Chain, ",Box Lunch,6.90,
925,"Funko Pop! Mr. Bean Vinyl Figure, ",Box Lunch,10.90,9.00
926,"Funko Pop! Nino Kuni II Revenant Kingdom Tani With Higgedly Vinyl Figure, ",Box Lunch,10.90,9.00
927,"Funko Pop! Rick And Morty Warrior Summer Vinyl Figure, ",Box Lunch,10.90,9.00
928,"Funko Pop! Cuphead Mugman Vinyl Figure, ",Box Lunch,10.90,9.00
929,"Funko Pop! Jurassic Park John Hammond Vinyl Figure, ",Box Lunch,10.90,9.00
930,"Funko Pop! Rick And Morty Prison Break Rick Vinyl Figure, ",Box Lunch,10.90,9.00
931,"Funko Pop! 007 James Bond (The Spy Who Loved Me) Vinyl Figure, ",Box Lunch,10.90,9.00
932,"Funko Mystery Minis Disney Kingdom Hearts Blind Box Figure, ",Box Lunch,7.90,
933,"Funko Pop! Cuphead The Devil Vinyl Figure, ",Box Lunch,10.90,9.00
934,"Funko Pop! The Walking Dead Ezekial Vinyl Figure, ",Box Lunch,10.90,9.00
935,"Funko Pop! Rick And Morty Hemmorrhage Vinyl Figure, ",Box Lunch,10.90,9.00
936,"Funko Pop! Jurassic Park Dr. Alan Grant Vinyl Figure, ",Box Lunch,10.90,9.00
937,"Funko Pop! Jurassic Park Dennis Nedry Vinyl Figure, ",Box Lunch,10.90,9.00
938,"Funko Pop! The Walking Dead Sasha Vinyl Figure, ",Box Lunch,10.90,9.00
939,"Funko Pop! The Walking Dead Eugene Vinyl Figure, ",Box Lunch,10.90,9.00
940,"Funko Pop! Cuphead Vinyl Figure, ",Box Lunch,10.90,9.00
941,"Funko Pop! Teen Titans Go! Beast Boy Vinyl Figure, ",Box Lunch,10.90,9.00
942,"Funko Pop! Nino Kuni II Revenant Kingdom Roland With Higgledy Vinyl Figure, ",Box Lunch,10.90,9.00
943,"Funko Pocket Pop! Game Of Thrones Icy Viserion Key Chain - BoxLunch Exclusive, ",Box Lunch,6.90,
944,"Funko Pop! The Walking Dead Richard Vinyl Figure, ",Box Lunch,10.90,9.00
945,"Funko Vynl. Stranger Things Dustin & Lucas Vinyl Figures, ",Box Lunch,18.90,9.45
946,"Funko Pop! Buffy The Vampire Slayer Faith Vinyl Figure, ",Box Lunch,10.90,9.00
947,"Funko Pop! Star Wars: The Last Jedi First Order Snowtrooper Vinyl Bobble-Head, ",Box Lunch,10.90,9.00
948,"Funko Pop! Disney The Emperor's New Groove Kuzco Vinyl Figure, ",Box Lunch,10.90,9.00
949,"Funko Pop! Marvel Contest Of Champions King Groot Vinyl Figure, ",Box Lunch,10.90,9.00
950,"Funko Pop! Yuri!!! on ICE Yurio Vinyl Figure, ",Box Lunch,10.90,9.00
951,"Funko Pop! The Walking Dead Negan Vinyl Figure, ",Box Lunch,10.90,9.00
952,"Funko Pop! Blade Runner 2049 Deckard Vinyl Figure, ",Box Lunch,10.90,8.99
953,"Funko Pop! Rick And Morty Cornvelious Daniel Vinyl Figure, ",Box Lunch,10.90,9.00
954,"Funko Pop! Destiny Lord Shaxx Vinyl Figure, ",Box Lunch,10.90,9.00
955,"Funko Pop! Buffy The Vampire Slayer Buffy Vinyl Figure, ",Box Lunch,10.90,9.00
956,"Funko Mystery Minis DC Comics Justice League Blind Box Figure, ",Box Lunch,7.90,
957,"Funko Pop! Dragon Ball Super Future Trunks Vinyl Figure, ",Box Lunch,10.90,9.00
958,"Funko Pop! Disney Lilo & Stitch Experiment 626 Dome Vinyl Figure - BoxLunch Exclusive, ",Box Lunch,28.90,
959,"Funko Pocket Pop! Fairy Tale Carla Key Chain, ",Box Lunch,6.90,
960,"Funko Pop! Teen Titans Go! Robin As Red X Vinyl Figure, ",Box Lunch,10.90,9.00
961,"Funko Pop! Looney Tunes Daffy Duck Vinyl Figure, ",Box Lunch,10.90,9.00
962,"Rick And Morty Portal Gun, ",Box Lunch,18.90,
963,"Funko Pop! Looney Tunes Bugs Bunny Vinyl Figure, ",Box Lunch,10.90,9.00
964,"Funko Pop! Buffy The Vampire Slayer Xander Vinyl Figure, ",Box Lunch,10.90,9.00
965,"Funko Pop! Teen Titans Go! Starfire As Batgirl Vinyl Figure, ",Box Lunch,10.90,9.00
966,"Funko Pop! Teen Titans Go! Mammoth Vinyl Figure, ",Box Lunch,10.90,9.00
967,"Funko Pop! Teen Titans Go! Robin As Nightwing Vinyl Figure, ",Box Lunch,10.90,9.00
968,"Funko Pop! Looney Tune Bugs Bunny (Opera) Vinyl Figure, ",Box Lunch,10.90,9.00
970,"Funko Pop! Stranger Things Eleven Vinyl Figure - BoxLunch Exclusive, ",Box Lunch,12.90,
971,"Funko Pop! Star Wars: The Last Jedi BB-9E Vinyl Bobble-Head, ",Box Lunch,10.90,9.00
972,"Funko Pop! James Bond 007 Oddjob Vinyl Figure, ",Box Lunch,10.90,9.00
973,"Funko Pop! Disney Aladdin Princess Jasmine Vinyl Figure, ",Box Lunch,10.90,9.00
974,"Funko Pop! Rick And Morty Lawyer Morty Vinyl Figure, ",Box Lunch,10.90,9.00
975,"Funko Pop! DC Comics Bombshells Batwoman Vinyl Figure, ",Box Lunch,10.90,9.00
976,"Funko Pop! DC Comics Bombshells Catwoman Vinyl Figure, ",Box Lunch,10.90,9.00
977,"Funko Pocket Pop! Sailor Moon Key Chain, ",Box Lunch,6.90,
978,"Funko Pocket Pop! Sailor Moon Sailor Chibi Moon Key Chain, ",Box Lunch,6.90,
979,"Funko Pop! Rocko's Modern Life Heffer Vinyl Figure, ",Box Lunch,10.90,9.00
980,"Funko Pop! My Little Pony The Movie Fluttershy Sea Pony Vinyl Figure, ",Box Lunch,10.90,9.00
981,"Funko Pop! Angry Beavers Norbert Vinyl Figure, ",Box Lunch,10.90,9.00
982,"Funko Dorbz Ridez Disney Aladdin Vinyl Figure - 2017 Summer Convention Exclusive, ",Box Lunch,30.00,7.00
983,"Funko Pop! Rides Disney Lilo & Stitch The Red One Vinyl Figure - BoxLunch Exclusive, ",Box Lunch,28.90,
984,"Funko Pop! Hellboy Liz Sherman Vinyl Figure, ",Box Lunch,10.90,9.00
985,"Funko Pop! Elf Buddy Elf (With Snowballs) Vinyl Figure - BoxLunch Exclusive, ",Box Lunch,12.90,
986,"Funko Pop! Jumanji Dr. Smolder Bravestone Vinyl Figure, ",Box Lunch,10.90,9.00
987,"Funko Pop! Jumanji Professor Shelly Oberon Vinyl Figure, ",Box Lunch,10.90,9.00
988,"Funko Pop! Team Fortress 2 Medic Vinyl Figure, ",Box Lunch,10.90,9.00
989,"Funko Pop! Team Fortress 2 Scout Vinyl Figure, ",Box Lunch,10.90,9.00
990,"Funko Pop! Rick And Morty Summer Vinyl Figure, ",Box Lunch,10.90,9.00
991,"Funko Dorbz Stranger Things Lucas Vinyl Figure, ",Box Lunch,9.90,7.00
992,"Funko Dorbz Stranger Things Demogorgon Vinyl Figure, ",Box Lunch,9.90,4.95
993,"Funko Dorbz Stranger Things Will Vinyl Figure, ",Box Lunch,9.90,4.95
994,"Funko Dorbz Stranger Things Mike Vinyl Figure, ",Box Lunch,9.90,4.95
995,"Funko Pop! Stranger Things Eleven Vinyl Figure, ",Box Lunch,10.90,9.00
996,"Funko Dorbz Stranger Things Dustin Vinyl Figure, ",Box Lunch,9.90,4.95
997,"Funko Pop! Blade Runner 2049 Officer K Vinyl Figure, ",Box Lunch,10.90,8.99
998,"Funko Pop! Team Fortress 2 Heavy Vinyl Figure, ",Box Lunch,10.90,9.00
999,"Funko Pop! Disney Snow White And The Seven Dwarfs Snow White Vinyl Figure, ",Box Lunch,10.90,9.00
1000,"Funko Pop! Star Wars Tie Fighter Pilot With Tie Fighter Vinyl Bobble-Head, ",Box Lunch,28.90,
1001,"Funko Pop! Hanna Barbera Breezly And Sneezly Vinyl Figure, ",Box Lunch,10.90,9.00
1002,"Funko Pop! Five Nights At Freddy's Sister Location Funtime Foxy Vinyl Figure, ",Box Lunch,10.90,9.00
1003,"Funko Pop! Fairy Tale Carla Vinyl Figure, ",Box Lunch,10.90,9.00
1004,"Funko Pop! Five Nights At Freddy's Sister Location Ballora Vinyl Figure, ",Box Lunch,10.90,9.00
1005,"Funko Pop! Five Nights At Freddy's Sister Location Baby Vinyl Figure, ",Box Lunch,10.90,9.00
1006,"Funko Rock Candy Harry Potter Ron Weasley Vinyl Figure, ",Box Lunch,9.90,
1007,"Funko Rock Candy Harry Potter Hermione Granger Vinyl Figure, ",Box Lunch,9.90,
1008,"Funko Pop! Destiny Zavala Vinyl Figure, ",Box Lunch,10.90,9.00
1009,"Funko Pop! Destiny Ikora Vinyl Figure, ",Box Lunch,10.90,9.00
1010,"Funko Pop! Star Wars: The Last Jedi Finn Vinyl Bobble-Head, ",Box Lunch,10.90,9.00
1011,"Funko Pop! Star Wars: The Last Jedi Poe Dameron Vinyl Bobble-Head, ",Box Lunch,10.90,9.00
1012,"Funko Pop! Star Wars: The Last Jedi Supreme Leader Snoke Vinyl Bobble-Head, ",Box Lunch,10.90,9.00
1014,"Funko Pop! Star Wars: The Last Jedi Praetorian Guard Vinyl Bobble-Head, ",Box Lunch,10.90,9.00
1015,"Funko Pop! IT Pennywise Vinyl Figure, ",Box Lunch,10.90,9.00
1016,"Funko Pop! Five Nights At Freddy's Nightmare Foxy Vinyl Figure, ",Box Lunch,10.90,9.00
1017,"Funko Pop! BoJack Horseman Mr. Peanutbutter Vinyl Figure, ",Box Lunch,10.90,9.00
1018,"Funko Pop! DC Comics Batman Classic TV Series Mr. Freeze Vinyl Figure, ",Box Lunch,10.90,9.00
1019,"Funko Pop! War For The Planet Of The Apes Bad Ape Vinyl Figure, ",Box Lunch,10.90,9.00
1020,"Funko Pop! Alien Covenant David Vinyl Figure, ",Box Lunch,10.90,8.99
1021,"Funko Mystery Minis Dr. Seuss Blind Box Figure, ",Box Lunch,7.90,
1022,"Funko Pop! DC Comics Batman Classic TV Series The Riddler Vinyl Figure, ",Box Lunch,10.90,9.00
1023,"Funko Pop! Justin Bieber Vinyl Figure, ",Box Lunch,10.90,9.00
1024,"Funko Pop! Game Of Thrones Bran Stark Vinyl Figure, ",Box Lunch,10.90,9.00
1025,"Funko Pop! Alien Covenant Daniels Vinyl Figure, ",Box Lunch,10.90,8.99
1026,"Funko Pop! Valerian Igon Siruss Vinyl Figure, ",Box Lunch,10.90,9.00
1027,"Funko Pop! Valerian Vinyl Figure, ",Box Lunch,10.90,9.00
1028,"Funko Pop! Valerian Laureline Vinyl Figure, ",Box Lunch,10.90,9.00
1029,"Funko Pop! Valerian Doghan Daguis Vinyl Figure, ",Box Lunch,10.90,9.00
1030,"Funko Pop! Valerian Da Vinyl Figure, ",Box Lunch,10.90,9.00
1031,"Funko Pop! Valerian Commander Arun Filitt Vinyl Figure, ",Box Lunch,10.90,9.00
1032,"Funko Pop! DC Comics Batman Classic TV Series The Penguin Vinyl Figure, ",Box Lunch,10.90,9.00
1033,"Funko Pop! BoJack Horseman Princess Carolyn Vinyl Figure, ",Box Lunch,10.90,9.00
1034,"Funko Pop! DC Comics Batman Classic TV Series Batgirl Vinyl Figure, ",Box Lunch,10.90,9.00
1035,"Funko Pop! BoJack Horseman Diane Nguyen Vinyl Figure, ",Box Lunch,10.90,9.00
1036,"Funko Pop! Mr. Robot White Rose Vinyl Figure, ",Box Lunch,10.90,8.99
1037,"Funko Pop! DC Comics Batman Classic TV Series King Tut Vinyl Figure, ",Box Lunch,10.90,9.00
1038,"Funko Pop! BoJack Horseman Todd Chavez Vinyl Figure, ",Box Lunch,10.90,9.00
1039,"Funko Pop! War For The Planet Of The Apes Maurice Vinyl Figure, ",Box Lunch,10.90,9.00
1040,"Funko Pop! Alias Sydney Bristow (School Girl) Vinyl Figure, ",Box Lunch,10.90,9.00
1041,"Funko Pop! Alias Sydney Bristow (Blonde) Vinyl Figure, ",Box Lunch,10.90,9.00
1042,"Funko Pop! Five Nights At Freddy's Nightmare Bonnie Vinyl Figure, ",Box Lunch,10.90,9.00
1043,"Funko Pop! Alias Sydney Bristow (Redhead) Vinyl Figure, ",Box Lunch,10.90,9.00
1044,"Funko Pop! Alias Sydney Bristow (Goth) Vinyl Figure, ",Box Lunch,10.90,9.00
1045,"Funko Rock Candy Aliens Ellen Ripley Vinyl Figure, ",Box Lunch,9.90,
1046,"Funko Pop! The Elder Scrolls Morrowind Warden Vinyl Figure, ",Box Lunch,10.90,9.00
1047,"Funko Pop! The Leftovers Patti Vinyl Figure, ",Box Lunch,10.90,9.00
1048,"Funko Pop! Joey Ramone Vinyl Figure, ",Box Lunch,10.90,9.00
1049,"Funko Pop! The Elder Scrolls Morrowind Vivec Vinyl Figure, ",Box Lunch,10.90,9.00
1050,"Funko Pop! The Leftovers Kevin Vinyl Figure, ",Box Lunch,10.90,9.00
1051,"Funko Pop! Borderlands Emperor Claptrap Vinyl Figure, ",Box Lunch,10.90,9.00
1052,"Funko Pop! The Leftovers Matt Vinyl Figure, ",Box Lunch,10.90,9.00
1053,"Funko Pop! Borderlands Lilith Vinyl Figure, ",Box Lunch,10.90,9.00
1054,"Funko Pop! The Elder Scrolls Morrowind Naryu Vinyl Figure, ",Box Lunch,10.90,9.00
1055,"Funko Pop! Teen Wolf Scott McCall (Werewolf) Vinyl Figure, ",Box Lunch,10.90,9.00
1056,"Funko Pop! Teen Wolf Scott McCall Vinyl Figure, ",Box Lunch,10.90,9.00
1057,"Funko Pop! Gears Of War Damon Baird Vinyl Figure, ",Box Lunch,10.90,9.00
1058,"Funko Pop! Five Nights At Freddy's Chica Vinyl Figure, ",Box Lunch,10.90,9.00
1059,"Funko Pop! Gears Of War Augustus Cole Vinyl Figure, ",Box Lunch,10.90,9.00
1060,"Funko Pop! Gears Of War Oscar Diaz Vinyl Figure, ",Box Lunch,10.90,9.00
1061,"Funko Pop! Gears Of War Marcus Fenix Vinyl Figure, ",Box Lunch,10.90,9.00
1062,"Funko Pop! Gears Of War Dominic Santiago Vinyl Figure, ",Box Lunch,10.90,9.00
1063,"Funko Pop! Captain Underpants Professor Poopy Pants Vinyl Figure, ",Box Lunch,10.90,9.00
1064,"Funko Dorbz Teen Titans Go Robin Vinyl Figure, ",Box Lunch,9.90,7.00
1065,"Funko Pop! Marvel Spider-Man Homecoming Vulture Vinyl Figure, ",Box Lunch,10.90,9.00
1066,"Funko Pocket Pop! Doctor Who TARDIS Key Chain, ",Box Lunch,6.90,
1067,"Funko Pocket Pop! Marvel X-Men Magneto Key Chain, ",Box Lunch,6.90,
1068,"Funko Pocket Pop! DC Comics The Flash Key Chain, ",Box Lunch,6.90,
1069,"Funko Pocket Pop! Harry Potter Dumbledore Key Chain, ",Box Lunch,6.90,
1070,"Funko Pocket Pop! DC Comics Wonder Woman Key Chain, ",Box Lunch,6.90,
1071,"Funko Pocket Pop! Rick And Morty Rick Key Chain, ",Box Lunch,6.90,
1072,"Funko Pocket Pop! Rick And Morty Morty Key Chain, ",Box Lunch,6.90,
1073,"Funko Pop! Rick And Morty Mr. Poopy Butthole Vinyl Figure, ",Box Lunch,10.90,9.00
1074,"Funko Pop! Space Jam Swackhammer Vinyl Figure, ",Box Lunch,10.90,9.00
1075,"Funko Pop! Star Wars: The Force Awakens General Leia Vinyl Bobble-Head, ",Box Lunch,10.90,9.00
1076,"Funko Pop! DC Comics Wonder Woman Steve Trevor Vinyl Figure, ",Box Lunch,10.90,7.99
1077,"Funko Pocket Pop! Friday the 13th Jason Vorhees Movies Key Chain, ",Box Lunch,6.50,
1078,"Funko Pop! Movies Freddy Krueger & Jason Voorhees Vinyl Figure Set - BoxLunch Exclusive, ",Box Lunch,24.90,
1079,"Funko Pocket Pop! Game Of Thrones Drogon Key Chain, ",Box Lunch,6.90,
1080,Funko POP Alien Covenant Xenomorph Bloody Splattered Gamestop Exclusive,CHRONOTOYS,24.99,
1081,Funko POP Attack on Titan Eren Jaeger Titan Form - Hot Topic Exclusive,CHRONOTOYS,30.99,
1082,Funko POP Game of Thrones Jon Snow Bloody - Hot Topic Exclusive,CHRONOTOYS,24.99,
1083,Funko POP Game of Thrones Night King Glows in the Dark GITD - GameStop Exclusive,CHRONOTOYS,27.99,
1084,Funko POP Kingdom Hearts Halloween Donald NYCC Fall Convention Exclusive,CHRONOTOYS,49.99,
1085,Funko POP Kingdom Hearts Halloween Goofy NYCC Fall Convention Exclusive,CHRONOTOYS,49.99,
1086,Funko POP Marvel Spider-Man Carnage - Hot Topic Exclusive,CHRONOTOYS,22.99,
1087,Funko POP Overwatch MCcree USA - GameStop Exclusive,CHRONOTOYS,24.99,
1088,Funko POP Predator Masked Specialty Series *FREE SHIPPING*,CHRONOTOYS,27.99,
1089,Funko POP Star Wars Dengar - NYCC Exclusive,CHRONOTOYS,29.99,14.99
1090,Funko POP! Animation - Voltron Metallic Variant - Los Angeles AnimeExpo Convention Exclusive,CHRONOTOYS,19.99,
1091,"Pack of 20 - Funko POP! 4"" 0.5mm Plastic Protector Bundle",CHRONOTOYS,35.00,22.99
1092,POP! Animation - Dragonball Z - Goku Glow in the Dark - EE Exclusive,CHRONOTOYS,13.99,
1093,POP! Animation - Dragonball Z - Goku Super Saiyan God Red,CHRONOTOYS,39.99,
1094,POP! Animation - Dragonball Z - SSGSS Goku Blue - Hot Topic Exclusive,CHRONOTOYS,24.99,
1095,POP! Animation - Dragonball Z - SSGSS Vegeta Blue - Vaulted,CHRONOTOYS,19.99,
1096,POP! Animation - Dragonball Z - Vegeta Metallic Exclusive,CHRONOTOYS,27.99,
1097,POP! Animation - Dragonball Z Super - Super Saiyan Rose Goku Black - Hot Topic Exclusive,CHRONOTOYS,19.99,
1098,POP! Animation - Duck Dodgers White Gamma - 2016 Summer Convention Exclusive,CHRONOTOYS,39.99,
1099,POP! Animation - Huckleberry Hound,CHRONOTOYS,19.99,
1100,POP! Animation - Naruto Sage Mode - Gamestop Exclusive,CHRONOTOYS,14.99,
1101,POP! Animation - Naruto Six Path Glow in the Dark,CHRONOTOYS,19.99,
1102,POP! Animation - Space Ghost - Zorak - 2016 Summer Convention Exclusive,CHRONOTOYS,23.99,
1103,POP! Anime - Naruto Shippuden - Naruto Six Path - Glows in the Dark,CHRONOTOYS,35.00,32.99
1104,POP! Asia - Amazing Thailand Sukjai Black & White Exclusive,CHRONOTOYS,29.99,
1105,POP! Asia - Amazing Thailand Sukjai Glow In The Dark Exclusive,CHRONOTOYS,44.99,
1106,POP! Asia - Amazing Thailand Sukjai Peach Convention Exclusive,CHRONOTOYS,29.99,
1107,POP! Asia - Astro Boy - Poplife Exclusive,CHRONOTOYS,21.99,
1108,POP! Asia - Astro Boy Metallic - 2015 Exclusive,CHRONOTOYS,25.99,
1109,POP! Asia - Aswang Exclusive,CHRONOTOYS,24.99,
1110,POP! Asia - CosFanX - MOMO 2016 Exclusive,CHRONOTOYS,12.99,
1111,POP! Asia - Kappa - Poplife Exclusive,CHRONOTOYS,29.99,
1112,POP! Asia - Kuchisake Bloody - 2017 Convention Exclusive,CHRONOTOYS,34.99,
1113,POP! Asia - Legendary Creatures & Myths - White Lady Glows In The Dark - Asia Exclusive,CHRONOTOYS,39.99,
1114,POP! Asia - Manny Pacquiao Boxing - Asia Exclusive,CHRONOTOYS,64.99,
1115,POP! Asia - Merlion Original - Singapore Exclusive,CHRONOTOYS,24.99,
1116,POP! Asia - Merlion Sunburst - Singapore Exclusive,CHRONOTOYS,35.99,
1117,POP! Asia - Monkey King Rock - Poplife Exclusive,CHRONOTOYS,24.99,
1118,POP! Asia - Siyokoy - Poplife Exclusive,CHRONOTOYS,29.99,
1119,POP! Asia - Street Fighter V Hot Ryu - 2016 Convention Exclusive,CHRONOTOYS,34.99,
1120,POP! Asia - The Little Prince - The Aviator - Poplife Exclusive,CHRONOTOYS,29.99,
1121,POP! Asia - The Little Prince - The Little Girl - Poplife Exclusive,CHRONOTOYS,29.99,
1122,POP! Asia - The Little Prince - The Little Prince - Poplife Exclusive,CHRONOTOYS,29.99,
1123,POP! Asia - Three King Romance - Guan Yu Glow In The Dark - 2015 Exclusive,CHRONOTOYS,33.99,
1124,POP! Asia Only Exclusive - Kung Fu Panda - Dim Sum PO,CHRONOTOYS,35.00,29.99
1125,POP! Asia Only Exclusive - Kung Fu Panda - Fighting PO,CHRONOTOYS,35.00,29.99
1126,POP! Asia Only Exclusive - Kung Fu Panda - Fortune PO,CHRONOTOYS,35.00,29.99
1127,POP! Asia Only Exclusive - Kung Fu Panda - Guan Yu PO,CHRONOTOYS,35.00,29.99
1128,POP! Asia Only Exclusive - Kung Fu Panda - Lucky PO,CHRONOTOYS,35.00,29.99
1129,POP! Asia Only Exclusive - Kung Fu Panda - Master PO,CHRONOTOYS,35.00,29.99
1130,POP! Asia Only Exclusive - Kung Fu Panda - PO Of Wealth,CHRONOTOYS,35.00,29.99
1131,POP! Asia Only Exclusive - Kung Fu Panda - Shaolin PO,CHRONOTOYS,35.00,29.99
1132,POP! Asia Only Exclusive - Kung Fu Panda - Tai Ji PO,CHRONOTOYS,35.00,29.99
1133,POP! Asia Only Exclusive - Kung Fu Panda - Terra Cotta Armor PO,CHRONOTOYS,35.00,29.99
1134,POP! DC - Darkest Night Batman - 2016 NYCC Exclusive,CHRONOTOYS,30.00,22.99
1135,POP! DC - Justice League - The Flash Unmasked Exclusive,CHRONOTOYS,35.00,24.99
1136,POP! DC - The Killing Joker - 2016 NYCC Exclusive,CHRONOTOYS,21.99,
1137,POP! DC Comics Bombshell - Joker with Kisses - Hot Topic Exclusive,CHRONOTOYS,25.00,19.99
1138,POP! Disney - Cheshire Cat Fading - Hot Topic Exclusive,CHRONOTOYS,28.99,
1139,POP! Disney - Enchanted Tiki Room - Pele & Barker Parrot - Disneypark Exclusive,CHRONOTOYS,49.99,
1140,POP! Disney - Heffalump Stripes - Barnes & Noble Exclusive,CHRONOTOYS,14.99,
1141,POP! Disney - Nightmare Before Christmas - Behemoth - 2016 NYCC Exclusive,CHRONOTOYS,19.99,
1142,POP! Disney - Nightmare Before Christmas - Jack Skellington with Snowflake - Hot Topic Exclusive,CHRONOTOYS,24.99,
1143,POP! Disney - Pirates of the Caribbean - Cursed Barbossa - 2016 Summer Convention Exclusive,CHRONOTOYS,27.99,
1144,POP! Disney - Roger Rabbit & Jessica Rabbit 2 Pack - Vaulted / 2014 Asia Exclusive,CHRONOTOYS,79.99,
1145,POP! Disney - Splash Mountain Ride - Disneypark Exclusive,CHRONOTOYS,44.99,
1146,POP! Disney Treasures Box Ever After Castle - Ariel & Eric 2 Pack,CHRONOTOYS,65.00,49.99
1147,POP! Dragonball Z - Badman Vegeta - Hot Topic Exclusive,CHRONOTOYS,33.99,
1148,POP! Games - Mega Man Thunder Beam - 2016 NYCC Exclusive,CHRONOTOYS,21.99,
1149,POP! Games - World of Warcraft Deathwing Gold Giant Size- Simply Toys Exclusive,CHRONOTOYS,69.99,
1150,"POP! Harry Potter - Cornish Pixie, Mandrake & Grindylow 3 Pack - 2016 Summer Convention Exclusive",CHRONOTOYS,64.99,
1151,POP! Heroes - Lex Luthor Metallic Mech Suit - Legion of Collectors Exclusive *FREE SHIPPING*,CHRONOTOYS,19.99,14.99
1152,POP! Heroes - Wonder Woman Lasso - Legion Of Collectors Exclusive *FREE SHIPPING*,CHRONOTOYS,24.99,20.99
1153,POP! Marvel - Avengers - Captain America Unmasked - 2015 Convention Exclusive,CHRONOTOYS,34.99,
1154,POP! Marvel - Black Panther - Okoye - Popcultcha Exclusive,CHRONOTOYS,59.99,
1155,POP! Marvel - Blue Stealth Iron Man,CHRONOTOYS,23.99,
1156,POP! Marvel - Guardians Of The Galaxy - The Collector Gold - Disney Exclusive,CHRONOTOYS,24.99,
1157,POP! Marvel - Moon Knight Glows in the Dark - Exclusive,CHRONOTOYS,45.00,28.99
1158,POP! Marvel - Stan Lee Guan Yu Red - 2017 Convention Exclusive,CHRONOTOYS,29.99,
1159,POP! Marvel - Superior Spider-Man - Walgreens Exclusive,CHRONOTOYS,24.99,
1160,POP! Mighty Morphing Power Rangers - Red Ranger Dragon Shield,CHRONOTOYS,39.99,
1161,POP! Mighty Morphing Power Rangers Alpha 5 Black & Gold - BAIT SDCC Exclusive,CHRONOTOYS,49.99,39.99
1162,POP! Movie - A Nightmare On Elm Street - Freddy Kruger Syringes - Hot Topic Exclusive,CHRONOTOYS,23.99,
1163,POP! Movies - Bruce Lee Enter The Dragon Gold - BAIT Exclusive AnimeExpo / SDCC,CHRONOTOYS,49.99,
1164,POP! Movies - Bruce Lee Enter The Dragon White Pants - BAIT SDCC Exclusive,CHRONOTOYS,44.99,
