,NAME,STORE,ORIGINAL PRICE,SALE PRICE
4425,Arrested Development Pop! Vinyl Figure George-Michael Bluth,Fugitive Toys,$9.95,
4426,Arrested Development Pop! Vinyl Figure Gob Bluth,Fugitive Toys,$24.95,
4427,Arrested Development Pop! Vinyl Figure Good Grief Buster Bluth,Fugitive Toys,$9.95,
4428,Arrested Development Pop! Vinyl Figure Michael Bluth,Fugitive Toys,$9.95,
4429,Arrow The Television Series Pop! Vinyl Figure Black Canary,Fugitive Toys,$9.95,
4430,Arrow The Television Series Pop! Vinyl Figure Deathstroke,Fugitive Toys,$9.95,
4431,Arrow The Television Series Pop! Vinyl Figure Oliver Queen,Fugitive Toys,$9.95,
4432,Arrow The Television Series Pop! Vinyl Figure Speedy,Fugitive Toys,$9.95,
4433,Arrow The Television Series Pop! Vinyl Figure Speedy w/ Sword,Fugitive Toys,$9.95,
4434,Ash vs Evil Dead Pop! Vinyl Figure Ash,Fugitive Toys,Out of stock,
4435,Ash vs Evil Dead Pop! Vinyl Figure Kelly,Fugitive Toys,$9.95,
4436,Ash vs Evil Dead Pop! Vinyl Figure Pablo,Fugitive Toys,$9.95,
4437,Ash vs Evil Dead Pop! Vinyl Figure Ruby Knowby,Fugitive Toys,$9.95,
4438,Asia Pop! Vinyl Figure Blando [Astro Boy] Exclusive,Fugitive Toys,$19.99,
4439,Asia Pop! Vinyl Figure Bloody Aswang [Legendary Creatures & Myths] Exclusive,Fugitive Toys,$29.95,
4440,Asia Pop! Vinyl Figure Bora [Astro Boy] Exclusive,Fugitive Toys,$19.99,
4441,Asia Pop! Vinyl Figure Epsilon [Astro Boy] Exclusive,Fugitive Toys,Out of stock,
4442,Asia Pop! Vinyl Figure Flocked Dr. Ochanomizu [Astro Boy] Exclusive,Fugitive Toys,Out of stock,
4443,Asia Pop! Vinyl Figure Flocked Leo & Coco [Tezuka Osamu Official] Exclusive,Fugitive Toys,$29.95,
4444,Asia Pop! Vinyl Figure Flocked Tink [Osamu Tezuka Official] Exclusive,Fugitive Toys,Out of stock,
4445,Asia Pop! Vinyl Figure Glow in the Dark Tossakan [Legendary Creatures & Myths] Exclusive,Fugitive Toys,Out of stock,
4446,Asia Pop! Vinyl Figure Green Oni [Momotaro] Exclusive,Fugitive Toys,Out of stock,
4447,Asia Pop! Vinyl Figure Manny Pacquiao [Basketball Player],Fugitive Toys,Out of stock,
4448,Asia Pop! Vinyl Figure Monochrome Black Jack [Osamu Tezuka Official] Exclusive,Fugitive Toys,Out of stock,
4449,Asia Pop! Vinyl Figure Princess Sapphire [Osamu Tezuka Official] Exclusive,Fugitive Toys,Out of stock,
4450,Asia Pop! Vinyl Figure Ryu [Street Fighter],Fugitive Toys,$17.95,
4451,Asia Pop! Vinyl Figure Sharaku [Osamu Tezuka Official] Exclusive,Fugitive Toys,$19.99,
4452,Asia Pop! Vinyl Figure Stan Lee [Guan Yu],Fugitive Toys,$49.95,
4453,Assassin's Creed III Pop! Vinyl Figure Connor,Fugitive Toys,$19.95,
4454,Assassin's Creed III: Liberation Pop! Vinyl Figure Aveline de Grandpre,Fugitive Toys,$19.95,
4455,Assassin's Creed: Unity Pop! Vinyl Figure Elise,Fugitive Toys,$9.95,
4456,Atomic Blonde Pop! Vinyl Figure Lorraine White Coat (Chase) [565],Fugitive Toys,$34.95,
4457,Atomic Blonde Pop! Vinyl Figure Lorraine White Coat [565],Fugitive Toys,$9.95,
4458,Atomic Blonde Pop! Vinyl Figure Lorraine with Gun (Chase) [566],Fugitive Toys,$34.95,
4459,Atomic Blonde Pop! Vinyl Figure Lorraine with Gun [566],Fugitive Toys,$9.95,
4460,Attack on Titan Pop! Vinyl Figure Annie Leonhart,Fugitive Toys,$9.95,
4461,Batman the Animated Series Pop! Vinyl Figure Bane,Fugitive Toys,$9.95,
4462,Batman the Animated Series Pop! Vinyl Figure Batgirl,Fugitive Toys,$9.95,
4463,Batman the Animated Series Pop! Vinyl Figure Batman,Fugitive Toys,$9.95,
4464,Batman the Animated Series Pop! Vinyl Figure Batman Robot,Fugitive Toys,$9.95,
4465,Batman the Animated Series Pop! Vinyl Figure Batman Robot (Chase),Fugitive Toys,Out of stock,
4466,Batman the Animated Series Pop! Vinyl Figure Catwoman,Fugitive Toys,$9.95,
4467,Batman the Animated Series Pop! Vinyl Figure Clayface,Fugitive Toys,$9.95,
4468,Batman the Animated Series Pop! Vinyl Figure Harley Quinn,Fugitive Toys,$9.95,
4469,Batman the Animated Series Pop! Vinyl Figure Phantasm,Fugitive Toys,$9.95,
4470,Batman the Animated Series Pop! Vinyl Figure Poison Ivy,Fugitive Toys,$9.95,
4471,Batman the Animated Series Pop! Vinyl Figure Robin,Fugitive Toys,$9.95,
4472,Batman the Animated Series Pop! Vinyl Figure Scarecrow,Fugitive Toys,$9.95,
4473,Battlestar Galactica Pop! Vinyl Figure Captain Apollo,Fugitive Toys,$9.95,
4474,Battlestar Galactica Pop! Vinyl Figure Captain Apollo [Experiment in Terra Uniform] Toy Tokyo Exclusive,Fugitive Toys,Out of stock,
4475,Battlestar Galactica Pop! Vinyl Figure Commander Adama,Fugitive Toys,$9.95,
4476,Battlestar Galactica Pop! Vinyl Figure Lieutenant Starbuck,Fugitive Toys,$9.95,
4477,Baywatch Pop! Vinyl Figure C.J. Parker,Fugitive Toys,$9.95,
4478,Baywatch Pop! Vinyl Figure Mitch Buchannon,Fugitive Toys,$9.95,
4479,Bendy and the Ink Machine Pop! Vinyl Figure Alice Angel [281],Fugitive Toys,$9.95,
4480,Bendy and the Ink Machine Pop! Vinyl Figure Bendy [279],Fugitive Toys,Out of stock,
4481,Bendy and the Ink Machine Pop! Vinyl Figure Boris the Wolf [280],Fugitive Toys,$9.95,
4482,Bendy and the Ink Machine Pop! Vinyl Figure Dead Boris [290],Fugitive Toys,$9.95,
4483,Bendy and the Ink Machine Pop! Vinyl Figure Ink Bendy [289],Fugitive Toys,$9.95,
4484,Bendy and the Ink Machine Pop! Vinyl Figure Sammy Lawrence [282],Fugitive Toys,$9.95,
4485,Bendy and the Ink Machine Pop! Vinyl Figure Searcher [291],Fugitive Toys,$9.95,
4486,Bioshock Pop! Vinyl Figure Little Sister,Fugitive Toys,$24.95,
4487,Bioshock: Infinite Pop! Vinyl Figure Booker DeWitt,Fugitive Toys,$9.95,
4488,Bioshock: Infinite Pop! Vinyl Figure Booker DeWitt with Skyhook,Fugitive Toys,$9.95,
4489,Bioshock: Infinite Pop! Vinyl Figure Elizabeth,Fugitive Toys,$9.95,
4490,Blacklist Pop! Vinyl Figure Elizabeth Keen,Fugitive Toys,$9.95,
4491,Bob's Big Boy Pop! Vinyl Figure Bob (New Pose),Fugitive Toys,Out of stock,
4492,Bob's Burgers Pop! Vinyl Figure Bob Belcher,Fugitive Toys,Out of stock,
4493,Bob's Burgers Pop! Vinyl Figure Buttloose Tina,Fugitive Toys,$9.95,
4494,Bob's Burgers Pop! Vinyl Figure Linda Belcher,Fugitive Toys,$29.95,
4495,Bob's Burgers Pop! Vinyl Figure Louise Belcher,Fugitive Toys,Out of stock,
4496,BoJack Horseman Pop! Vinyl Figure Diane Nguyen [229],Fugitive Toys,$9.95,
4497,BoJack Horseman Pop! Vinyl Figure Mr. Peanutbutter [230],Fugitive Toys,$9.95,
4498,BoJack Horseman Pop! Vinyl Figure Princess Carolyn [231],Fugitive Toys,$9.95,
4499,BoJack Horseman Pop! Vinyl Figure Todd Chavez [232],Fugitive Toys,$9.95,
4500,Books Pop! Vinyl Figure Cat in the Hat [Dr. Seuss],Fugitive Toys,$9.95,
4501,Books Pop! Vinyl Figure Fox in Socks [Dr. Seuss],Fugitive Toys,$9.95,
4502,Books Pop! Vinyl Figure Max the Dog [Dr. Seuss The Grinch] [13],Fugitive Toys,$9.95,
4503,Books Pop! Vinyl Figure Sam I Am [Dr. Seuss],Fugitive Toys,$9.95,
4504,Books Pop! Vinyl Figure Sam's Friend [Dr. Seuss],Fugitive Toys,$9.95,
4505,Books Pop! Vinyl Figure The Grinch (Chase) [Dr. Seuss The Grinch] [12],Fugitive Toys,$34.95,
4506,Books Pop! Vinyl Figure The Grinch [Dr. Seuss The Grinch] [12],Fugitive Toys,$9.95,
4507,Borderlands Pop! Vinyl Figure Lilith The Siren,Fugitive Toys,$9.95,
4508,Borderlands Pop! Vinyl Figure Mad Moxxi,Fugitive Toys,$9.95,
4509,Borderlands Pop! Vinyl Figure Psycho,Fugitive Toys,$9.95,
4510,Breezly and Sneezly Pop! Vinyl Figure Breezly [277],Fugitive Toys,$9.95,
4511,Breezly and Sneezly Pop! Vinyl Figure Sneezly [278],Fugitive Toys,$9.95,
4512,Bright Pop! Vinyl Figure Daryl Ward [558],Fugitive Toys,$9.95,
4513,Bright Pop! Vinyl Figure Daryl Ward [Chase] [558],Fugitive Toys,$34.95,
4514,Bright Pop! Vinyl Figure Nick Jakoby with Gun [560],Fugitive Toys,$9.95,
4515,Bright Pop! Vinyl Figure Tikka with Wand [559],Fugitive Toys,$9.95,
4516,Buffy The Vampire Slayer 20th Anniversary Pop! Vinyl Figure Buffy [594],Fugitive Toys,$9.95,
4517,Buffy The Vampire Slayer 20th Anniversary Pop! Vinyl Figure Dark Willow [598],Fugitive Toys,$9.95,
4518,Buffy The Vampire Slayer 20th Anniversary Pop! Vinyl Figure Faith [597],Fugitive Toys,$9.95,
4519,Buffy The Vampire Slayer 20th Anniversary Pop! Vinyl Figure Giles [596],Fugitive Toys,$9.95,
4520,Buffy The Vampire Slayer 20th Anniversary Pop! Vinyl Figure Xander (Chase) [595],Fugitive Toys,$34.95,
4521,Buffy The Vampire Slayer 20th Anniversary Pop! Vinyl Figure Xander [595],Fugitive Toys,$9.95,
4522,Buffy The Vampire Slayer Pop! Vinyl Figure Buffy & Faith 2-pack [NYCC 2017 Exclusive] [2],Fugitive Toys,$34.95,
4523,Bullet Club Pop! Vinyl Figure Kenny Omega [01],Fugitive Toys,$9.95,
4524,Bullet Club Pop! Vinyl Figure The American Nightmare Cody [02],Fugitive Toys,$9.95,
4525,Care Bears Pop! Vinyl Figure Cheer Bear [351],Fugitive Toys,$9.95,
4526,Care Bears Pop! Vinyl Figure Cheer Bear [Chase] [351],Fugitive Toys,$34.95,
4527,Care Bears Pop! Vinyl Figure Funshine Bear [356],Fugitive Toys,$9.95,
4528,Care Bears Pop! Vinyl Figure Funshine Bear [Chase] [356],Fugitive Toys,$34.95,
4529,Care Bears Pop! Vinyl Figure Good Luck Bear [355],Fugitive Toys,$9.95,
4530,Care Bears Pop! Vinyl Figure Good Luck Bear [Chase] [355],Fugitive Toys,$34.95,
4531,Care Bears Pop! Vinyl Figure Love-A-Lot Bear [354],Fugitive Toys,$9.95,
4532,Care Bears Pop! Vinyl Figure Tenderheart Bear [352],Fugitive Toys,$9.95,
4533,Carmen Sandiego Pop! Vinyl Figure Carmen Sandiego [662],Fugitive Toys,$9.95,
4534,Cartoon Hangover Bravest Warriors Pop! Vinyl Figure Commander Catbug [Entertainment Earth Exclusive],Fugitive Toys,$12.99,
4535,Cartoon Hangover Bravest Warriors Pop! Vinyl Figure Impossibear,Fugitive Toys,$9.95,
4536,Children's Hospital Pop! Vinyl Figure Dr. Blake Downs [43],Fugitive Toys,$9.95,
4537,Comics Pop! Vinyl Figure Abe Sapien [Hellboy] [03],Fugitive Toys,$9.95,
4538,Comics Pop! Vinyl Figure Alana with Baby Hazel [Saga] [Specialty Series] [13],Fugitive Toys,$12.95,
4539,Comics Pop! Vinyl Figure Alana with Gun [Saga] [8],Fugitive Toys,$9.95,
4540,Comics Pop! Vinyl Figure Hellboy with Excalibur [Previews Exclusive] [14],Fugitive Toys,Out of stock,
4541,Comics Pop! Vinyl Figure Hellboy [Hellboy] [01],Fugitive Toys,Out of stock,
4542,Comics Pop! Vinyl Figure Liz Sherman [Hellboy] [02],Fugitive Toys,$9.95,
4543,Comics Pop! Vinyl Figure Lobster Johnson [Hellboy] [04],Fugitive Toys,$9.95,
4544,Comics Pop! Vinyl Figure Marko with Sword [Saga] [7],Fugitive Toys,$9.95,
4545,Comics Pop! Vinyl Figure Nimue The Queen of Blood [Hellboy] [06],Fugitive Toys,$9.95,
4546,Comics Pop! Vinyl Figure Prince Robot IV [Saga] [9],Fugitive Toys,$9.95,
4547,Comics Pop! Vinyl Figure Rasputin [Hellboy] [05],Fugitive Toys,$9.95,
4548,Comics Pop! Vinyl Figure The Will (Chase) [Saga] [10],Fugitive Toys,$34.95,
4549,Comics Pop! Vinyl Figure The Will [Saga] [10],Fugitive Toys,$9.95,
4550,Coraline Pop! Vinyl Figure Coraline as a Doll [425],Fugitive Toys,Out of stock,
4551,Coraline Pop! Vinyl Figure Coraline in Raincoat (Chase) [423],Fugitive Toys,Out of stock,
4552,Coraline Pop! Vinyl Figure Coraline in Raincoat [423],Fugitive Toys,Out of stock,
4553,Coraline Pop! Vinyl Figure Coraline with Cat [422],Fugitive Toys,Out of stock,
4554,Coraline Pop! Vinyl Figure Mr. Bobinsky with Mouse [426],Fugitive Toys,Out of stock,
4555,Coraline Pop! Vinyl Figure The Other Mother [427],Fugitive Toys,Out of stock,
4556,Cowboy Bebop Pop! Vinyl Figure Jet,Fugitive Toys,Out of stock,
4557,Crash Bandicoot Pop! Vinyl Figure Crash Bandicoot (Chase) [273],Fugitive Toys,$34.95,
4558,Crash Bandicoot Pop! Vinyl Figure Crash Bandicoot [273],Fugitive Toys,$9.95,
4559,Crash Bandicoot Pop! Vinyl Figure Dr. Neo Cortex [276],Fugitive Toys,$9.95,
4560,Cuphead Pop! Vinyl Figure Cuphead (Chase) [310],Fugitive Toys,$34.95,
4561,Cuphead Pop! Vinyl Figure Cuphead [310],Fugitive Toys,$9.95,
4562,Cuphead Pop! Vinyl Figure King Dice (Chase) [313],Fugitive Toys,$34.95,
4563,Cuphead Pop! Vinyl Figure King Dice [313],Fugitive Toys,$9.95,
4564,Cuphead Pop! Vinyl Figure Legendary Chalice [314],Fugitive Toys,$9.95,
4565,Cuphead Pop! Vinyl Figure The Devil [312],Fugitive Toys,$9.95,
4566,D.I.Y. Pop! Vinyl Figure Female,Fugitive Toys,$9.95,
4567,D.I.Y. Pop! Vinyl Figure Male,Fugitive Toys,Out of stock,
4568,DC Comics Bombshells Pop! Vinyl Figure Batgirl,Fugitive Toys,$9.95,
4569,DC Comics Bombshells Pop! Vinyl Figure Batwoman [221],Fugitive Toys,$9.95,
4570,DC Comics Bombshells Pop! Vinyl Figure Catwoman [225],Fugitive Toys,$9.95,
4571,DC Comics Bombshells Pop! Vinyl Figure Harley Quinn,Fugitive Toys,Out of stock,
4572,DC Comics Bombshells Pop! Vinyl Figure Hawkgirl [223],Fugitive Toys,$9.95,
4573,DC Comics Bombshells Pop! Vinyl Figure Poison Ivy [224],Fugitive Toys,$9.95,
4574,DC Comics Bombshells Pop! Vinyl Figure Supergirl [222],Fugitive Toys,$9.95,
4575,DC Comics Bombshells Pop! Vinyl Katana,Fugitive Toys,$9.95,
4576,DC Comics Bombshells Pop! Vinyl Wonder Woman,Fugitive Toys,$9.95,
4577,DC Comics Pop! Vinyl Batman Impopster Harley Quinn,Fugitive Toys,$9.95,
4578,DC Comics Pop! Vinyl Batman Impopster Harley Quinn Batgirl,Fugitive Toys,$9.95,
4579,DC Comics Pop! Vinyl Batman Impopster Penguin,Fugitive Toys,$9.95,
4580,DC Comics Pop! Vinyl Batman Impopster Poison Ivy,Fugitive Toys,$9.95,
4581,DC Comics Pop! Vinyl Batman Impopster Riddler,Fugitive Toys,$9.95,
4582,DC Comics Pop! Vinyl Batman Impopster Scarecrow,Fugitive Toys,$9.95,
4583,DC Comics Pop! Vinyl Batman Impopster Two-Face,Fugitive Toys,$9.95,
4584,DC Comics Pop! Vinyl Batman v Superman - Aquaman,Fugitive Toys,$9.95,
4585,DC Comics Pop! Vinyl Batman v Superman - Aquaman (Aqua),Fugitive Toys,$19.95,
4586,DC Comics Pop! Vinyl Batman v Superman - Batman,Fugitive Toys,$9.95,
4587,"DC Comics Pop! Vinyl Batman v Superman - Doomsday 6"" [SDCC 2016 Exclusive]",Fugitive Toys,$34.95,
4588,DC Comics Pop! Vinyl Batman v Superman - Superman,Fugitive Toys,$9.95,
4589,DC Comics Pop! Vinyl Batman v Superman - Superman Soilder,Fugitive Toys,$9.95,
4590,DC Comics Pop! Vinyl Batman v Superman - Wonder Woman,Fugitive Toys,$9.95,
4591,DC Comics Pop! Vinyl Figure Batgirl 2016,Fugitive Toys,$9.95,
4592,DC Comics Pop! Vinyl Figure Black Manta,Fugitive Toys,Out of stock,
4593,DC Comics Pop! Vinyl Figure Cyborg,Fugitive Toys,$9.95,
4594,DC Comics Pop! Vinyl Figure Firestorm,Fugitive Toys,$9.95,
4595,DC Comics Pop! Vinyl Figure Power Girl,Fugitive Toys,$9.95,
4596,DC Comics Pop! Vinyl Figure Super Girl,Fugitive Toys,$9.95,
4597,DC Comics Pop! Vinyl Lobo [PX Exclusive] [231],Fugitive Toys,$12.95,
4598,DC Comics Pop! Vinyl Metallic Batman V Superman 2 Pack [Exclusive],Fugitive Toys,$34.95,
4599,DC Heroes Pop! Vinyl Figure Classic Batman,Fugitive Toys,$9.95,
4600,DC Heroes Pop! Vinyl Figure Earth 1 Batman,Fugitive Toys,$9.95,
4601,DC Heroes Pop! Vinyl Figure North Pole Camo Batman,Fugitive Toys,Out of stock,
4602,DC Heroes Pop! Vinyl Figure Super Friends Batman,Fugitive Toys,$9.95,
4603,DC Pop! Vinyl Figure White Lantern: Kyle Rayner GITD [Fugitive Toys Exclusive] [237],Fugitive Toys,Out of stock,
4604,DC Pop! Vinyl Figure White Lantern: Kyle Rayner [Fugitive Toys Exclusive] [237],Fugitive Toys,Out of stock,
4605,DC Universe Pop! Vinyl Figure Arkham Knight,Fugitive Toys,$9.95,
4606,DC Universe Pop! Vinyl Figure Batgirl [03],Fugitive Toys,$99.95,
4607,DC Universe Pop! Vinyl Figure Batman 75th Anniversary Rainbow Set [Entertainment Earth Exclusive],Fugitive Toys,$79.95,
4608,DC Universe Pop! Vinyl Figure Batman Beyond [33],Fugitive Toys,Out of stock,
4609,DC Universe Pop! Vinyl Figure Batman [Arkham Knight],Fugitive Toys,$9.95,
4610,DC Universe Pop! Vinyl Figure Batman [Batman: Arkham Asylum],Fugitive Toys,$9.95,
4611,DC Universe Pop! Vinyl Figure Black Batman [01],Fugitive Toys,$9.95,
4612,DC Universe Pop! Vinyl Figure Blackest Night Batman [Exclusive],Fugitive Toys,$29.99,
4613,DC Universe Pop! Vinyl Figure Blue Batman 75th Anniversary Rainbow [Entertainment Earth Exclusive],Fugitive Toys,$14.95,
4614,DC Universe Pop! Vinyl Figure Blue Batman [Batman: Arkham Asylum] Exclusive,Fugitive Toys,$19.95,
4615,DC Universe Pop! Vinyl Figure Bruce Wayne [Gotham],Fugitive Toys,$9.95,
4616,DC Universe Pop! Vinyl Figure Earth 2 Batman [Exclusive],Fugitive Toys,Out of stock,
4617,DC Universe Pop! Vinyl Figure Fish Mooney [Gotham],Fugitive Toys,$9.95,
4618,DC Universe Pop! Vinyl Figure Glow in the Dark Swamp Thing [Previews Exclusive],Fugitive Toys,Out of stock,
4619,DC Universe Pop! Vinyl Figure Harley Quinn w/ Mallet,Fugitive Toys,$9.95,
4620,DC Universe Pop! Vinyl Figure Harley Quinn [34],Fugitive Toys,Out of stock,
4621,DC Universe Pop! Vinyl Figure Harley Quinn [Arkham Knight],Fugitive Toys,$9.95,
4622,DC Universe Pop! Vinyl Figure Harvey Bullock [Gotham],Fugitive Toys,$9.95,
4623,DC Universe Pop! Vinyl Figure James Gordon [Gotham],Fugitive Toys,$9.95,
4624,DC Universe Pop! Vinyl Figure Killer Croc [Batman: Arkham Asylum],Fugitive Toys,$14.95,
4625,DC Universe Pop! Vinyl Figure Metallic Deathstroke [Previews Exclusive],Fugitive Toys,$34.95,
4626,DC Universe Pop! Vinyl Figure New 52 Batman [Previews Exclusive],Fugitive Toys,$10.99,
4627,DC Universe Pop! Vinyl Figure New 52 Superman [Previews Exclusive],Fugitive Toys,$10.99,
4628,DC Universe Pop! Vinyl Figure Orange Batman 75th Anniversary Rainbow [Entertainment Earth Exclusive],Fugitive Toys,$14.95,
4629,DC Universe Pop! Vinyl Figure Purple Batman 75th Anniversary Rainbow [Entertainment Earth Exclusive],Fugitive Toys,$14.95,
4630,DC Universe Pop! Vinyl Figure Robin [02],Fugitive Toys,$9.95,
4631,DC Universe Pop! Vinyl Figure Scarecrow [Arkham Knight],Fugitive Toys,$9.95,
4632,DC Universe Pop! Vinyl Figure Selina Kyle [Gotham],Fugitive Toys,$9.95,
4633,DC Universe Pop! Vinyl Figure Sinestro [12],Fugitive Toys,$99.95,
4634,DC Universe Pop! Vinyl Figure Superman [07],Fugitive Toys,$9.95,
4635,DC Universe Pop! Vinyl Figure Swamp Thing [Previews Exclusive],Fugitive Toys,$12.99,
4636,DC Universe Pop! Vinyl Figure The Flash [10],Fugitive Toys,$9.95,
4637,DC Universe Pop! Vinyl Figure The Joker [06],Fugitive Toys,$9.95,
4638,DC Universe Pop! Vinyl Figure Wonder Woman [08],Fugitive Toys,Out of stock,
4639,DC Universe Pop! Vinyl Figure Yellow Batman 75th Anniversary Rainbow [Entertainment Earth Exclusive],Fugitive Toys,$14.95,
4640,Death Note Pop! Vinyl Figure Light,Fugitive Toys,$9.95,
4641,Despicable Me 2 Pop! Vinyl Figure Carl [35],Fugitive Toys,$9.95,
4642,Despicable Me 2 Pop! Vinyl Figure Dave [36],Fugitive Toys,$9.95,
4643,Despicable Me 2 Pop! Vinyl Figure Glow-in-the-Dark Hula Minion [NYCC 2015 Exclusive],Fugitive Toys,$17.99,
4644,Despicable Me 2 Pop! Vinyl Figure Hula Minion,Fugitive Toys,$9.95,
4645,Despicable Me 2 Pop! Vinyl Figure Mustache Carl [Entertainment Earth Exclusive],Fugitive Toys,$14.95,
4646,Destiny Pop! Vinyl Figure Amanda Holliday [338],Fugitive Toys,$9.95,
4647,Destiny Pop! Vinyl Figure Dominus Ghaul [343],Fugitive Toys,$9.95,
4648,Destiny Pop! Vinyl Figure Hawthorne with Hawk [337],Fugitive Toys,$9.95,
4649,Destiny Pop! Vinyl Figure Oryx,Fugitive Toys,$9.95,
4650,Destiny Pop! Vinyl Figure Osiris [339],Fugitive Toys,$9.95,
4651,Destiny Pop! Vinyl Figure Zavala,Fugitive Toys,$9.95,
4652,Diablo III Pop! Vinyl Figure Diablo,Fugitive Toys,$9.95,
4653,Digimon Pop! Vinyl Figure Agumon [429],Fugitive Toys,$9.95,
4654,Digimon Pop! Vinyl Figure Matt [430],Fugitive Toys,$9.95,
4655,Digimon Pop! Vinyl Figure Tai [428],Fugitive Toys,$9.95,
4656,Director Pop! Vinyl Figure Guillermo del Toro,Fugitive Toys,$9.95,
4657,Directors Pop! Vinyl Figure Alfred Hitchcock [624],Fugitive Toys,Out of stock,
4658,Disney Pop! Vinyl Figure 20th Anniversary Woody [Toy Story],Fugitive Toys,$9.95,
4659,Disney Pop! Vinyl Figure Abu [Aladdin] [353],Fugitive Toys,$9.95,
4660,Disney Pop! Vinyl Figure Aladdin [Aladdin] [352],Fugitive Toys,$9.95,
4661,Disney Pop! Vinyl Figure Alice Kingsleigh [Alice Through the Looking Glass],Fugitive Toys,$9.95,
4662,Disney Pop! Vinyl Figure Alice [Alice in Wonderland Live Action],Fugitive Toys,$9.95,
4663,Disney Pop! Vinyl Figure Anna [Frozen],Fugitive Toys,$9.95,
4664,Disney Pop! Vinyl Figure Apprentice Mickey [Mickey's 90th] [426],Fugitive Toys,$9.95,
4665,Disney Pop! Vinyl Figure Ariel (Gown) [The Little Mermaid],Fugitive Toys,$9.95,
4666,Disney Pop! Vinyl Figure Aurora (Chase) [325],Fugitive Toys,$34.95,
4667,Disney Pop! Vinyl Figure Aurora [325],Fugitive Toys,$9.95,
4668,Disney Pop! Vinyl Figure Baby Hercules [Hercules] [382],Fugitive Toys,$9.95,
4669,Disney Pop! Vinyl Figure Baby Pegasus [Hercules] [383],Fugitive Toys,$9.95,
4670,Disney Pop! Vinyl Figure Barbershop Quartet Olaf [Frozen] Exclusive,Fugitive Toys,$24.95,
4671,Disney Pop! Vinyl Figure Barbossa [Pirates of Caribbean],Fugitive Toys,$9.95,
4672,Disney Pop! Vinyl Figure Barrel [The Nightmare Before Christmas],Fugitive Toys,Out of stock,
4673,Disney Pop! Vinyl Figure Boo [Monsters Inc] [386],Fugitive Toys,$9.95,
4674,Disney Pop! Vinyl Figure Brave Little Tailor [Mickey's 90th] [429],Fugitive Toys,$9.95,
4675,Disney Pop! Vinyl Figure Broadway [Gargoyles] [393],Fugitive Toys,$9.95,
4676,Disney Pop! Vinyl Figure Bronx [Gargoyles] [394],Fugitive Toys,$9.95,
4677,Disney Pop! Vinyl Figure Brooklyn [Gargoyles] [392],Fugitive Toys,$9.95,
4678,Disney Pop! Vinyl Figure Captain Salazar (Chase) [PotC: Dead Men Tell No Tales],Fugitive Toys,$34.95,
4679,Disney Pop! Vinyl Figure Captain Salazar [PotC: Dead Men Tell No Tales],Fugitive Toys,$9.95,
4680,Disney Pop! Vinyl Figure Chip & Dale 2-Pack [Kingdom Hearts],Fugitive Toys,$24.95,
4681,Disney Pop! Vinyl Figure Cinderella (Gown) [Cinderella],Fugitive Toys,$9.95,
4682,Disney Pop! Vinyl Figure Clown [The Nightmare Before Christmas] [452],Fugitive Toys,$9.95,
4683,Disney Pop! Vinyl Figure Conductor Mickey [Mickey's 90th] [428],Fugitive Toys,$9.95,
4684,Disney Pop! Vinyl Figure Coronation Anna [Frozen],Fugitive Toys,Out of stock,
4685,Disney Pop! Vinyl Figure Cruz Ramirez [Cars 3],Fugitive Toys,$9.95,
4686,Disney Pop! Vinyl Figure Darkwing Duck [Darkwing Duck],Fugitive Toys,$9.95,
4687,Disney Pop! Vinyl Figure Dash [Incredibles 2] [366],Fugitive Toys,$9.95,
4688,Disney Pop! Vinyl Figure David Nix [Tomorrowland],Fugitive Toys,$9.95,
4689,Disney Pop! Vinyl Figure Davy Jones [Pirates of Caribbean],Fugitive Toys,$9.95,
4690,Disney Pop! Vinyl Figure Demona [Gargoyles] [390],Fugitive Toys,$9.95,
4691,Disney Pop! Vinyl Figure Dewey [Ducktales],Fugitive Toys,$9.95,
4692,Disney Pop! Vinyl Figure Donald [Kingdom Hearts],Fugitive Toys,Out of stock,
4693,Disney Pop! Vinyl Figure Dory [Finding Dory],Fugitive Toys,$9.95,
4694,Disney Pop! Vinyl Figure Dr. Finkelstein [The Nightmare Before Christmas] [451],Fugitive Toys,$9.95,
4695,Disney Pop! Vinyl Figure Dumbo [50],Fugitive Toys,Out of stock,
4696,Disney Pop! Vinyl Figure Eeyore [Winnie the Pooh],Fugitive Toys,$9.95,
4697,Disney Pop! Vinyl Figure Elastigirl [Incredibles 2] [364],Fugitive Toys,$9.95,
4698,Disney Pop! Vinyl Figure Elastigirl [The Incredibles] [29],Fugitive Toys,$179.95,
4699,Disney Pop! Vinyl Figure Ele-Finnick [Zootopia],Fugitive Toys,$9.95,
4700,Disney Pop! Vinyl Figure Elena [Elena of Avalor] [316],Fugitive Toys,$9.95,
4701,Disney Pop! Vinyl Figure Elizabeth Swann [Pirates of Caribbean],Fugitive Toys,$9.95,
4702,Disney Pop! Vinyl Figure Elsa [Frozen],Fugitive Toys,Out of stock,
4703,Disney Pop! Vinyl Figure Emile [Ratatouille],Fugitive Toys,$9.95,
4704,Disney Pop! Vinyl Figure Fear [Inside Out],Fugitive Toys,$9.95,
4705,Disney Pop! Vinyl Figure Firefighter Mickey [Mickey's 90th] [427],Fugitive Toys,$9.95,
4706,Disney Pop! Vinyl Figure Flik [A Bug's Life],Fugitive Toys,$9.95,
4707,Disney Pop! Vinyl Figure Flocked Remy (Chase) [Ratatouille],Fugitive Toys,$34.95,
4708,Disney Pop! Vinyl Figure Flocked Simba [The Lion King] Exclusive,Fugitive Toys,$29.95,
4709,Disney Pop! Vinyl Figure Flounder [The Little Mermaid],Fugitive Toys,$9.95,
4710,Disney Pop! Vinyl Figure Frank Walker [Tomorrowland],Fugitive Toys,$9.95,
4711,Disney Pop! Vinyl Figure Fred [Big Hero 6],Fugitive Toys,$9.95,
4712,Disney Pop! Vinyl Figure Frozone [Incredibles 2] [368],Fugitive Toys,$9.95,
4713,Disney Pop! Vinyl Figure Gaston [Beauty & The Beast],Fugitive Toys,$9.95,
4714,Disney Pop! Vinyl Figure Glitter Hair Joy [Inside Out] SDCC 2015 Exclusive,Fugitive Toys,Out of stock,
4715,Disney Pop! Vinyl Figure Goliath [Gargoyles] [389],Fugitive Toys,$9.95,
4716,Disney Pop! Vinyl Figure Goofy [Kingdom Hearts],Fugitive Toys,$9.95,
4717,Disney Pop! Vinyl Figure Gosalyn Mallard [Darkwing Duck],Fugitive Toys,$9.95,
4718,Disney Pop! Vinyl Figure Gramma Tala [Moana],Fugitive Toys,$9.95,
4719,Disney Pop! Vinyl Figure Hades [Hercules] [381],Fugitive Toys,$9.95,
4720,Disney Pop! Vinyl Figure Hank [Finding Dory],Fugitive Toys,$9.95,
4721,Disney Pop! Vinyl Figure Heffalump (Chase) [Winnie the Pooh],Fugitive Toys,Out of stock,
4722,Disney Pop! Vinyl Figure Heffalump (Exclusive) [Winnie the Pooh],Fugitive Toys,$29.95,
4723,Disney Pop! Vinyl Figure Heffalump [Winnie the Pooh],Fugitive Toys,$9.95,
4724,Disney Pop! Vinyl Figure Hercules (Chase) [Hercules] [378],Fugitive Toys,$34.95,
4725,Disney Pop! Vinyl Figure Hercules [Hercules] [378],Fugitive Toys,$9.95,
4726,Disney Pop! Vinyl Figure Hiro Hamada [Big Hero 6],Fugitive Toys,Out of stock,
4727,Disney Pop! Vinyl Figure Huey [Ducktales],Fugitive Toys,$9.95,
4728,Disney Pop! Vinyl Figure Isabel [Elena of Avalor] [317],Fugitive Toys,$9.95,
4729,Disney Pop! Vinyl Figure Jack Sparrow [Pirates of the Caribbean] [48],Fugitive Toys,$14.95,
4730,Disney Pop! Vinyl Figure Jack-Jack [Incredibles 2] [367],Fugitive Toys,$9.95,
4731,Disney Pop! Vinyl Figure Jafar in Red [Aladdin] [356],Fugitive Toys,$9.95,
4732,Disney Pop! Vinyl Figure Jasmine in Red [Aladdin] [354],Fugitive Toys,$9.95,
4733,Disney Pop! Vinyl Figure Jasmine [326],Fugitive Toys,Out of stock,
4734,Disney Pop! Vinyl Figure Kairi [Kingdom Hearts] [332],Fugitive Toys,$9.95,
4735,Disney Pop! Vinyl Figure Kristoff [Frozen],Fugitive Toys,$9.95,
