,NAME,STORE,ORIGINAL PRICE,SALE PRICE
3153,Movies Pop! Vinyl Figure Maria [The Book of Life],Fugitive Toys,$29.95,
3154,Movies Pop! Vinyl Figure Marv [Home Alone] [493],Fugitive Toys,$9.95,
3155,Movies Pop! Vinyl Figure Maude [The Big Lebowski],Fugitive Toys,$14.95,
3156,Movies Pop! Vinyl Figure Max Rockatansky [Mad Max: Fury Road] [509],Fugitive Toys,$9.95,
3157,Movies Pop! Vinyl Figure Metallic Optimus Prime [Transformers: Age of Extinction] Barnes & Noble Exclusive,Fugitive Toys,$29.95,
3158,Movies Pop! Vinyl Figure Michael Corleone [The Godfather],Fugitive Toys,$9.95,
3159,Movies Pop! Vinyl Figure Mike Hanlon [It] [572],Fugitive Toys,$9.95,
3160,Movies Pop! Vinyl Figure Morpheus [The Matrix],Fugitive Toys,$15.95,
3161,Movies Pop! Vinyl Figure Morton Schmidt [21 Jump Street],Fugitive Toys,$9.95,
3162,Movies Pop! Vinyl Figure Mother Ghost [Crimson Peak],Fugitive Toys,$9.95,
3163,Movies Pop! Vinyl Figure Mouth [The Goonies],Fugitive Toys,$34.95,
3164,Movies Pop! Vinyl Figure Napoleon [Napoleon Dynamite],Fugitive Toys,$24.95,
3165,Movies Pop! Vinyl Figure Neomorph with Toddler [Alien: Covenant],Fugitive Toys,$9.95,
3166,Movies Pop! Vinyl Figure Newt Scamander w/Egg [Fantastic Beasts],Fugitive Toys,$9.95,
3167,Movies Pop! Vinyl Figure Niffler [Fantastic Beasts],Fugitive Toys,$9.95,
3168,Movies Pop! Vinyl Figure Norman Bates [Psycho],Fugitive Toys,$9.95,
3169,Movies Pop! Vinyl Figure Nosferatu [Nosferatu],Fugitive Toys,$59.95,
3170,Movies Pop! Vinyl Figure Nux Shirtless [Mad Max: Fury Road] [512],Fugitive Toys,$9.95,
3171,Movies Pop! Vinyl Figure Oddjob [James Bond] [520],Fugitive Toys,$9.95,
3172,Movies Pop! Vinyl Figure Officer K [Blade Runner 2049] [476],Fugitive Toys,$9.95,
3173,Movies Pop! Vinyl Figure Ojeda [Assassin's Creed],Fugitive Toys,$9.95,
3174,Movies Pop! Vinyl Figure Papa Elf [Elf] [486],Fugitive Toys,$9.95,
3175,Movies Pop! Vinyl Figure Pedro [Napoleon Dynamite],Fugitive Toys,$14.95,
3176,Movies Pop! Vinyl Figure Peeta Mellark [The Hunger Games],Fugitive Toys,$9.95,
3177,Movies Pop! Vinyl Figure Pennywise [IT The Movie],Fugitive Toys,$9.95,
3178,Movies Pop! Vinyl Figure Pennywise with Boat (Chase) [It],Fugitive Toys,$99.95,
3179,Movies Pop! Vinyl Figure Pennywise with Spider Legs [It] [542],Fugitive Toys,$9.95,
3180,Movies Pop! Vinyl Figure Percival [Fantastic Beasts],Fugitive Toys,$9.95,
3181,Movies Pop! Vinyl Figure Petra [Ender's Game],Fugitive Toys,$9.95,
3182,Movies Pop! Vinyl Figure Pinhead [Hellraiser],Fugitive Toys,$9.95,
3183,Movies Pop! Vinyl Figure Pink Ranger,Fugitive Toys,$9.95,
3184,Movies Pop! Vinyl Figure Poet Anderson [Poet Anderson: The Dreamwalker],Fugitive Toys,$9.95,
3185,Movies Pop! Vinyl Figure President Snow [The Hunger Games],Fugitive Toys,$9.95,
3186,Movies Pop! Vinyl Figure Professor Poopypants [Captain Underpants],Fugitive Toys,$9.95,
3187,Movies Pop! Vinyl Figure Professor Shelly Oberom [Jumanji] [495],Fugitive Toys,$9.95,
3188,Movies Pop! Vinyl Figure Queenie Goldstein [Fantastic Beasts],Fugitive Toys,$9.95,
3189,Movies Pop! Vinyl Figure Red Ranger,Fugitive Toys,$9.95,
3190,Movies Pop! Vinyl Figure Regan [The Exorcist],Fugitive Toys,$9.95,
3191,Movies Pop! Vinyl Figure Richie Tozier [It] [540],Fugitive Toys,$9.95,
3192,Movies Pop! Vinyl Figure Rico [Penguins of Madagascar],Fugitive Toys,$9.95,
3193,Movies Pop! Vinyl Figure Robocop [22],Fugitive Toys,$39.95,
3194,Movies Pop! Vinyl Figure Roger Moore [James Bond] [522],Fugitive Toys,$9.95,
3195,Movies Pop! Vinyl Figure Sapper (Chase) [Blade Runner 2049] [480],Fugitive Toys,$34.95,
3196,Movies Pop! Vinyl Figure Sapper [Blade Runner 2049] [480],Fugitive Toys,$9.95,
3197,Movies Pop! Vinyl Figure Sark [Tron] [490],Fugitive Toys,$9.95,
3198,Movies Pop! Vinyl Figure Scarecrow [Wizard of Oz] [39],Fugitive Toys,$99.95,
3199,Movies Pop! Vinyl Figure Short Fuse [Penguins of Madagascar],Fugitive Toys,$9.95,
3200,Movies Pop! Vinyl Figure Slimer [Ghostbusters],Fugitive Toys,$19.95,
3201,Movies Pop! Vinyl Figure Smaug [The Hobbit: The Battle of the Five Armies],Fugitive Toys,$14.95,
3202,Movies Pop! Vinyl Figure Smaug Chase [The Hobbit: The Battle of the Five Armies],Fugitive Toys,$49.95,
3203,Movies Pop! Vinyl Figure Snacking Twins [Miss Peregrine's Home for Peculiar Children],Fugitive Toys,$19.95,
3204,Movies Pop! Vinyl Figure Sonny Corleone [The Godfather],Fugitive Toys,$9.95,
3205,Movies Pop! Vinyl Figure Spy Gru (Chase) [Despicable Me 3],Fugitive Toys,$34.95,
3206,Movies Pop! Vinyl Figure Spy Gru [Despicable Me 3],Fugitive Toys,$9.95,
3207,Movies Pop! Vinyl Figure Stanley Uris [It] [573],Fugitive Toys,$9.95,
3208,Movies Pop! Vinyl Figure Stay Domo [Ghostbusters],Fugitive Toys,$15.95,
3209,Movies Pop! Vinyl Figure Steve Hiller (Indepedence Day),Fugitive Toys,$9.95,
3210,Movies Pop! Vinyl Figure Swackhammer [Space Jam],Fugitive Toys,$9.95,
3211,Movies Pop! Vinyl Figure Taz (Chase) [Space Jam],Fugitive Toys,$34.95,
3212,Movies Pop! Vinyl Figure Taz [Space Jam],Fugitive Toys,$9.95,
3213,Movies Pop! Vinyl Figure Ted the Geek [Sixteen Candles],Fugitive Toys,$9.95,
3214,Movies Pop! Vinyl Figure The Crow,Fugitive Toys,$29.95,
3215,Movies Pop! Vinyl Figure The Gunslinger [The Dark Tower],Fugitive Toys,$9.95,
3216,Movies Pop! Vinyl Figure The Man in Black [The Dark Tower],Fugitive Toys,$9.95,
3217,Movies Pop! Vinyl Figure The Mummy [The Mummy 2017],Fugitive Toys,$9.95,
3218,Movies Pop! Vinyl Figure The Mummy [Universal Monsters],Fugitive Toys,$29.95,
3219,Movies Pop! Vinyl Figure The Valkyrie [Mad Max: Fury Road] [514],Fugitive Toys,$9.95,
3220,Movies Pop! Vinyl Figure Tiffany (Chase) [Bride of Chucky],Fugitive Toys,$34.95,
3221,Movies Pop! Vinyl Figure Tiffany [Bride of Chucky],Fugitive Toys,$9.95,
3222,Movies Pop! Vinyl Figure Tigress [Kung Fu Panda],Fugitive Toys,$9.95,
3223,Movies Pop! Vinyl Figure Tourist Dave [Despicable Me 3],Fugitive Toys,$9.95,
3224,Movies Pop! Vinyl Figure Tourist Jerry [Despicable Me 3],Fugitive Toys,$9.95,
3225,Movies Pop! Vinyl Figure Trinity [The Matrix],Fugitive Toys,$12.95,
3226,Movies Pop! Vinyl Figure Tron (Chase) [Tron] [489],Fugitive Toys,$34.95,
3227,Movies Pop! Vinyl Figure Tron [Tron] [489],Fugitive Toys,$9.95,
3228,Movies Pop! Vinyl Figure Uncle Rico [Napoleon Dynamite],Fugitive Toys,$14.95,
3229,Movies Pop! Vinyl Figure Valentine [Kingsman],Fugitive Toys,$9.95,
3230,Movies Pop! Vinyl Figure Valerian [Valerian],Fugitive Toys,$9.95,
3231,Movies Pop! Vinyl Figure Vincent Vega [Pulp Fiction],Fugitive Toys,$59.95,
3232,Movies Pop! Vinyl Figure Wallace [Blade Runner 2049] [478],Fugitive Toys,$9.95,
3233,Movies Pop! Vinyl Figure Wendy Torrance [The Shining],Fugitive Toys,$9.95,
3234,Movies Pop! Vinyl Figure Xenomorph [Alien: Covenant],Fugitive Toys,$9.95,
3235,Movies Pop! Vinyl Figure Yellow Ranger,Fugitive Toys,$9.95,
3236,Movies Pop! Vinyl The Fast and the Furious - Luke Hobbs,Fugitive Toys,$9.95,
3237,Mr. Bean Pop! Vinyl Figure Mr. Bean (Chase) [592],Fugitive Toys,$34.95,
3238,Mr. Bean Pop! Vinyl Figure Mr. Bean [592],Fugitive Toys,$9.95,
3239,Mr. Peabody & Sherman Pop! Vinyl Figure Mr. Peabody,Fugitive Toys,$20.95,
3240,Mr. Robot Pop! Vinyl Figure Angela Moss,Fugitive Toys,$9.95,
3241,Mr. Robot Pop! Vinyl Figure Darlene Alderson,Fugitive Toys,$9.95,
3242,Mr. Robot Pop! Vinyl Figure Elliot Alderson (Chase),Fugitive Toys,$34.95,
3243,Mr. Robot Pop! Vinyl Figure Mr. Robot,Fugitive Toys,$9.95,
3244,Mr. Robot Pop! Vinyl Figure White Rose,Fugitive Toys,$9.95,
3245,My Chemical Romance Pop! Vinyl Figure Black Parade Gerard Way,Fugitive Toys,$34.95,
3246,My Chemical Romance Pop! Vinyl Figure Revenge Gerard Way,Fugitive Toys,$14.95,
3247,My Hero Academia Pop! Vinyl Figure Deku Training [373],Fugitive Toys,$9.95,
3248,My Hero Academia Pop! Vinyl Figure Katsuki,Fugitive Toys,$9.95,
3249,My Hero Academia Pop! Vinyl Figure Tenya,Fugitive Toys,$129.95,
3250,My Little Pony Pop! Vinyl Figure Derpy [01],Fugitive Toys,$14.95,
3251,My Little Pony Pop! Vinyl Figure DJ Pon3 [05],Fugitive Toys,$9.95,
3252,My Little Pony Pop! Vinyl Figure Dr. Hooves,Fugitive Toys,$9.95,
3253,My Little Pony Pop! Vinyl Figure Fluttershy [02],Fugitive Toys,$9.95,
3254,My Little Pony Pop! Vinyl Figure Fluttershy Sea Pony [15],Fugitive Toys,$9.95,
3255,My Little Pony Pop! Vinyl Figure Pinkie Pie [03],Fugitive Toys,$19.95,
3256,My Little Pony Pop! Vinyl Figure Pinkie Pie Sea Pony [13],Fugitive Toys,$9.95,
3257,My Little Pony Pop! Vinyl Figure Princess Celestia,Fugitive Toys,$24.95,
3258,My Little Pony Pop! Vinyl Figure Rainbow Dash Sea Pony (Chase) [12],Fugitive Toys,$34.95,
3259,My Little Pony Pop! Vinyl Figure Rainbow Dash Sea Pony [12],Fugitive Toys,$9.95,
3260,My Little Pony Pop! Vinyl Figure Spitfire,Fugitive Toys,$9.95,
3261,My Little Pony Pop! Vinyl Figure Twilight Sparkle [06],Fugitive Toys,$9.95,
3262,My Little Pony Pop! Vinyl Figure Twilight Sparkle Sea Pony (Chase) [14],Fugitive Toys,$34.95,
3263,My Little Pony Pop! Vinyl Figure Twilight Sparkle Sea Pony [14],Fugitive Toys,$9.95,
3264,Mystery Science Theater 3000 Pop! Vinyl Figure Tom Servo,Fugitive Toys,$9.95,
3265,NBA Series 1 Pop! Vinyl Figure Derrick Rose [09],Fugitive Toys,$14.95,
3266,NBA Series 1 Pop! Vinyl Figure Lamarcus Aldridge [08],Fugitive Toys,$9.95,
3267,NBA Series 2 Pop! Vinyl Figure Chris Paul,Fugitive Toys,$19.95,
3268,NBA Series 2 Pop! Vinyl Figure Jeremy Lin (Rockets) [14],Fugitive Toys,$14.95,
3269,NBA Series 2 Pop! Vinyl Figure Kobe Bryant,Fugitive Toys,$59.95,
3270,NBA Series 3 Pop! Vinyl Figure Anthony Davis (Pelicans) [23],Fugitive Toys,$9.95,
3271,NBA Series 3 Pop! Vinyl Figure Chris Paul (Rockets) [35],Fugitive Toys,$9.95,
3272,NBA Series 3 Pop! Vinyl Figure Giannis Antetokounmpo (Bucks) [32],Fugitive Toys,$9.95,
3273,NBA Series 3 Pop! Vinyl Figure Gordon Hayward (Celtics) [37],Fugitive Toys,$9.95,
3274,NBA Series 3 Pop! Vinyl Figure Joel Embiid (76ers) [38],Fugitive Toys,$9.95,
3275,NBA Series 3 Pop! Vinyl Figure John Wall (Wizards) [26],Fugitive Toys,$9.95,
3276,NBA Series 3 Pop! Vinyl Figure Karl Anthony Towns (Wolves) [31],Fugitive Toys,$9.95,
3277,NBA Series 3 Pop! Vinyl Figure Kawhi Leonard (Spurs) [27],Fugitive Toys,$9.95,
3278,NBA Series 3 Pop! Vinyl Figure Kevin Durant (Warriors) [33],Fugitive Toys,$9.95,
3279,NBA Series 3 Pop! Vinyl Figure Klay Thompson (Warriors) [22],Fugitive Toys,$9.95,
3280,NBA Series 3 Pop! Vinyl Figure Kristaps Porzingis (Knicks) [28],Fugitive Toys,$9.95,
3281,NBA Series 3 Pop! Vinyl Figure Kyrie Irving (Cavs) [25],Fugitive Toys,$9.95,
3282,New Girl Pop! Vinyl Figure Cece Parekh [NYCC 2018 Exclusive] [710],Fugitive Toys,$14.95,
3283,New Girl Pop! Vinyl Figure Jess [648],Fugitive Toys,$9.95,
3284,New Girl Pop! Vinyl Figure Nick [651],Fugitive Toys,$9.95,
3285,New Girl Pop! Vinyl Figure Schmidt [649],Fugitive Toys,$9.95,
3286,New Girl Pop! Vinyl Figure Winston [650],Fugitive Toys,$9.95,
3287,NFL Legends Pop! Vinyl Figure Bart Starr (B&W) [Green Bay Packers] [116],Fugitive Toys,$9.95,
3288,NFL Legends Pop! Vinyl Figure Bart Starr [Green Bay Packers] [116],Fugitive Toys,$9.95,
3289,NFL Legends Pop! Vinyl Figure Brett Farve (Home) [Green Bay Packers] [83],Fugitive Toys,$9.95,
3290,NFL Legends Pop! Vinyl Figure Brian Bosworth [Seattle Seahawks] [113],Fugitive Toys,$9.95,
3291,NFL Legends Pop! Vinyl Figure Deion Sanders (Throwback) [Dallas Cowboys] [92],Fugitive Toys,$9.95,
3292,NFL Legends Pop! Vinyl Figure Drew Bledsoe [New England Patriots] [115],Fugitive Toys,$9.95,
3293,NFL Legends Pop! Vinyl Figure Jerome Bettis [Pittsburg Steelers] [117],Fugitive Toys,$9.95,
3294,NFL Legends Pop! Vinyl Figure Junior Seau [San Diego Chargers] [111],Fugitive Toys,$9.95,
3295,NFL Legends Pop! Vinyl Figure Terry Bradshaw (Home) [Pittsburg Steelers] [85],Fugitive Toys,$9.95,
3296,NFL Legends Pop! Vinyl Figure Troy Aikman [Dallas Cowboys] [112],Fugitive Toys,$9.95,
3297,NFL Legends Pop! Vinyl Figure Walter Payton (Home) [Chicago Bears] [78],Fugitive Toys,$9.95,
3298,NFL Pop! Vinyl Figure Dak Prescott [Dallas Cowboys] [67],Fugitive Toys,$9.95,
3299,NFL Pop! Vinyl Figure Deshaun Watson [Houston Texans] [94],Fugitive Toys,$9.95,
3300,NFL Pop! Vinyl Figure Drew Brees (Road Jersey) [New Orleans Saints] [11],Fugitive Toys,$9.95,
3301,NFL Pop! Vinyl Figure Ezekiel Elliott (Away) [Dallas Cowboys] [68],Fugitive Toys,$9.95,
3302,NFL Pop! Vinyl Figure Jadeveon Clowney [Houston Texans],Fugitive Toys,$9.95,
3303,NFL Pop! Vinyl Figure JJ Watt (Color Rush) [Houston Texans] [51],Fugitive Toys,$9.95,
3304,NFL Pop! Vinyl Figure Johnny Manziel [Cleveland Browns],Fugitive Toys,$9.95,
3305,NFL Pop! Vinyl Figure Julio Jones [Atlanta Falcons] [72],Fugitive Toys,$9.95,
3306,NFL Pop! Vinyl Figure Keenan Allen [Los Angeles Chargers] [105],Fugitive Toys,$9.95,
3307,NFL Pop! Vinyl Figure Leonard Fournette [Jacksonville Jaguars] [104],Fugitive Toys,$9.95,
3308,NFL Pop! Vinyl Figure LeSean McCoy [Philadelphia Eagles],Fugitive Toys,$9.95,
3309,NFL Pop! Vinyl Figure Matt Stafford [Detroit Lions] [102],Fugitive Toys,$9.95,
3310,NFL Pop! Vinyl Figure Richard Sherman [San Francisco 49ers] [100],Fugitive Toys,$9.95,
3311,NFL Pop! Vinyl Figure Richard Sherman [Seattle Seahawks],Fugitive Toys,$9.95,
3312,NFL Pop! Vinyl Figure Robert Griffin III [Washington Redskins],Fugitive Toys,$9.95,
3313,NFL Pop! Vinyl Figure Victor Cruz [New York Giants],Fugitive Toys,$9.95,
3314,NFL Pop! Vinyl Figure Von Miller [Denver Broncos] [60],Fugitive Toys,$9.95,
3315,NFL Wave 2 Pop! Vinyl Figure Jameis Winston [Tampa Bay Buccaneers],Fugitive Toys,$9.95,
3316,NFL Wave 2 Pop! Vinyl Figure Marcus Mariota [Tennessee Titans],Fugitive Toys,$9.95,
3317,NFL Wave 2 Pop! Vinyl Figure Russell Wilson [Seattle Seahawks],Fugitive Toys,$9.95,
3318,NFL Wave 3 Pop! Vinyl Figure Andrew Luck [Indianapolis Colts],Fugitive Toys,$9.95,
3319,NFL Wave 3 Pop! Vinyl Figure Cam Newton [Carolina Panthers],Fugitive Toys,$9.95,
3320,NFL Wave 3 Pop! Vinyl Figure Dez Bryant [Dallas Cowboys],Fugitive Toys,$9.95,
3321,NFL Wave 3 Pop! Vinyl Figure J.J. Watt [Houston Texans],Fugitive Toys,$9.95,
3322,NFL Wave 3 Pop! Vinyl Figure Luke Kuechly [Carolina Panthers],Fugitive Toys,$9.95,
3323,NFL Wave 3 Pop! Vinyl Figure Marcus Mariota [Tennessee Titans],Fugitive Toys,$9.95,
3324,NFL Wave 3 Pop! Vinyl Figure Odell Beckham Jr [New York Giants],Fugitive Toys,$9.95,
3325,NFL Wave 3 Pop! Vinyl Figure Richard Sherman [Seattle Seahawks],Fugitive Toys,$9.95,
3326,NFL Wave 3 Pop! Vinyl Figure Russell Wilson [Seattle Seahawks],Fugitive Toys,$9.95,
3327,NFL Wave 3 Pop! Vinyl Figure Todd Gurley [Los Angeles Rams],Fugitive Toys,$9.95,
3328,NFL Wave 3 Pop! Vinyl Figure Tom Brady [New England Patriots],Fugitive Toys,$14.95,
3329,NFL Wave 3 Pop! Vinyl Figure Von Miller [Denver Broncos],Fugitive Toys,$9.95,
3330,NFL Wave 4 Pop! Vinyl Figure Aaron Rodgers (Color Rush) [Green Bay Packers] [43],Fugitive Toys,$14.95,
3331,NFL Wave 4 Pop! Vinyl Figure Marshawn Lynch (Home) [Oakland Raiders] [77],Fugitive Toys,$9.95,
3332,NHL Pop! Vinyl Figure Carey Price [Montreal Canadiens],Fugitive Toys,$9.95,
3333,NHL Pop! Vinyl Figure Morgan Rielly [Toronto Maple Leafs],Fugitive Toys,$9.95,
3334,NHL Pop! Vinyl Figure Patrick Kane [Chicago Blackhawks],Fugitive Toys,$9.95,
3335,NHL Pop! Vinyl Figure Steve Stamkos [Tampa Bay Lightning],Fugitive Toys,$9.95,
3336,Ni No Kuni 2 Pop! Vinyl Figure Evan with Higgledy [328],Fugitive Toys,$9.95,
3337,Ni No Kuni 2 Pop! Vinyl Figure Roland with Higgledy [330],Fugitive Toys,$9.95,
3338,Ni No Kuni 2 Pop! Vinyl Figure Tani with Higgledy [329],Fugitive Toys,$9.95,
3339,Once Upon A Time Pop! Vinyl Figure Belle,Fugitive Toys,$9.95,
3340,Once Upon A Time Pop! Vinyl Figure Prince Charming,Fugitive Toys,$9.95,
3341,Once Upon A Time Pop! Vinyl Figure Zelena,Fugitive Toys,$9.95,
3342,One Piece Live Pop! Vinyl Figure Donquixote Doflamingo [400],Fugitive Toys,$9.95,
3343,One Piece Live Pop! Vinyl Figure Nico Robin [399],Fugitive Toys,$9.95,
3344,One Piece Live Pop! Vinyl Figure Usopp [401],Fugitive Toys,$9.95,
3345,One Piece Live Pop! Vinyl Figure Vinsmoke Sanji [398],Fugitive Toys,$9.95,
3346,One Punch Man Pop! Vinyl Figure Lord Boros,Fugitive Toys,$9.95,
3347,One Punch Man Pop! Vinyl Figure Saitama,Fugitive Toys,$9.95,
3348,Orange is the New Black Pop! Vinyl Figure George 'Pornstache' Mendez,Fugitive Toys,$9.95,
3349,Orphan Black Pop! Vinyl Figure Alison Hendrix,Fugitive Toys,$9.95,
3350,Orphan Black Pop! Vinyl Figure Helena,Fugitive Toys,$14.95,
3351,Orphan Black Pop! Vinyl Figure Rachel Duncan,Fugitive Toys,$9.95,
3352,Ouran High School Host Club Pop! Vinyl Figure Haruhi,Fugitive Toys,$9.95,
3353,Ouran High School Host Club Pop! Vinyl Figure Kyoya,Fugitive Toys,$9.95,
3354,Ouran High School Host Club Pop! Vinyl Figure Tamaki,Fugitive Toys,$9.95,
3355,Outlander Pop! Vinyl Figure Frank Randall,Fugitive Toys,$9.95,
3356,Overwatch Pop! Vinyl Figure Ana [349],Fugitive Toys,$9.95,
3357,Overwatch Pop! Vinyl Figure D.VA with MEKA [6-Inch],Fugitive Toys,$24.95,
3358,Overwatch Pop! Vinyl Figure Doomfist [351],Fugitive Toys,$9.95,
3359,Overwatch Pop! Vinyl Figure Genji [347],Fugitive Toys,$9.95,
3360,Overwatch Pop! Vinyl Figure Hanzo [348],Fugitive Toys,$9.95,
3361,Overwatch Pop! Vinyl Figure Junkrat [308],Fugitive Toys,$9.95,
3362,Overwatch Pop! Vinyl Figure Lucio,Fugitive Toys,$9.95,
3363,Overwatch Pop! Vinyl Figure McCree,Fugitive Toys,$9.95,
3364,Overwatch Pop! Vinyl Figure Mei,Fugitive Toys,$9.95,
3365,Overwatch Pop! Vinyl Figure Mercy [304],Fugitive Toys,$9.95,
3366,Overwatch Pop! Vinyl Figure Orisa [6-Inch] [352],Fugitive Toys,$14.95,
3367,Overwatch Pop! Vinyl Figure Reaper,Fugitive Toys,$9.95,
3368,Overwatch Pop! Vinyl Figure Sombra [307],Fugitive Toys,$9.95,
3369,Overwatch Pop! Vinyl Figure Symmetra,Fugitive Toys,$9.95,
3370,Overwatch Pop! Vinyl Figure Torbjorn [350],Fugitive Toys,$9.95,
3371,Overwatch Pop! Vinyl Figure Tracer,Fugitive Toys,$9.95,
3372,Overwatch Pop! Vinyl Figure Widowmaker,Fugitive Toys,$9.95,
3373,Overwatch Pop! Vinyl Figure Zarya [306],Fugitive Toys,$9.95,
3374,Overwatch Pop! Vinyl Figure Zenyatta [305],Fugitive Toys,$9.95,
3375,Pac-Man Pop! Vinyl Figure Blue Ghost,Fugitive Toys,$17.95,
3376,Pac-Man Pop! Vinyl Figure Clyde,Fugitive Toys,$9.95,
3377,Pac-Man Pop! Vinyl Figure Inky,Fugitive Toys,$9.95,
3378,Pac-Man Pop! Vinyl Figure Ms. Pac-Man,Fugitive Toys,$9.95,
3379,Pac-Man Pop! Vinyl Figure Pac-Man,Fugitive Toys,$9.95,
3380,Pac-Man Pop! Vinyl Figure Pinky,Fugitive Toys,$9.95,
3381,Pan's Labyrinth Pop! Vinyl Figure Fauno [603],Fugitive Toys,$9.95,
3382,Pan's Labyrinth Pop! Vinyl Figure Pale Man [604],Fugitive Toys,$9.95,
3383,Parks and Recreation Pop! Vinyl Figure April Ludgate,Fugitive Toys,$9.95,
3384,Parks and Recreation Pop! Vinyl Figure Ron Swanson,Fugitive Toys,$9.95,
3385,Peanuts Pop! Vinyl Figure Sally Brown,Fugitive Toys,$9.95,
3386,Pets Pop! Vinyl Figure French Labrador Retriever (Chocolate),Fugitive Toys,$9.95,
3387,Pets Pop! Vinyl Figure Maine Coon,Fugitive Toys,$9.95,
3388,Pinky and the Brain Pop! Vinyl The Brain,Fugitive Toys,$19.95,
3389,Popeye Pop! Vinyl Figure Popeye [369],Fugitive Toys,$19.95,
3390,Portal 2 Pop! Vinyl Figure Atlas [245],Fugitive Toys,$9.95,
3391,Portal 2 Pop! Vinyl Figure Chell with Portal Gun [243],Fugitive Toys,$9.95,
3392,Portal 2 Pop! Vinyl Figure P-Body [246],Fugitive Toys,$9.95,
3393,Portal 2 Pop! Vinyl Figure Turret [244],Fugitive Toys,$9.95,
3394,Power Rangers Pop! Vinyl Figure Black Gold Megazord [Morphicon] [6-Inch] [497],Fugitive Toys,$69.95,
3395,Power Rangers Pop! Vinyl Figure Black Ranger,Fugitive Toys,$9.95,
3396,Power Rangers Pop! Vinyl Figure Blue Ranger,Fugitive Toys,$9.95,
3397,Power Rangers Pop! Vinyl Figure Goldar [667],Fugitive Toys,$9.95,
3398,Power Rangers Pop! Vinyl Figure Lord Zedd [666],Fugitive Toys,$9.95,
3399,Power Rangers Pop! Vinyl Figure Red Ranger Jason [670],Fugitive Toys,$9.95,
3400,Power Rangers Pop! Vinyl Figure Yellow Ranger,Fugitive Toys,$9.95,
3401,Powerpuff Girls Pop! Vinyl Figure Blossom,Fugitive Toys,$9.95,
3402,Powerpuff Girls Pop! Vinyl Figure Buttercup,Fugitive Toys,$9.95,
3403,Powerpuff Girls Pop! Vinyl Figure Him,Fugitive Toys,$9.95,
3404,Powerpuff Girls Pop! Vinyl Figure Mojo Jojo,Fugitive Toys,$9.95,
3405,Q*bert Pop! Vinyl Figure Q*bert,Fugitive Toys,$9.95,
3406,Ready Player One Pop! Vinyl Figure Aech [498],Fugitive Toys,$9.95,
3407,Ready Player One Pop! Vinyl Figure Art3mis [497],Fugitive Toys,$9.95,
3408,Ready Player One Pop! Vinyl Figure Daito [499],Fugitive Toys,$9.95,
3409,Ready Player One Pop! Vinyl Figure i-r0k [502],Fugitive Toys,$9.95,
3410,Ready Player One Pop! Vinyl Figure Iron Giant [557],Fugitive Toys,$9.95,
3411,Ready Player One Pop! Vinyl Figure Parzival [496],Fugitive Toys,$9.95,
3412,Ready Player One Pop! Vinyl Figure Sho [500],Fugitive Toys,$9.95,
3413,Ready Player One Pop! Vinyl Figure Sixer [503],Fugitive Toys,$9.95,
3414,Ready Player One Pop! Vinyl Figure Sorrento [501],Fugitive Toys,$9.95,
3415,Ren & Stimpy Pop! Vinyl Figure Ren,Fugitive Toys,$9.95,
3416,Ren & Stimpy Pop! Vinyl Figure Ren [Chase],Fugitive Toys,$29.95,
3417,Ren & Stimpy Pop! Vinyl Figure Stimpy,Fugitive Toys,$9.95,
3418,Ren & Stimpy Pop! Vinyl Figure Stimpy [Chase],Fugitive Toys,$29.95,
3419,Resident Evil Pop! Vinyl Figure Jill Valentine,Fugitive Toys,$14.95,
3420,Resident Evil Pop! Vinyl Figure Leon S. Kennedy,Fugitive Toys,$9.95,
3421,Resident Evil Pop! Vinyl Figure Licker,Fugitive Toys,$9.95,
3422,Resident Evil Pop! Vinyl Figure Nemesis,Fugitive Toys,$9.95,
3423,Rick and Morty Pop! Vinyl Figure Beth with Wine Glass [301],Fugitive Toys,$9.95,
3424,Rick and Morty Pop! Vinyl Figure Birdperson,Fugitive Toys,$9.95,
3425,Rick and Morty Pop! Vinyl Figure Cornvelious Daniel w/ Sauce [334],Fugitive Toys,$9.95,
3426,Rick and Morty Pop! Vinyl Figure Jerry [302],Fugitive Toys,$9.95,
3427,Rick and Morty Pop! Vinyl Figure Lawyer Morty [303],Fugitive Toys,$9.95,
3428,Rick and Morty Pop! Vinyl Figure Morty,Fugitive Toys,$9.95,
3429,Rick and Morty Pop! Vinyl Figure Mr. Meeseeks,Fugitive Toys,$9.95,
3430,Rick and Morty Pop! Vinyl Figure Mr. Poopy Butthole,Fugitive Toys,$9.95,
3431,Rick and Morty Pop! Vinyl Figure Scary Terry [300],Fugitive Toys,$9.95,
3432,Rick and Morty Pop! Vinyl Figure Snowball,Fugitive Toys,$9.95,
3433,Rick and Morty Pop! Vinyl Figure Squanchy,Fugitive Toys,$9.95,
3434,Rick and Morty Pop! Vinyl Figure Summer [303],Fugitive Toys,$9.95,
3435,Rick and Morty Pop! Vinyl Figure Weaponized Morty,Fugitive Toys,$9.95,
3436,Rick and Morty Pop! Vinyl Figure Weaponized Rick,Fugitive Toys,$9.95,
3437,Rick and Morty Pop! Vinyl Figure Weaponized Rick (Chase),Fugitive Toys,$34.95,
3438,Riverdale Pop! Vinyl Figure Archie Andrews [586],Fugitive Toys,$9.95,
3439,Rocko's Modern Life Pop! Vinyl Figure Heffer (Chase) [321],Fugitive Toys,$34.95,
3440,Rocko's Modern Life Pop! Vinyl Figure Heffer [321],Fugitive Toys,$9.95,
3441,Rocko's Modern Life Pop! Vinyl Figure Rocko and Spunky (Chase) [320],Fugitive Toys,$34.95,
3442,Rocko's Modern Life Pop! Vinyl Figure Rocko and Spunky [320],Fugitive Toys,$9.95,
3443,Rocks Pop! Vinyl Figure Alice Cooper [68],Fugitive Toys,$9.95,
3444,Rocks Pop! Vinyl Figure Amy Winehouse,Fugitive Toys,$9.95,
3445,Rocks Pop! Vinyl Figure Axl Rose [Guns n Roses],Fugitive Toys,$9.95,
3446,Rocks Pop! Vinyl Figure Ed Sheeran [76],Fugitive Toys,$9.95,
3447,Rocks Pop! Vinyl Figure Elton John Greatest Hits,Fugitive Toys,$9.95,
3448,Rocks Pop! Vinyl Figure Elton John Red White and Blue,Fugitive Toys,$9.95,
3449,Rocks Pop! Vinyl Figure James Hetfield [Metallica],Fugitive Toys,$9.95,
3450,Rocks Pop! Vinyl Figure Jerry Garcia,Fugitive Toys,$9.95,
3451,Rocks Pop! Vinyl Figure Jimi Hendrix Woodstock,Fugitive Toys,$9.95,
3452,Rocks Pop! Vinyl Figure Joey Ramone,Fugitive Toys,$9.95,
3453,Rocks Pop! Vinyl Figure Justin Bieber,Fugitive Toys,$9.95,
3454,Rocks Pop! Vinyl Figure Kirk Hammett [Metallica],Fugitive Toys,$9.95,
3455,Rocks Pop! Vinyl Figure KISS - The Spaceman [05],Fugitive Toys,$119.95,
3456,Rocks Pop! Vinyl Figure Kurt Cobain in Striped Shirt,Fugitive Toys,$9.95,
3457,Rocks Pop! Vinyl Figure Lars Ulrich [Metallica],Fugitive Toys,$9.95,
3458,Rocks Pop! Vinyl Figure Mariah Carey [85],Fugitive Toys,$9.95,
3459,Rocks Pop! Vinyl Figure Mick Mars [Motley Crue] [72],Fugitive Toys,$9.95,
3460,Rocks Pop! Vinyl Figure Moametal (BABYMETAL),Fugitive Toys,$27.95,
3461,Rocks Pop! Vinyl Figure Nikki Sixx [Motley Crue] [70],Fugitive Toys,$9.95,
3462,Rocks Pop! Vinyl Figure Notorious B.I.G. with Jersey [78],Fugitive Toys,$9.95,
3463,Rocks Pop! Vinyl Figure Ozzy Osbourne [12],Fugitive Toys,$249.95,
3464,Rocks Pop! Vinyl Figure Prince [3rd Eye Girl] [81],Fugitive Toys,$9.95,
3465,Rocks Pop! Vinyl Figure Prince [Around the World in a Day] [80],Fugitive Toys,$9.95,
3466,Rocks Pop! Vinyl Figure Prince [Purple Rain] [79],Fugitive Toys,$9.95,
3467,Rocks Pop! Vinyl Figure Robert Trujillo [Metallica],Fugitive Toys,$9.95,
3468,Rocks Pop! Vinyl Figure Slash [Guns n Roses],Fugitive Toys,$9.95,
3469,Rocks Pop! Vinyl Figure Steve Jones [Sex Pistols] [32],Fugitive Toys,$99.95,
3470,Rocks Pop! Vinyl Figure Su-Metal (BABYMETAL),Fugitive Toys,$49.95,
3471,Rocks Pop! Vinyl Figure Tommy Lee [Motley Crue] [73],Fugitive Toys,$9.95,
3472,Rocks Pop! Vinyl Figure Vince Neil [Motley Crue] [71],Fugitive Toys,$9.95,
3473,Rocks Pop! Vinyl Figure Weird Al Yankovic [74],Fugitive Toys,$9.95,
3474,Rocks Pop! Vinyl Figure Yuimetal (BABYMETAL),Fugitive Toys,$27.95,
3475,Rocky & Bullwinkle Pop! Vinyl Figure Bullwinkle,Fugitive Toys,$19.95,
3476,Rocky & Bullwinkle Pop! Vinyl Figure Fearless Leader [451],Fugitive Toys,$9.95,
3477,Rocky & Bullwinkle Pop! Vinyl Figure Rocky,Fugitive Toys,$29.95,
3478,Rugrats Pop! Vinyl Figure Chuckie Finster,Fugitive Toys,$9.95,
3479,Rugrats Pop! Vinyl Figure Reptar,Fugitive Toys,$9.95,
3480,Rugrats Pop! Vinyl Figure Tommy Pickles,Fugitive Toys,$9.95,
3481,Runaways Pop! Vinyl Figure Alex Wilder [356],Fugitive Toys,$9.95,
3482,Runaways Pop! Vinyl Figure Chase Stein [360],Fugitive Toys,$9.95,
3483,Runaways Pop! Vinyl Figure Gert Yorkes [358],Fugitive Toys,$9.95,
3484,Runaways Pop! Vinyl Figure Molly Hernandez [359],Fugitive Toys,$9.95,
